khach_cmt,rating,shop_phan_hoi,shop,dvvc,sản phẩm
"quần xanh than chất đẹp dày dặn, quần hồng thì mỏng chất xấu hơn rất nhiều, form cũng xấu hơn màu nhìn cũng khá già.",4,,0,0,2
"săn sale thì ok chứ chất lượng 30k thì quá kém, vải cứng, không nên mặc cho các cháu vì sẽ bị xước da",4,,0,0,1
"chất vải ok nhưng hơi dài, mua 3 cái mà 1 cái size số 1 lại dài hơn 2 cái size số 2",4,,0,0,2
 đặt nhiều sản phẩm mà đúng 2 sản phẩm shop giao hàng chậm đóng gói cẩn thận,4,,1,0,1
áo giao 5 cái 5 loại trong đó hết 3 cái giặt dãn quá ,4,,0,0,1
"chất giày nhưng vải hơi thô,cứng không được mềm mại",4,,0,0,2
"quần hồng hơi mỏng ạ, màu hơi chói hơn trong ảnh",4,,0,0,2
"vải dày,có mùi khó chịu. mà săn sale 1k nên cũng ok",4,,0,0,1
"màu áo không đẹp như trong ảnh, bé mặc vừa, chất liệu phù hợp với giá tiền",4,,0,0,1
"màu hồng vải hơi mỏng, màu tím than thì ống bé chật cứng không co dãn mấy. lần đầu mua ưng ý hơn lần này",4,,0,0,1
quần hơi mỏng,4,,0,0,2
hành nhận nhanh. dầy dặn .nhưng đồ cho trẻ mà bị phai màu quá. phải giặt đi giặt lại nhiều lần .,4,,0,0,2
quần hơi mỏng phí ship cao hơn cả giá quần chắc mua lần này thôi,4,,0,0,2
"quần đẹp, giống với hình, nhưng chất vải hơi mỏng mặc trời hơi se lạnh thì vẫn ok ",4,,0,0,2
với giá tiền này thì ok rồi nhưng mình mua ở shop khác thì hàng ok hơn nhiều,4,,0,0,1
chất quần đẹp nhưng shop giao nhầm 1 cái không đúng mẫu mà lại còn ngắn,4,,0,0,2
" vải tạm ổn nhưng dài quá, bé 1 tuổi lấy size 1 mà dài cả gang á",4,,0,0,1
ok,4,,0,0,1
quần bị ngắn,4,,0,0,2
"quần hồng, xanh than chất ổn, ghi xám mỏng dính",4,,0,0,2
màu không giống ảnh.ngoài là màu hồng sen đậm,4,,0,0,2
đặt màu tím than nhưng shop giao màu xanh đen,4,,0,0,1
"quần hơi chật mông, co giãn không tốt lắm",4,,0,0,2
"hàng ok , mỗi tội chất thô cứng chứ không mềm",4,,0,0,1
màu không giống hình,4,,0,0,2
quần không đúng màu ,4,,0,0,2
tạm được. quần rẻ thì chất lượng được vậy thôi,4,,0,0,2
"vải không đẹp, nhưng vì giá rẻ nên cho 4 sao",4,,0,0,1
quần hơi thô cứng,4,,0,0,2
sản phẩm đẹp,4,,0,0,1
2 màu cùng size mà kích thước khác nhau,4,,0,0,1
"vải mỏng, phù hợp với giá tiền",4,,0,0,1
chất vải cứng,4,,0,0,1
quần vải hơi mỏng,4,,0,0,2
quần mỏng nhé,4,,0,0,2
sản phẩm ok,4,,0,0,1
khá mỏng,4,,0,0,2
hàng đẹp,4,,0,0,2
tạm được áo màu xám mỏng nhẹ hơn màu xanh màu xanh giặt bị ra màu,4,"cảm ơn bạn vì đã đánh giá sản phẩm này. bemo thật sự rất hạnh phúc vì bạn đã luôn đồng hành, tin yêu sản phẩm và dịch vụ của bemo tại shope trong suốt thời gian vừa qua. hi vọng shop sẽ tiếp tục được phục vụ bạn và bé trong thời gian tới. một lần nữa thay mặt đội ngũ nhân sự, xin cám ơn bạn rất nhiều ^~",0,0,1
"mình mua 2 áo nhưng áo vàng shop gửi bị bẩn 2 chấm to như hình chất liệu áo bình thường không rút mồ hôi, được cái shop chuẩn bị hàng nhanh ship nhanh nhưng áo bị bẩn không hài lòng mình trừ 1 sao nha",4,"cảm ơn bạn vì đã đánh giá sản phẩm này. bemo thật sự rất hạnh phúc vì bạn đã luôn đồng hành, tin yêu sản phẩm và dịch vụ của bemo tại shope trong suốt thời gian vừa qua. hi vọng shop sẽ tiếp tục được phục vụ bạn và bé trong thời gian tới. một lần nữa thay mặt đội ngũ nhân sự, xin cám ơn bạn rất nhiều ^~",0,0,1
"sản phẩm đẹp, vải ổn , mình đặt màu xám và vàng, nhưng shop lại giao nhầm vàng thành xanh lá.",4,"cảm ơn bạn vì đã đánh giá sản phẩm này. bemo thật sự rất hạnh phúc vì bạn đã luôn đồng hành, tin yêu sản phẩm và dịch vụ của bemo tại shope trong suốt thời gian vừa qua. hi vọng shop sẽ tiếp tục được phục vụ bạn và bé trong thời gian tới. một lần nữa thay mặt đội ngũ nhân sự, xin cám ơn bạn rất nhiều ^~",0,0,1
"áo bị ra màu nhiều, mọi người đặt lưu ý khi giặt nhé. hàng form nhỏ nên trừ hao khi mua nha.",4,"cảm ơn bạn vì đã đánh giá sản phẩm này. bemo thật sự rất hạnh phúc vì bạn đã luôn đồng hành, tin yêu sản phẩm và dịch vụ của bemo tại shope trong suốt thời gian vừa qua. hi vọng shop sẽ tiếp tục được phục vụ bạn và bé trong thời gian tới. một lần nữa thay mặt đội ngũ nhân sự, xin cám ơn bạn rất nhiều ^~",0,0,1
"giao hàng rất nhanh. áo hơi ngắn, chất hơi nóng.",4,"cảm ơn bạn vì đã đánh giá sản phẩm này. bemo thật sự rất hạnh phúc vì bạn đã luôn đồng hành, tin yêu sản phẩm và dịch vụ của bemo tại shope trong suốt thời gian vừa qua. hi vọng shop sẽ tiếp tục được phục vụ bạn và bé trong thời gian tới. một lần nữa thay mặt đội ngũ nhân sự, xin cám ơn bạn rất nhiều ^~",0,1,1
3 cái giao sai size 1 cái,4,,0,0,1
"bớt 1 sao cho shop, giao hàng lâu quá.",4,tulalove xin cảm ơn phản hồi của ba/mẹ. xin vui lòng nhắn tin cho tulalove biết điều gì làm mình chưa hài lòng để tulalove có thể tư vấn và hỗ trợ tốt hơn ạ. trân trọng cảm ơn!,0,1,2
"sản phẩm ok. đồ đẹp. có diều size hơi nhỏ, mặc chắc được vài lần là chật.giao hàng nhanh.",4,tulalove xin cảm ơn phản hồi của ba/mẹ. xin vui lòng nhắn tin cho tulalove biết điều gì làm mình chưa hài lòng để tulalove có thể tư vấn và hỗ trợ tốt hơn ạ. trân trọng cảm ơn!,0,1,1
shop giao đúng màu đã đặt tuy đặt chung một kiểu khác màu nhưng chất liệu khác nhau màu hồng với xanh dày dặn hơn trắng với đen,4,,1,0,2
"chất mát nhưng mỏng và dễ dão. đã mua áo này màu hồng, chất dày hơn nhưng nóng hơn. nói chung là được dáng áo đẹp còn chất thì không tốt lắm.",4,,0,0,1
"vải ok, giao hàng khá lâu,áo ba lỗ màu xanh lá cây rất dễ thương,vải mịn ,còn lại tất cả tạm ổn , cảm ơn shop",4,tulalove xin cảm ơn phản hồi của ba/mẹ. xin vui lòng nhắn tin cho tulalove biết điều gì làm mình chưa hài lòng để tulalove có thể tư vấn và hỗ trợ tốt hơn ạ. trân trọng cảm ơn!,0,1,1
chất mỏng nhưng cũng ok . vải màu đen không đẹp cho lắm chất áo cộc không phải coton,4,tulalove xin cảm ơn phản hồi của ba/mẹ. xin vui lòng nhắn tin cho tulalove biết điều gì làm mình chưa hài lòng để tulalove có thể tư vấn và hỗ trợ tốt hơn ạ. trân trọng cảm ơn!,0,0,2
hàng giống mô tả nhưng về 1 cái bị dính như này giặt không ra. trừ 1 sao vì sự không chu đáo của shop,4,,0,0,2
"quần đẹp , vải ok dáng áo đẹp , mà chất lượng vải quá tệ .áo cho con nít mà vải khô rát,không thấm hút mồ hôi .",4,tulalove xin cảm ơn phản hồi của ba/mẹ. xin vui lòng nhắn tin cho tulalove biết điều gì làm mình chưa hài lòng để tulalove có thể tư vấn và hỗ trợ tốt hơn ạ. trân trọng cảm ơn!,0,0,2
mấy lần trước thi giao đúng size .lần này gần tết chắc có size nào giao size ấy nên áo trắng giao sai size ,4,tulalove xin cảm ơn phản hồi của ba/mẹ. xin vui lòng nhắn tin cho tulalove biết điều gì làm mình chưa hài lòng để tulalove có thể tư vấn và hỗ trợ tốt hơn ạ. trân trọng cảm ơn!,0,0,1
"áo thì vải hơi mỏng nhưg cũng đẹp, còn quần bé hơi chật rồi.",4,tulalove xin cảm ơn phản hồi của ba/mẹ. xin vui lòng nhắn tin cho tulalove biết điều gì làm mình chưa hài lòng để tulalove có thể tư vấn và hỗ trợ tốt hơn ạ. trân trọng cảm ơn!,0,0,1
"áo hơi mỏng , chất lượng không được tốt , với giá như này thì cũng tạm được",4,,0,0,1
"vải quần thì ok, còn chất lượng áo hơi thất vọng",4,tulalove xin cảm ơn phản hồi của ba/mẹ. xin vui lòng nhắn tin cho tulalove biết điều gì làm mình chưa hài lòng để tulalove có thể tư vấn và hỗ trợ tốt hơn ạ. trân trọng cảm ơn!,0,0,2
vải khá mỏng,4,tulalove xin cảm ơn phản hồi của ba/mẹ. xin vui lòng nhắn tin cho tulalove biết điều gì làm mình chưa hài lòng để tulalove có thể tư vấn và hỗ trợ tốt hơn ạ. trân trọng cảm ơn!,0,0,2
 so với giá tiền thi áo mỏng. form không được đẹp,4,tulalove xin cảm ơn phản hồi của ba/mẹ. xin vui lòng nhắn tin cho tulalove biết điều gì làm mình chưa hài lòng để tulalove có thể tư vấn và hỗ trợ tốt hơn ạ. trân trọng cảm ơn!,0,0,1
áo rất mỏng,4,tulalove xin cảm ơn phản hồi của ba/mẹ. xin vui lòng nhắn tin cho tulalove biết điều gì làm mình chưa hài lòng để tulalove có thể tư vấn và hỗ trợ tốt hơn ạ. trân trọng cảm ơn!,0,0,1
vải hơi mỏng,4,,0,0,1
"chất lượng cũng tạm,",4,,0,0,2
cũng dễ thương có điều hơi mát ,4,"bshine chân thành cảm ơn bạn đã tin tường chọn lựa sản phẩm của shop, mọi ý kiến đóng góp của bạn sẽ góp phần to lớn tạo nên động lục phát triển bền vững, đừng ngần ngại nhắn tin cho shop khi có thắc mắc hoặc những ý kiến cần giải đáp nhé. shop hy vọng sẽ được tiếp tục phục vụ bạn trong thời gian tới ạ :)",0,0,1
giao hàng nhanh.,4,"bshine chân thành cảm ơn bạn đã tin tường chọn lựa sản phẩm của shop, mọi ý kiến đóng góp của bạn sẽ góp phần to lớn tạo nên động lục phát triển bền vững, đừng ngần ngại nhắn tin cho shop khi có thắc mắc hoặc những ý kiến cần giải đáp nhé. shop hy vọng sẽ được tiếp tục phục vụ bạn trong thời gian tới ạ :)",0,1,0
quần lót size s 11-14kg mà nhỏ xíu luôn bé mình không mặc được đầm thì đẹp.,4,"bshine cảm ơn bạn đã đồng hành và ủng hộ sản phẩm của shop trong thời gian qua, nếu sản phẩm có vấn đề gì đừng ngần ngaị nhắn ngay cho shop để được hỗ trợ nhanh nhất bạn nhé, shop luôn giải đáp thắc mắc và lắng nghe đóng góp ý kiến của khách hàng. bshine rất vui và hy vọng sẽ phục vụ bạn tốt hơn trong tương lai ạ :)",0,0,4
"được bộ ưng ý thì bị lỗi, lủng ngay lỗ sau lưng, tạm cho 4 * vậy",4,,0,0,1
mình đặt 2 quần size khác nhau cho 2 bé. nhưng shop giao cùng size. chất ổn.,4,tulalove xin cảm ơn phản hồi của ba/mẹ. xin vui lòng nhắn tin cho tulalove biết điều gì làm mình chưa hài lòng để tulalove có thể tư vấn và hỗ trợ tốt hơn ạ. trân trọng cảm ơn!,0,0,2
"chất vải quần màu hồng có lẽ là mỏng nhất so với 5 màu. chưa ưng lắm nhưng thôi, để mặc khi thời tiết ấm lên.",4,tulalove xin cảm ơn phản hồi của ba/mẹ. xin vui lòng nhắn tin cho tulalove biết điều gì làm mình chưa hài lòng để tulalove có thể tư vấn và hỗ trợ tốt hơn ạ. trân trọng cảm ơn!,0,0,2
"quần trắng tinh còn áo ngả màu hơn . Nhắn tin shop mấy lần mà shop không trả lời . chất hợp giá tiền , ship nhanh",4,tulalove xin cảm ơn phản hồi của ba/mẹ. xin vui lòng nhắn tin cho tulalove biết điều gì làm mình chưa hài lòng để tulalove có thể tư vấn và hỗ trợ tốt hơn ạ. trân trọng cảm ơn!,0,0,2
"mẫu mã và màu sắc y hình, đẹp, sẽ tiếp tục ủng hộ shop. áo thì vừa . còn quần thì bị chật. mẹ nào chọn size quần thì lên 1 size nhé",4,tulalove xin cảm ơn phản hồi của ba/mẹ. xin vui lòng nhắn tin cho tulalove biết điều gì làm mình chưa hài lòng để tulalove có thể tư vấn và hỗ trợ tốt hơn ạ. trân trọng cảm ơn!,0,0,1
"hàng chất ok. màu đẹp nhưng shop giao sai màu 1 cái áo của mình nên trừ 1 sao. bé mình 4,5 tuổi 18kg cao 107cm chọn size 5 mặc thoải mái, vừa đẹp",4,,1,0,1
"vải mỏng hơn mình nghĩ nhiều, thích hợp thời tiết hơi hơi lạnh thôi. giao hàng nhanh",4,,0,1,1
"giao hàng nhanh, lần thứ 2 mua hàng của shop, chất lượng phù hợp giá sản phẩm. sẽ ủng hộ shop những lần sau.",4,tulalove xin cảm ơn phản hồi của ba/mẹ. xin vui lòng nhắn tin cho tulalove biết điều gì làm mình chưa hài lòng để tulalove có thể tư vấn và hỗ trợ tốt hơn ạ. trân trọng cảm ơn!,0,1,1
quần cũng tạm. màu hồng bên ngoài tối hơn hình shop đăng,4,tulalove xin cảm ơn phản hồi của ba/mẹ. xin vui lòng nhắn tin cho tulalove biết điều gì làm mình chưa hài lòng để tulalove có thể tư vấn và hỗ trợ tốt hơn ạ. trân trọng cảm ơn!,0,0,2
"chất mỏng hơn mình nghĩ, nói chung tạm được. giao hàng tạm ổn",4,tulalove xin cảm ơn phản hồi của ba/mẹ. xin vui lòng nhắn tin cho tulalove biết điều gì làm mình chưa hài lòng để tulalove có thể tư vấn và hỗ trợ tốt hơn ạ. trân trọng cảm ơn!,0,1,2
chất vải hơi mỏng nhưng cũng oke với giá tiền này.,4,tulalove xin cảm ơn phản hồi của ba/mẹ. xin vui lòng nhắn tin cho tulalove biết điều gì làm mình chưa hài lòng để tulalove có thể tư vấn và hỗ trợ tốt hơn ạ. trân trọng cảm ơn!,0,0,1
"theo màu thì vải khác nhau, màu trắng mịn mềm, vải đen thi hơi cứng và mỏng",4,tulalove xin cảm ơn phản hồi của ba/mẹ. xin vui lòng nhắn tin cho tulalove biết điều gì làm mình chưa hài lòng để tulalove có thể tư vấn và hỗ trợ tốt hơn ạ. trân trọng cảm ơn!,0,0,2
mặc được 1 thời gian ngắn nên mình quay lại sửa đánh giá shop phục vụ tốt nhưng chất lượng quần thì chán mặc có dúm hết lên và bị cộc hơn khi giặt tiền nào của nấy thôi ạ,4,tula xin chân thành cảm ơn sự ủng hộ của ba mẹ. hi vọng sẽ tiếp tục nhận được sự ủng hộ của ba mẹ. trân trọng!,0,0,2
tạm được. vải hơi mỏng,4,tulalove xin cảm ơn phản hồi của ba/mẹ. xin vui lòng nhắn tin cho tulalove biết điều gì làm mình chưa hài lòng để tulalove có thể tư vấn và hỗ trợ tốt hơn ạ. trân trọng cảm ơn!,0,0,2
giao hàng lâu. mong shop cải thiện,4,tulalove xin cảm ơn phản hồi của ba/mẹ. xin vui lòng nhắn tin cho tulalove biết điều gì làm mình chưa hài lòng để tulalove có thể tư vấn và hỗ trợ tốt hơn ạ. trân trọng cảm ơn!,0,1,0
ok,4,tulalove xin cảm ơn phản hồi của ba/mẹ. xin vui lòng nhắn tin cho tulalove biết điều gì làm mình chưa hài lòng để tulalove có thể tư vấn và hỗ trợ tốt hơn ạ. trân trọng cảm ơn!,0,0,1
"quần hơi mỏng . giao đúng size. thanks shop.,.",4,tulalove xin cảm ơn phản hồi của ba/mẹ. xin vui lòng nhắn tin cho tulalove biết điều gì làm mình chưa hài lòng để tulalove có thể tư vấn và hỗ trợ tốt hơn ạ. trân trọng cảm ơn!,0,0,2
quần ok nhưng quần trắng lại bị mốc vài chỗ nên chỉ cho 4 sao thôi nhé. Kiểm tra hàng kĩ trước khi ship chứ,4,,0,0,2
"đã nhận được hàng và cảm thấy hơi thất vọng, chất và dáng quần không như mong đợi.",4,,0,0,2
"quần đùi màu đen vải hơi cứng, không mịn như màu hồng và xám mình mua lần trước",4,tulalove xin cảm ơn phản hồi của ba/mẹ. xin vui lòng nhắn tin cho tulalove biết điều gì làm mình chưa hài lòng để tulalove có thể tư vấn và hỗ trợ tốt hơn ạ. trân trọng cảm ơn!,0,0,2
"chất lượng quần đẹp, nhưng lại giao sai mất màu quần nên cho shop 4 sao ạ",4,,0,0,2
"quần giá hơi đắt so với chất lượng, quần không có tem nhãn mác gì ",4,,0,0,2
"quần coton thun, sợ nóng cho bé nếu đi chơi ở ngoài. co dãn tốt.",4,,0,0,2
"sản phẩm rất đẹp, giao hàng đúng tuy nhiên có 1 vài cái bị sổ chỉ ạ",4,,0,1,1
tạm được,4,tulalove xin cảm ơn phản hồi của ba/mẹ. xin vui lòng nhắn tin cho tulalove biết điều gì làm mình chưa hài lòng để tulalove có thể tư vấn và hỗ trợ tốt hơn ạ. trân trọng cảm ơn!,0,0,1
mức giá rẻ chất khá ổn,4,tulalove xin cảm ơn phản hồi của ba/mẹ. xin vui lòng nhắn tin cho tulalove biết điều gì làm mình chưa hài lòng để tulalove có thể tư vấn và hỗ trợ tốt hơn ạ. trân trọng cảm ơn!,0,0,2
"quần vải giống hình, ok",4,,0,0,2
"mình vừa nhận hàng,chất vải quá ok. thanks shop!",4,,0,0,1
"quần hơi mỏng . giao đúng size. thanks shop.,.",4,tulalove xin cảm ơn phản hồi của ba/mẹ. xin vui lòng nhắn tin cho tulalove biết điều gì làm mình chưa hài lòng để tulalove có thể tư vấn và hỗ trợ tốt hơn ạ. trân trọng cảm ơn!,0,0,2
quần ok nhưng quần trắng lại bị mốc vài chỗ nên chỉ cho 4 sao thôi nhé. Kiểm tra hàng kĩ trước khi ship chứ,4,,0,0,2
"đã nhận được hàng và cảm thấy hơi thất vọng, chất và dáng quần không như mong đợi.",4,,0,0,1
"quần đùi màu đen vải hơi cứng, không mịn như màu hồng và xám mình mua lần trước",4,tulalove xin cảm ơn phản hồi của ba/mẹ. xin vui lòng nhắn tin cho tulalove biết điều gì làm mình chưa hài lòng để tulalove có thể tư vấn và hỗ trợ tốt hơn ạ. trân trọng cảm ơn!,0,0,2
"chất lượng quần đẹp, nhưng lại giao sai mất màu quần nên cho shop 4 sao ạ",4,,0,0,2
"quần giá hơi đắt so với chất lượng, quần không có tem nhãn mác gì ",4,,0,0,2
"quần coton thun, sợ nóng cho bé nếu đi chơi ở ngoài. co dãn tốt.",4,,0,0,2
"sản phẩm rất đẹp, giao hàng đúng tuy nhiên có 1 vài cái bị sổ chỉ ạ",4,,0,1,2
tạm được,4,tulalove xin cảm ơn phản hồi của ba/mẹ. xin vui lòng nhắn tin cho tulalove biết điều gì làm mình chưa hài lòng để tulalove có thể tư vấn và hỗ trợ tốt hơn ạ. trân trọng cảm ơn!,0,0,1
mức giá rẻ chất khá ổn,4,tulalove xin cảm ơn phản hồi của ba/mẹ. xin vui lòng nhắn tin cho tulalove biết điều gì làm mình chưa hài lòng để tulalove có thể tư vấn và hỗ trợ tốt hơn ạ. trân trọng cảm ơn!,0,0,1
"quần vải giống hình, có dãn ok",4,,0,0,2
"minh vừa nhận hàng,chất vải quá ok. thanks shop!",4,,0,0,1
"áo vải thun đẹp, nhưng phần cổ không giống hình, với mức giá này thì cũng chấp nhận được",4,shop cám ơn chị đã tin tưởng lựa chọn sản phẩm bên shop . shop sẽ cố gắng đem lại những sản phẩm tốt nhất giá cả hợp lý nhất mang đến cho chị . shop rất mong được phục vụ chị trong những lần mua sắm tiếp theo.chúc chị một ngày vui vẻ ạ,0,0,1
sản phẩm tuyệt vời chất lượng tốt ship nhanh hành giá rẻ sẽ ủng hộ tuy nhiên áo hơi dài và màu không tươi như hình,4,cảm ơn chị đã tin tưởng. shop sẽ ngày càng nâng cao chất lượng và dịch vụ để phục vụ chị tốt hơn. mong chị tiếp tục ủng hộ shop trong thời gian tới chị nha,0,1,1
hàng ok,4,cảm ơn chị đã tin tưởng. shop sẽ ngày càng nâng cao chất lượng và dịch vụ để phục vụ chị tốt hơn. mong chị tiếp tục ủng hộ shop trong thời gian tới chị nha,0,0,1
"shop giao hàng hơi lâu, chất áo dày vừa phải nhưng vải khá thô, sờ vào không được mềm tay cho lắm, áo thì chỉ có 1 lớp thôi nên mặc sẽ không được ấm",4,cảm ơn chị đã tin tưởng. shop sẽ ngày càng nâng cao chất lượng và dịch vụ để phục vụ chị tốt hơn. mong chị tiếp tục ủng hộ shop trong thời gian tới chị nha,0,1,2
sản phẩm chất lượng khá tốt. vải không quá dày. có điều giao hàng lâu quá. tuy nhiên shop phản hồi thắc mắc khách hàng nhanh chóng nên trừ 1 sao vì giao lâu thôi,4,cảm ơn chị đã tin tưởng. shop sẽ ngày càng nâng cao chất lượng và dịch vụ để phục vụ chị tốt hơn. mong chị tiếp tục ủng hộ shop trong thời gian tới chị nha,0,1,1
áo vải dày mà nhỏ quá. form 19-23kg hơi nhỏ.mọi người có đặt thì đặt lớn hơn size là ok,4,cảm ơn mom đã tin tưởng ủng hộ. shop sẽ ngày càng nâng cao chất lượng và dịch vụ để phục vụ được tốt hơn. chúc chị 1 ngày tốt lành,0,0,1
hàng khá ok. sẽ ủng hộ lần sau.,4,cảm ơn chị đã tin tưởng. shop sẽ ngày càng nâng cao chất lượng và dịch vụ để phục vụ chị tốt hơn. mong chị tiếp tục ủng hộ shop trong thời gian tới chị nha,0,0,1
"cảm ơn shop, mình đã nhận được hàng, hàng đóng gói cẩn thận, giao hàng nhanh",4,cảm ơn chị đã tin tưởng. shop sẽ ngày càng nâng cao chất lượng và dịch vụ để phục vụ chị tốt hơn. mong chị tiếp tục ủng hộ shop trong thời gian tới chị nha,1,1,0
áo mua lần này chất lượng kém hơn mình mua đợt trước shop ạ,4,cảm ơn chị đã tin tưởng. shop sẽ ngày càng nâng cao chất lượng và dịch vụ để phục vụ chị tốt hơn. mong chị tiếp tục ủng hộ shop trong thời gian tới chị nha,0,0,1
"màu thực tế nhạt hơn nhiều, không tươi như ảnh. đơn vị vận chuyển shopee rất chậm.",4,cảm ơn chị đã tin tưởng. shop sẽ ngày càng nâng cao chất lượng và dịch vụ để phục vụ chị tốt hơn. mong chị tiếp tục ủng hộ shop trong thời gian tới chị nha,0,1,1
"áo mình đặt đỏ tươi mà ship về màu đỏ đô nên chưa hài lòng lắm, nhưng vẫn rất dễ thương ",4,cảm ơn chị đã tin tưởng. shop sẽ ngày càng nâng cao chất lượng và dịch vụ để phục vụ chị tốt hơn. mong chị tiếp tục ủng hộ shop trong thời gian tới chị nha,0,0,1
như này có phải áo nỉ không nhưng cũng đẹp áo có hai lớp nên dày. nói chung giống hình quảng cáo nhưng không đẹp như hình quảng cáo tưởng tượng. xin cảm ơn,4,cảm ơn chị đã tin tưởng. shop sẽ ngày càng nâng cao chất lượng và dịch vụ để phục vụ chị tốt hơn. mong chị tiếp tục ủng hộ shop trong thời gian tới chị nha,0,0,1
hàng như hình có điều giao lâu quá chờ dài cổ luôn ấy shop ạ. ,4,cảm ơn mom đã tin tưởng ủng hộ. nhím store sẽ ngày càng nâng cao chất lượng và dịch vụ để phục vụ được tốt hơn. chúc chị 1 ngày tốt lành!,0,1,2
"màu không được đỏ tươi như mẫu. chắc do lúc chụp lên ánh sáng ảnh làm màu sắc áo khác hẳn ở ngoài. Được cái chát nỉ, ấm.",4,cảm ơn chị đã tin tưởng. shop sẽ ngày càng nâng cao chất lượng và dịch vụ để phục vụ chị tốt hơn. mong chị tiếp tục ủng hộ shop trong thời gian tới chị nha,0,0,2
"size áo nhỏ , con mình 23 kg cứ nghĩ áo rộng nhưng vừa zin,",4,cảm ơn chị đã tin tưởng. shop sẽ ngày càng nâng cao chất lượng và dịch vụ để phục vụ chị tốt hơn. mong chị tiếp tục ủng hộ shop trong thời gian tới chị nha,0,0,1
chất lượng bình thường. Không đẹp lắm.được cái shop làm ăn cũng uy tín.giao sai size cho mình nhưng cũng đã đổi lại size khách đặt.nhưng dù sao cũng không thích lắm vì tự nhiên mất thời gian và tiền cho khoản đi bưu điện gửi đồ.,4,cảm ơn mom đã tin tưởng ủng hộ. nhím store sẽ ngày càng nâng cao chất lượng và dịch vụ để phục vụ được tốt hơn. chúc chị 1 ngày tốt lành!,0,0,1
hàng mặc bị xổ lông,4,cảm ơn mom đã tin tưởng ủng hộ. nhím store sẽ ngày càng nâng cao chất lượng và dịch vụ để phục vụ được tốt hơn. chúc chị 1 ngày tốt lành!,0,0,2
áo vừa và đẹp nhưng hàng về thì áo bị nhăn đùng,4,cảm ơn chị đã tin tưởng. shop sẽ ngày càng nâng cao chất lượng và dịch vụ để phục vụ chị tốt hơn. mong chị tiếp tục ủng hộ shop trong thời gian tới chị nha,0,0,1
chất cũng ổn,4,,0,0,1
