khach_cmt,rating,shop_phan_hoi,,,,,,,,,,,,,,,,,,,,,,,
"lừa đảo. mua quần âu, giao quần jeans, nhắn thì kêu mình tự gửi về shop rồi tự trả phí ship",1,"chào bạn, nhận đánh giá của bạn thì quanaunamọi ngườipv có liên hệ bạn ngay để hỗ trợ, nhưng chưa thấy bạn phản hồi nếu sản phẩm bên mình có điều gì khiến bạn không hài lòng thì quanaunamọi ngườipv thành thật xin lỗi. và mong bạn phản hồi để quanaunamọi ngườipv giải quyết vấn đề bạn đang mắc phải ạ. cảm ơn và 1 lần nữa xin lỗi bạn ạ. chúc bạn 1 ngày vui vẻ ❤",,,,,,,,,,,,,,,,,,,,,,,
khuyên anh em nên đặt thừa 3 size khi shop tư vấn. mà không lên mua anh em à vì chất lượng quá chán,1,"chào bạn, nhận đánh giá của bạn thì quanaunamọi ngườipv có liên hệ bạn ngay để hỗ trợ, nhưng chưa thấy bạn phản hồi nếu sản phẩm bên mình có điều gì khiến bạn không hài lòng thì quanaunamọi ngườipv thành thật xin lỗi. và mong bạn phản hồi để quanaunamọi ngườipv giải quyết vấn đề bạn đang mắc phải ạ. cảm ơn và 1 lần nữa xin lỗi bạn ạ. chúc bạn 1 ngày vui vẻ ❤",,,,,,,,,,,,,,,,,,,,,,,
"sản phẩm mặc không lên form giống hình giặt máy thì bị xù hết vải , chỉ may dễ đứt mặc được vài bữa ,bạn nào hay vận động sẽ rách nhiều ở 2 bên túi quần . shop rep tin nhắn chậm",1,"quanaunamọi ngườipv thành thật cảm ơn bạn vì đã dành thời gian để đánh giá cho chúng mình nhé ^. đánh giá này của bạn đã tiếp thêm động lực để tập thể nhà quanaunamọi ngườipv phấn đấu hoàn thiện hơn từng ngày nhằm mang đến những dịch vụ và trải nghiệm mua sắm tuyệt vời nhất cho quý khách hàng như bạn đó ạ ❤. rất mong quanaunamọi ngườipv sẽ luôn là lựa chọn để bạn dành thời gian ghé thăm trong thời gian tới, nếu ưng ý sản phẩm nào hãy để quanaunamọi ngườipv được tư vấn cho bạn ngay nha. chân thành cảm ơn, chúc bạn luôn vui vẻ và gặp nhiều may mắn ạ ^",,,,,,,,,,,,,,,,,,,,,,,
"bảng size không chuẩn , ib đổi thì cách rep không muốn đổi , quần mỏng",1,"chào bạn, nhận đánh giá của bạn thì quanaunamọi ngườipv có liên hệ bạn ngay để hỗ trợ, nhưng chưa thấy bạn phản hồi nếu sản phẩm bên mình có điều gì khiến bạn không hài lòng thì quanaunamọi ngườipv thành thật xin lỗi. và mong bạn phản hồi để quanaunamọi ngườipv giải quyết vấn đề bạn đang mắc phải ạ. cảm ơn và 1 lần nữa xin lỗi bạn ạ. chúc bạn 1 ngày vui vẻ ❤",,,,,,,,,,,,,,,,,,,,,,,
"không giống như hình, chẳng khác  gì cái quần 8 chục ở chợ, tốn tiền sửa mới mặc được",1,"chào bạn, nhận đánh giá của bạn thì quanaunamọi ngườipv có liên hệ bạn ngay để hỗ trợ, nhưng chưa thấy bạn phản hồi nếu sản phẩm bên mình có điều gì khiến bạn không hài lòng thì quanaunamọi ngườipv thành thật xin lỗi. và mong bạn phản hồi để quanaunamọi ngườipv giải quyết vấn đề bạn đang mắc phải ạ. cảm ơn và 1 lần nữa xin lỗi bạn ạ. chúc bạn 1 ngày vui vẻ ❤",,,,,,,,,,,,,,,,,,,,,,,
"quần chất không ổn , đợt trước mua đẹp bao nhiêu đợt này thất vọng bấy nhiêu , haiz",1,"chào bạn, nhận đánh giá của bạn thì quanaunamọi ngườipv có liên hệ bạn ngay để hỗ trợ, nhưng chưa thấy bạn phản hồi nếu sản phẩm bên mình có điều gì khiến bạn không hài lòng thì quanaunamọi ngườipv thành thật xin lỗi. và mong bạn phản hồi để quanaunamọi ngườipv giải quyết vấn đề bạn đang mắc phải ạ. cảm ơn và 1 lần nữa xin lỗi bạn ạ. chúc bạn 1 ngày vui vẻ ❤",,,,,,,,,,,,,,,,,,,,,,,
chỉ thừa rất nhiều đường may cẩu thả không đều đặt 2 sản phẩm là đều là size 29 nhưng chiếc thứ 2 rộng hơn 8 phân nói chung shop làm ăn quá tồi,1,"chào bạn, nhận đánh giá của bạn thì quanaunamọi ngườipv có liên hệ bạn ngay để hỗ trợ, nhưng chưa thấy bạn phản hồi nếu sản phẩm bên mình có điều gì khiến bạn không hài lòng thì quanaunamọi ngườipv thành thật xin lỗi. và mong bạn phản hồi để quanaunamọi ngườipv giải quyết vấn đề bạn đang mắc phải ạ. cảm ơn và 1 lần nữa xin lỗi bạn ạ. chúc bạn 1 ngày vui vẻ ❤",,,,,,,,,,,,,,,,,,,,,,,
size số ghi 1 đằng thì form lại 1 nẻo ship đến không vừa đổi xong còn bắt mình chịu cả 2 lần ship cả đi lẫn về mà trong khi mình hỏi đi hỏi là là không mất thêm phí gì nữa đúng không thì bảo không mất thêm phí mà cuối cùng mang đến vẫn mất đúng là lừa đảo,1,"chào bạn, nhận đánh giá của bạn thì quanaunamọi ngườipv có liên hệ bạn ngay để hỗ trợ, nhưng chưa thấy bạn phản hồi nếu sản phẩm bên mình có điều gì khiến bạn không hài lòng thì quanaunamọi ngườipv thành thật xin lỗi. và mong bạn phản hồi để quanaunamọi ngườipv giải quyết vấn đề bạn đang mắc phải ạ. cảm ơn và 1 lần nữa xin lỗi bạn ạ. chúc bạn 1 ngày vui vẻ ❤",,,,,,,,,,,,,,,,,,,,,,,
"size 29 nó nhỏ mà chật ních luôn, haiz, làm biếng đổi trả, chắc để cho em hay cháu nó bận. khuyên mọi người mua nhích thêm 1-2 size. ",1,"chào bạn, nhận đánh giá của bạn thì quanaunamọi ngườipv có liên hệ bạn ngay để hỗ trợ, nhưng chưa thấy bạn phản hồi nếu sản phẩm bên mình có điều gì khiến bạn không hài lòng thì quanaunamọi ngườipv thành thật xin lỗi. và mong bạn phản hồi để quanaunamọi ngườipv giải quyết vấn đề bạn đang mắc phải ạ. cảm ơn và 1 lần nữa xin lỗi bạn ạ. chúc bạn 1 ngày vui vẻ ❤",,,,,,,,,,,,,,,,,,,,,,,
"sản phẩm như hàng ở chợ, không có gì nổi bật. chất liệu thì bình thường và có khi còn kém. mới mua về thì chưa thể nào đánh giá cao hơn được phải dùng một thời gian mới biết được",1,"chào bạn, nhận đánh giá của bạn thì quanaunamọi ngườipv có liên hệ bạn ngay để hỗ trợ, nhưng chưa thấy bạn phản hồi nếu sản phẩm bên mình có điều gì khiến bạn không hài lòng thì quanaunamọi ngườipv thành thật xin lỗi. và mong bạn phản hồi để quanaunamọi ngườipv giải quyết vấn đề bạn đang mắc phải ạ. cảm ơn và 1 lần nữa xin lỗi bạn ạ. chúc bạn 1 ngày vui vẻ ❤",,,,,,,,,,,,,,,,,,,,,,,
mua về đã rách chán,1,"chào bạn, nhận đánh giá của bạn thì quanaunamọi ngườipv có liên hệ bạn ngay để hỗ trợ, nhưng chưa thấy bạn phản hồi nếu sản phẩm bên mình có điều gì khiến bạn không hài lòng thì quanaunamọi ngườipv thành thật xin lỗi. và mong bạn phản hồi để quanaunamọi ngườipv giải quyết vấn đề bạn đang mắc phải ạ. cảm ơn và 1 lần nữa xin lỗi bạn ạ. chúc bạn 1 ngày vui vẻ ❤",,,,,,,,,,,,,,,,,,,,,,,
quá là tệ cái quần vừa nhận xong háo hức đi thử thì ôi mặc lên thò tay vào túi quần cái túi rách từ bao giờ rồichả biết quần thì chỉ rêu linh tinh má tức chứ.,1,"chào bạn, nhận đánh giá của bạn thì quanaunamọi ngườipv có liên hệ bạn ngay để hỗ trợ, nhưng chưa thấy bạn phản hồi nếu sản phẩm bên mình có điều gì khiến bạn không hài lòng thì quanaunamọi ngườipv thành thật xin lỗi. và mong bạn phản hồi để quanaunamọi ngườipv giải quyết vấn đề bạn đang mắc phải ạ. cảm ơn và 1 lần nữa xin lỗi bạn ạ. chúc bạn 1 ngày vui vẻ ❤",,,,,,,,,,,,,,,,,,,,,,,
quần quá dở . side không chuẩn . anh mình mặc size 28 mà đặt size 28 bụng thì vừa . mà quần không xỏ ống vào nổi . bó hơn con gái ,1,"chào bạn, nhận đánh giá của bạn thì quanaunamọi ngườipv có liên hệ bạn ngay để hỗ trợ, nhưng chưa thấy bạn phản hồi nếu sản phẩm bên mình có điều gì khiến bạn không hài lòng thì quanaunamọi ngườipv thành thật xin lỗi. và mong bạn phản hồi để quanaunamọi ngườipv giải quyết vấn đề bạn đang mắc phải ạ. cảm ơn và 1 lần nữa xin lỗi bạn ạ. chúc bạn 1 ngày vui vẻ ❤",,,,,,,,,,,,,,,,,,,,,,,
như cái rẻ lau rộng già vải mỏng chất xấu không như đã tư vấn đề nghị mọi người không nên tin và mua về. tốn tiền mà không mặc được,1,,,,,,,,,,,,,,,,,,,,,,,,
shop như này. tôi hỏi size. tôi nói cân nặng và cao thì shop cứ lơ đi. nói đến chuyện đặt hàng thì trả lời rất nhiệt tình. giờ mua về không vừa.,1,"chào bạn, nhận đánh giá của bạn thì quanaunamọi ngườipv có liên hệ bạn ngay để hỗ trợ, nhưng chưa thấy bạn phản hồi nếu sản phẩm bên mình có điều gì khiến bạn không hài lòng thì quanaunamọi ngườipv thành thật xin lỗi. và mong bạn phản hồi để quanaunamọi ngườipv giải quyết vấn đề bạn đang mắc phải ạ. cảm ơn và 1 lần nữa xin lỗi bạn ạ. chúc bạn 1 ngày vui vẻ ❤",,,,,,,,,,,,,,,,,,,,,,,
quần chất mỏng rất xấu. ngắn trên mắt cá luôn. lần đầu mua nhưng không hài lòng,1,,,,,,,,,,,,,,,,,,,,,,,,
quần thì ống to ống nhỏ ống ngắn ống dài mình thấy hơn 20k lượt mua mà hơi thất vọng,1,"chào bạn, nhận đánh giá của bạn thì quanaunamọi ngườipv có liên hệ bạn ngay để hỗ trợ, nhưng chưa thấy bạn phản hồi nếu sản phẩm bên mình có điều gì khiến bạn không hài lòng thì quanaunamọi ngườipv thành thật xin lỗi. và mong bạn phản hồi để quanaunamọi ngườipv giải quyết vấn đề bạn đang mắc phải ạ. cảm ơn và 1 lần nữa xin lỗi bạn ạ. chúc bạn 1 ngày vui vẻ ❤",,,,,,,,,,,,,,,,,,,,,,,
mình đặt ghi tối mà shop giao màu xanh than. nhìn màu như quần của phụ nữ vậy.,1,"chào bạn, nhận đánh giá của bạn thì quanaunamọi ngườipv có liên hệ bạn ngay để hỗ trợ, nhưng chưa thấy bạn phản hồi nếu sản phẩm bên mình có điều gì khiến bạn không hài lòng thì quanaunamọi ngườipv thành thật xin lỗi. và mong bạn phản hồi để quanaunamọi ngườipv giải quyết vấn đề bạn đang mắc phải ạ. cảm ơn và 1 lần nữa xin lỗi bạn ạ. chúc bạn 1 ngày vui vẻ ❤",,,,,,,,,,,,,,,,,,,,,,,
quần tây thường thì ghi tây thường mắc gì ghi quần tây âu .đề vậy không phải hàng nhái hả . bảo trả hàng để đổi quần mới tôi có thể thêm tiền vô mua cái khác . làm ăn kiểu đó uy tín ai mua . tiền trăm chứ rẻ ha . mua đồ qua mạng trước tiên phải có uy tín cho người mua chứ . quần mỏng lắm luôn ,1,,,,,,,,,,,,,,,,,,,,,,,,
shop làm ăn không uy tín mình mùa 4 cái size 34 giao 4 cái 2 cái size 34 còn 2 cai size tam 31 vậy mà để size 34,1,"chào bạn,bên mình gửi bạn đúng 4 cái size 34 ,bên bạn ấn trả hàng ,bên mình thấy bạn chưa hài lòng đã chấp nhận trả hàng giúp bạn và có thêm nhu cầu đổi hàng giúp bạn ,bạn lại đánh giá shop thế ,mong bạn sửa giúp shop shop cảm ơn ạ",,,,,,,,,,,,,,,,,,,,,,,
làm ăn như lừa đảo rep thì lâu cho số điện để gọi đổi size mà gọi mãi toàn thuê bao mà shop lớn không đầu tư nổi nhân viên à tao quá sai lầm khi mua ở shop này anh em đừng mắc phải,1,"chào bạn, nhận đánh giá của bạn thì quanaunamọi ngườipv có liên hệ bạn ngay để hỗ trợ, nhưng chưa thấy bạn phản hồi nếu sản phẩm bên mình có điều gì khiến bạn không hài lòng thì quanaunamọi ngườipv thành thật xin lỗi. và mong bạn phản hồi để quanaunamọi ngườipv giải quyết vấn đề bạn đang mắc phải ạ. cảm ơn và 1 lần nữa xin lỗi bạn ạ. chúc bạn 1 ngày vui vẻ ❤",,,,,,,,,,,,,,,,,,,,,,,
đặt 2 màu giao 1 màu. cùng size mà cái to cái nhỏ,1,"shop rất xin lỗi mình đã có trải nghiệm không tốt trong khoảng thời gian sớm nhất tối đa 1-2 h nữa bên em sẽ liên hệ trực tiếp với mình qua điện thoại nhé.mọi vấn đề bên e đều khắc phục giải quyết giúp anh chị, chúc quý khách luôn có những trải nghiệm mua sắm vui vẻ trên shope!",,,,,,,,,,,,,,,,,,,,,,,
sản phẩm rất kém chất lượng vải xấu sù sì nhăn nheo rách túi hỏng  chân rộng. tóm lại hàng rất dởm ai có nhu cầu mua thì hãy cân nhắc ạ . không nên mua gì của shop này nha,1,"chào bạn, nhận đánh giá của bạn thì quanaunamọi ngườipv có liên hệ bạn ngay để hỗ trợ, nhưng chưa thấy bạn phản hồi nếu sản phẩm bên mình có điều gì khiến bạn không hài lòng thì quanaunamọi ngườipv thành thật xin lỗi. và mong bạn phản hồi để quanaunamọi ngườipv giải quyết vấn đề bạn đang mắc phải ạ. cảm ơn và 1 lần nữa xin lỗi bạn ạ. chúc bạn 1 ngày vui vẻ ❤",,,,,,,,,,,,,,,,,,,,,,,
"sản phẩm không giống hình.vải quần bóng,xấu mất công mua về không mặc được",1,,,,,,,,,,,,,,,,,,,,,,,,
vải xấu không như hình đường may không hoàn thiện không nên mua,1,,,,,,,,,,,,,,,,,,,,,,,,
quần vải xấu như miếng khăn lau á,1,"chào bạn, nhận đánh giá của bạn thì quanaunamọi ngườipv có liên hệ bạn ngay để hỗ trợ, nhưng chưa thấy bạn phản hồi nếu sản phẩm bên mình có điều gì khiến bạn không hài lòng thì quanaunamọi ngườipv thành thật xin lỗi. và mong bạn phản hồi để quanaunamọi ngườipv giải quyết vấn đề bạn đang mắc phải ạ. cảm ơn và 1 lần nữa xin lỗi bạn ạ. chúc bạn 1 ngày vui vẻ ❤",,,,,,,,,,,,,,,,,,,,,,,
quần số đo bị lệch nhiều 32 mà như 30 31,1,"chào bạn, nhận đánh giá của bạn thì quanaunamọi ngườipv có liên hệ bạn ngay để hỗ trợ, nhưng chưa thấy bạn phản hồi nếu sản phẩm bên mình có điều gì khiến bạn không hài lòng thì quanaunamọi ngườipv thành thật xin lỗi. và mong bạn phản hồi để quanaunamọi ngườipv giải quyết vấn đề bạn đang mắc phải ạ. cảm ơn và 1 lần nữa xin lỗi bạn ạ. chúc bạn 1 ngày vui vẻ ❤",,,,,,,,,,,,,,,,,,,,,,,
treo đầu dê bán thịt chó ,1,"chào bạn, nhận đánh giá của bạn thì quanaunamọi ngườipv có liên hệ bạn ngay để hỗ trợ, nhưng chưa thấy bạn phản hồi nếu sản phẩm bên mình có điều gì khiến bạn không hài lòng thì quanaunamọi ngườipv thành thật xin lỗi. và mong bạn phản hồi để quanaunamọi ngườipv giải quyết vấn đề bạn đang mắc phải ạ. cảm ơn và 1 lần nữa xin lỗi bạn ạ. chúc bạn 1 ngày vui vẻ ❤",,,,,,,,,,,,,,,,,,,,,,,
mọi thứ quá tệ,1,"chào bạn, nhận đánh giá của bạn thì quanaunamọi ngườipv có liên hệ bạn ngay để hỗ trợ, nhưng chưa thấy bạn phản hồi nếu sản phẩm bên mình có điều gì khiến bạn không hài lòng thì quanaunamọi ngườipv thành thật xin lỗi. và mong bạn phản hồi để quanaunamọi ngườipv giải quyết vấn đề bạn đang mắc phải ạ. cảm ơn và 1 lần nữa xin lỗi bạn ạ. chúc bạn 1 ngày vui vẻ ❤",,,,,,,,,,,,,,,,,,,,,,,
quần đẹp vải ok,1,"chào bạn, nhận đánh giá của bạn thì quanaunamọi ngườipv có liên hệ bạn ngay để hỗ trợ, nhưng chưa thấy bạn phản hồi nếu sản phẩm bên mình có điều gì khiến bạn không hài lòng thì quanaunamọi ngườipv thành thật xin lỗi. và mong bạn phản hồi để quanaunamọi ngườipv giải quyết vấn đề bạn đang mắc phải ạ. cảm ơn và 1 lần nữa xin lỗi bạn ạ. chúc bạn 1 ngày vui vẻ ❤",,,,,,,,,,,,,,,,,,,,,,,
mua màu đen gửi màu khác shop tệ,1,"chào bạn, nhận đánh giá của bạn thì quanaunamọi ngườipv có liên hệ bạn ngay để hỗ trợ, nhưng chưa thấy bạn phản hồi nếu sản phẩm bên mình có điều gì khiến bạn không hài lòng thì quanaunamọi ngườipv thành thật xin lỗi. và mong bạn phản hồi để quanaunamọi ngườipv giải quyết vấn đề bạn đang mắc phải ạ. cảm ơn và 1 lần nữa xin lỗi bạn ạ. chúc bạn 1 ngày vui vẻ ❤",,,,,,,,,,,,,,,,,,,,,,,
chán ,1,"chào bạn, nhận đánh giá của bạn thì quanaunamọi ngườipv có liên hệ bạn ngay để hỗ trợ, nhưng chưa thấy bạn phản hồi nếu sản phẩm bên mình có điều gì khiến bạn không hài lòng thì quanaunamọi ngườipv thành thật xin lỗi. và mong bạn phản hồi để quanaunamọi ngườipv giải quyết vấn đề bạn đang mắc phải ạ. cảm ơn và 1 lần nữa xin lỗi bạn ạ. chúc bạn 1 ngày vui vẻ ❤",,,,,,,,,,,,,,,,,,,,,,,
đưa sai sản phẩm,1,"chào bạn, nhận đánh giá của bạn thì quanaunamọi ngườipv có liên hệ bạn ngay để hỗ trợ, nhưng chưa thấy bạn phản hồi nếu sản phẩm bên mình có điều gì khiến bạn không hài lòng thì quanaunamọi ngườipv thành thật xin lỗi. và mong bạn phản hồi để quanaunamọi ngườipv giải quyết vấn đề bạn đang mắc phải ạ. cảm ơn và 1 lần nữa xin lỗi bạn ạ. chúc bạn 1 ngày vui vẻ ❤",,,,,,,,,,,,,,,,,,,,,,,
ống thì bó quảng cáo 1 kiểu bán hàng 1 kiểu,1,"chào bạn, nhận đánh giá của bạn thì quanaunamọi ngườipv có liên hệ bạn ngay để hỗ trợ, nhưng chưa thấy bạn phản hồi nếu sản phẩm bên mình có điều gì khiến bạn không hài lòng thì quanaunamọi ngườipv thành thật xin lỗi. và mong bạn phản hồi để quanaunamọi ngườipv giải quyết vấn đề bạn đang mắc phải ạ. cảm ơn và 1 lần nữa xin lỗi bạn ạ. chúc bạn 1 ngày vui vẻ ❤",,,,,,,,,,,,,,,,,,,,,,,
"hư dây kéo, vải không giống hình.lừa đảo",1,"chào bạn, nhận đánh giá của bạn thì quanaunamọi ngườipv có liên hệ bạn ngay để hỗ trợ, nhưng chưa thấy bạn phản hồi nếu sản phẩm bên mình có điều gì khiến bạn không hài lòng thì quanaunamọi ngườipv thành thật xin lỗi. và mong bạn phản hồi để quanaunamọi ngườipv giải quyết vấn đề bạn đang mắc phải ạ. cảm ơn và 1 lần nữa xin lỗi bạn ạ. chúc bạn 1 ngày vui vẻ ❤",,,,,,,,,,,,,,,,,,,,,,,
ghét,1,"chào bạn, nhận đánh giá của bạn thì quanaunamọi ngườipv có liên hệ bạn ngay để hỗ trợ, nhưng chưa thấy bạn phản hồi nếu sản phẩm bên mình có điều gì khiến bạn không hài lòng thì quanaunamọi ngườipv thành thật xin lỗi. và mong bạn phản hồi để quanaunamọi ngườipv giải quyết vấn đề bạn đang mắc phải ạ. cảm ơn và 1 lần nữa xin lỗi bạn ạ. chúc bạn 1 ngày vui vẻ ❤",,,,,,,,,,,,,,,,,,,,,,,
hàng bịp vậy khác ảnh vc,1,"chào bạn, nhận đánh giá của bạn thì quanaunamọi ngườipv có liên hệ bạn ngay để hỗ trợ, nhưng chưa thấy bạn phản hồi nếu sản phẩm bên mình có điều gì khiến bạn không hài lòng thì quanaunamọi ngườipv thành thật xin lỗi. và mong bạn phản hồi để quanaunamọi ngườipv giải quyết vấn đề bạn đang mắc phải ạ. cảm ơn và 1 lần nữa xin lỗi bạn ạ. chúc bạn 1 ngày vui vẻ ❤",,,,,,,,,,,,,,,,,,,,,,,
thấy gớm,1,"chào bạn, nhận đánh giá của bạn thì quanaunamọi ngườipv có liên hệ bạn ngay để hỗ trợ, nhưng chưa thấy bạn phản hồi nếu sản phẩm bên mình có điều gì khiến bạn không hài lòng thì quanaunamọi ngườipv thành thật xin lỗi. và mong bạn phản hồi để quanaunamọi ngườipv giải quyết vấn đề bạn đang mắc phải ạ. cảm ơn và 1 lần nữa xin lỗi bạn ạ. chúc bạn 1 ngày vui vẻ ❤",,,,,,,,,,,,,,,,,,,,,,,
sản phẩm khác với hình ảnh.,1,"chào bạn, nhận đánh giá của bạn thì quanaunamọi ngườipv có liên hệ bạn ngay để hỗ trợ, nhưng chưa thấy bạn phản hồi nếu sản phẩm bên mình có điều gì khiến bạn không hài lòng thì quanaunamọi ngườipv thành thật xin lỗi. và mong bạn phản hồi để quanaunamọi ngườipv giải quyết vấn đề bạn đang mắc phải ạ. cảm ơn và 1 lần nữa xin lỗi bạn ạ. chúc bạn 1 ngày vui vẻ ❤",,,,,,,,,,,,,,,,,,,,,,,
mua đúng size theo bảng quy đổi nhưng không vừa ,1,"chào bạn, nhận đánh giá của bạn thì quanaunamọi ngườipv có liên hệ bạn ngay để hỗ trợ, nhưng chưa thấy bạn phản hồi nếu sản phẩm bên mình có điều gì khiến bạn không hài lòng thì quanaunamọi ngườipv thành thật xin lỗi. và mong bạn phản hồi để quanaunamọi ngườipv giải quyết vấn đề bạn đang mắc phải ạ. cảm ơn và 1 lần nữa xin lỗi bạn ạ. chúc bạn 1 ngày vui vẻ ❤",,,,,,,,,,,,,,,,,,,,,,,
mua mang tết mà thấy cái quần mất vui ,1,"chào bạn, nhận đánh giá của bạn thì quanaunamọi ngườipv có liên hệ bạn ngay để hỗ trợ, nhưng chưa thấy bạn phản hồi nếu sản phẩm bên mình có điều gì khiến bạn không hài lòng thì quanaunamọi ngườipv thành thật xin lỗi. và mong bạn phản hồi để quanaunamọi ngườipv giải quyết vấn đề bạn đang mắc phải ạ. cảm ơn và 1 lần nữa xin lỗi bạn ạ. chúc bạn 1 ngày vui vẻ ❤",,,,,,,,,,,,,,,,,,,,,,,
một size nhưng cái vừa cái chật ,1,"chào bạn, nhận đánh giá của bạn thì quanaunamọi ngườipv có liên hệ bạn ngay để hỗ trợ, nhưng chưa thấy bạn phản hồi nếu sản phẩm bên mình có điều gì khiến bạn không hài lòng thì quanaunamọi ngườipv thành thật xin lỗi. và mong bạn phản hồi để quanaunamọi ngườipv giải quyết vấn đề bạn đang mắc phải ạ. cảm ơn và 1 lần nữa xin lỗi bạn ạ. chúc bạn 1 ngày vui vẻ ❤",,,,,,,,,,,,,,,,,,,,,,,
"đồ tốt, nhưng chuẩn bị hàng quá lâu",1,"chào bạn, nhận đánh giá của bạn thì quanaunamọi ngườipv có liên hệ bạn ngay để hỗ trợ, nhưng chưa thấy bạn phản hồi nếu sản phẩm bên mình có điều gì khiến bạn không hài lòng thì quanaunamọi ngườipv thành thật xin lỗi. và mong bạn phản hồi để quanaunamọi ngườipv giải quyết vấn đề bạn đang mắc phải ạ. cảm ơn và 1 lần nữa xin lỗi bạn ạ. chúc bạn 1 ngày vui vẻ ❤",,,,,,,,,,,,,,,,,,,,,,,
shop không rep tin nhắn,1,"chào bạn, nhận đánh giá của bạn thì quanaunamọi ngườipv có liên hệ bạn ngay để hỗ trợ, nhưng chưa thấy bạn phản hồi nếu sản phẩm bên mình có điều gì khiến bạn không hài lòng thì quanaunamọi ngườipv thành thật xin lỗi. và mong bạn phản hồi để quanaunamọi ngườipv giải quyết vấn đề bạn đang mắc phải ạ. cảm ơn và 1 lần nữa xin lỗi bạn ạ. chúc bạn 1 ngày vui vẻ ❤",,,,,,,,,,,,,,,,,,,,,,,
hàng không chuẩn shiper thái độ,1,"chào bạn, nhận đánh giá của bạn thì quanaunamọi ngườipv có liên hệ bạn ngay để hỗ trợ, nhưng chưa thấy bạn phản hồi nếu sản phẩm bên mình có điều gì khiến bạn không hài lòng thì quanaunamọi ngườipv thành thật xin lỗi. và mong bạn phản hồi để quanaunamọi ngườipv giải quyết vấn đề bạn đang mắc phải ạ. cảm ơn và 1 lần nữa xin lỗi bạn ạ. chúc bạn 1 ngày vui vẻ ❤",,,,,,,,,,,,,,,,,,,,,,,
