,Unnamed: 0,khach_cmt,rating,shop_phan_hoi
2463,154,"Đồ bơi đẹp tôn dáng. Mình 1m52, nặng 46kgs, mặc sz dưới 53 kg vừa vặn.",5,
2464,155,Hình & video ko liên quan nhưng đồ shop giao rất đẹp lun 😍😍 sẽ ủng hộ shop típ❤️,5,
2465,156,áo đẹp mọi ng ạ.mình 1m57 năng 45kg mặc vừa xinh.màu tươi lắm ạ,5,
2466,157,"Không liên quan🤭, video hình ảnh mang tính chất lấy xuuuuuuu",5,
2467,158,Hàng đúng như mô tả. Chất dày dặn. Sẽ ủng hộ shop lần tiếp theo.,5,Cảm ơn c yêu nhiều. .Hi vọng c ủng hộ shop lần sau ạ
2468,159,"Đẹp lắm nè, có mút ngực không sợ lộ 
Quần mặc hơi to phải bóp lại ạ",5,
2469,160,Chất đẹp rất hài lòng.nsnsjsnsjsksnsnnsnsnsnsnsnsjsksmksj,5,
2470,161,Giao hàng cực nhanh. Mới mua hàng lúc sáng là chiều có hàng rồi,5,Cảm ơn c yêu nhiều ạ. có dịp ủng hộ shop tiếp nha c <3
2471,162,"Ki như ảnh, mặc trật lắm lòi thịt ra ghê chếtnsnsndndnndsnsbdndn",5,vCảm ơn c yêu nhiều ạ. có dịp ủng hộ shop tiếp nha c <3
2472,163,"Vải hơi nóng, 49kg mà mặc quần chật ạ, giá thì khá rẻ so với shilop khác",5,
2473,164,"Đồ mỏng, tạm được
Quên chụp nên lấy tạm hình và video khác
Good ",5,Cảm ơn c yêu nhiều ạ. có dịp ủng hộ shop tiếp nha c <3
2474,165,Hàng chất lương tốt xứng đáng đồng tiền. Rẻ đep rất ưng ý. Shop nhiệt tình,5,Cảm ơn c yêu nhiều. Hi vọng sẽ ủng hộ shop lần sau ạ ❤️
2475,166,Vải OK. Nói chung vải hợp với giá. Mỗi tội hơi mập nên mặc không được đẹp.,5,
2476,167,Hzbkejxnicnxnzjnxjdkkxowkdn dkdkzndnskskskskskjsjwi,5,Cảm ơn chị yêu nhiều ak. Hi vọng sẽ ủng hộ Shop lần sau
2477,168,"Sp đúng hình ảnh,vải dày dặn,đẹp. Giao hàng nhanh,shop nhiệt tình",5,
2478,169,"Bộ hồng ruốc mình thấy hơi giống cam đất, nhưng giặt mau khô, bộ xanh rêu vải mỏng hơn mà phơi lâu khô hơn tí, có ra màu ít. Nhưng nói chung hàng rẻ, vải mát, m 1.58m- 47kg mặc vừa. ",5,Cảm ơn chị yêu nhiều ak. Hi vọng sẽ ủng hộ Shop lần sau
2479,170,Chất lượng sản phẩm tuyệt vời. Đóng gói đẹp kỹ. Giao hàng nhanh. ,5,
2480,171,"Vải co giản tốt,nên mua
Sẽ ủng hộ lần sau.chất lượng tốt so với giá tiền
Xl vi Video k lq tới sp ",5,
2481,172,"Đồ ship hơi lâu, nhưng may là mình 65kg vẫn vừa size to nhất, miếng mút hơi k được ổn nhưng có chỗ để thay thì vẫn ok",5,
2482,173,hsjhehhenensvsbsnsngshdndndbbdhdndnnbhnnxbffdnjjhcjc,5,
2483,174,"Ảnh và video mang tính chất nhận xu, chất so với gí tiền ổn, màu hơi đậm hơn ảnh chút, nói chung là ok",5,
2484,175,"M 39kg. Mặc bị rộng. Mặc dù đã hỏi shop tư vấn.
Số đo 78-59-78. Eo rộng tầm 2-3cm. Quần k ôm vào đùi. Chắc phải mang sửa mới mặc được",5,
2485,176,"..chất vải rất ok, mẶc vào vừa vặn...5 sao................///",5,
2486,177,Chất lượng sản phẩm của shop phù hợp với giá tiền. Mình rất ưng ý!,5,Cảm ơn c yêu nhiều. Hi vọng sẽ ủng hộ shop lần sau ạ ❤️❤️❤️
2487,178,Sản phẩm rất đẹp. Rất giống hình. Rất đáng mua. Jsjshshsshhsjhshshsshshgsvehsushshshhshhehshbs,5,
2488,179,Đẹp . Quần bơi hơi nhỏ . Nói chubg là okkkkkkkkkkkkkkkkkkkkkkk,5,Cảm ơn chị yêu nhiều ak. Hi vọng sẽ ủng hộ Shop lần sau
2489,180,Bbbbbnsnsjsksndndksdnndndndndjdj hàng đẹp nha nên mua nha mn,5,
2490,181,"Hình ảnh và video chỉ mang tính chất nhận xu
Đồ đẹp lắm nha mn
Nên mua nha",5,
2491,182,Đóng gói cẩn thận. Chất liệu tốt giá cả phải chăng. Mình 1m65 53 kg mặc vừa y luôn. Cám ơn shop sẽ ủng hộ shop dài dài ạ.💕,5,
2492,183,"Đẹp lắm ạ, mình 1m62 51kg mặc lên vừa ik luôn ấy..................",5,
2493,184,"Nhận được hàng đầy đủ, nguyên vẹn. Mặc lên ôm dáng, ok. Che khuyết điểm. ",5,Cảm ơn chị yêu nhiều ak. Hi vọng sẽ ủng hộ Shop lần sau
2494,185,Đẹp chưa mặc nên không biết form chuẩn không ....😄😔😄😔😄😔😔😔💕😔💕💕😔💕💕,5,
2495,186,Quần hơi bị nhúm phía sau. Trên 45ki sẽ mang đẹp ạ.tiền nào của đó vậy.,5,
2496,187,Shop giao hangf đủ. Mong mang lên nhìn đẹp. Mua 2 bộ như vậy cũng khá rẻ,5,Cảm ơn c yêu nhiều. Hi vọng sẽ ủng hộ shop lần sau ạ ❤️❤️❤️
2497,188,Sau khi nhận hàng thì thấy chất vải Ok. Ai dáng đẹp mặc sẽ đẹp. Ủng hộ shop,5,
2498,189,"Giao hàng nhanh , hàng giống trong hình  chất thung mềm mịn đẹp",5,
2499,190,"Hàng đẹp,  mặc vừa in luôn.  Chất đẹp lắm. Săn sale nên rẻ👌👌👌👌👌👌",5,
2500,191,"Vải đẹp
dày dặn
chất lượng tốt 
Đóng gói đẹp mắt
Giao hàng nhanh ",5,
2501,192,"Sản phẩm y hình, giao hàng nhanh chóng. Ưng ý. Lần sau lại ủng hộ shop",5,
2502,193,"Đẹp lắm nha mn chất cũng xịn sò nữa mua sợ chất mỏng nma lấy về rồi chất u mê lắm luôn đó 
Mn nên mua nha",5,
2503,194,Giao hàng siêu nhanh. Chất lượng sản phẩm ok,5,
2504,195,"Rát đẹp nhé, rát ung y, mặc lên rất thích, cảm ơn shop nhé, sẽ ủng hộ nữa.",5,
2505,196,"Mình đặt nhầm size nhắn tin chủ shop đồng ý đổi hàng chưa đầy 1 nốt nhạc. Rất thích cách phục vụ bên shop. 
Hàng đẹp đường may chắn chắn nói chung rất hài lòng.  Trước đây mình cũng từng mua hàng nhiều shop khác nhưng giờ dừng lại ủng hộ shop thôi 🥰🥰🥰",5,
2506,197,"Giao hàng nhanh, chất vải dày dặn, mịn, đặt đc giá tốt, sẽ ủng hộ shop vào những lần tiếp theo",5,
2507,198,,5,
2508,199,Chất lượng sản phẩm tốt,5,
2509,200,Okkkkkkkkkkkkkkkkkkkkkkkkkkkkkkkkkkkkkkkkkkkkkkkkkkkkkkkkkkkkkk,5,
2510,201,,5,
2511,202,"Sp như hình . Chất đẹp giá rẻ
Giao hàng lâu dịch nên bỏ qua đx",5,
2512,203,"Mình vừa nhận hàng xong, đẹp lắm luôn. Từ màu sắc đến chất liệu.",5,
2513,204,Đepppppppppppppppppppppppkkkkkkkkkkkkkkjjkkkkkkkkkkkjjjj,5,
2514,205,"Hàng OK chất lượng,sẽ ủng hộ tiếp ka",5,
2515,206,Hàng rất ok ạ vừa khít luôn chất cũng ok,5,
2516,207,Hàng ok. K đẹp k xấu phù hợp giá tiền,5,
2517,208,Chất max đinh luôn á mọi người mua đi không phí đồng tiền đâu 😍😍,5,
2518,209,,5,
2519,210,,5,
2520,211,"Video ko liên quan. Nhưng đã nhận đc hàng, sản phẩm ok so với giá tiền",5,
2521,212,,5,Cảm ơn c yêu nhiều. Hi vọng sẽ ủng hộ shop lần sau ạ ❤️
2522,213,,5,
2523,214,"Màu đẹp, chất mát",5,
2524,215,"Xuất sắc, giao hàng siêu nhanh",5,Cảm ơn c yêu nhiều ạ. có dịp ủng hộ shop tiếp nha c
2525,216,Bộ đẹp giá tốt nên mua nhé ppppppppppppppppppppppppppppppppppppppppppppppppppppppppppppppppppppppppppp ppppppppppppppppppppppppppppppppppppppppppppppppppppppppppppl,5,
2526,217,"Hình ảnh mang tính chất minh hoạ
Sản phẩm như quảng cáo.
Gói hàng cẩn thận .",5,
2527,218,"Giá rẻ, tạm ổn, quần may ko đc đẹp cho lắm, nó hơi bị đề phô, nc mặc vào tổng thể thì tạm chấp nhận đc",5,
2528,219,Vải đẹp oke 🥰🥰 giao hàng nhanhhhhhhh rẻ mình 1m60 44kg vừaaaaaa,5,
2529,220,Hình ảnh chỉ mang tính chất minh hoạ. 40 kg mặc vừa đồ bơi đẹp nên mua,5,
2530,221,"Hình ảnh chỉ mang tính chất minh hoạ , vải rất đẹp rất ưng rất vừa người",5,
2531,222,Vải dày đẹp. Mẫu dáng  màu lên người đẹp. Cảm ơn shop,5,
2532,223,"Mình nhận dc hàng rồi, giao hàng nhanh, vãi đẹp lắm luôn",5,
2533,224,Eo mặc xong không nhận ra mình luôn ý . Nói chung là rất ổn nha,5,
2534,225,"Đẹp, đáng mua, giá rẻ mà được như vậy là quá hời ... Vải và fom đẹp hơn mình nghĩ",5,
2535,226,"Đáng đồng tiền bát gạo lắm á mn. Ko quá hở , vừa vặn luôn. Mình tận 65kg á nhưng mặc vừa in . Được 1 cái che mỡ bụng khá là ok luôn. Săn sale giá hời freeship nữa ☺️",5,
2536,227,"Đồ dày dặn, giá tiền này tưởng ko đẹp mà đồ đẹp ko tưởng luôn nha, màu bên ngoài ưng hơn trong hình luôn, mua lần đầu sẽ quay lại mua món khác, camera chụp bị sai màu chứ màu ngoài cam đất nha các chị em",5,
2537,228,"Hình ko liên quan, nhưng sản phẩm ok, shop giao nhanh.",5,
2538,229,Nhận xu nhận xuuuuuuuuuuuuuuuuuuuuuuuuuuuuuuuuuuuuuuuuu,5,
2539,230,"Vải đẹp
Đặc size 55kg mà mình có 49 nhưng mặt hơi chặt
.... Giá ổn ...
Nên mua",5,
2540,231,"Gói hàng chắc chắn, sp ok nhé. Lớp quần có 2 lớp. Phần áo có chun phần sau. Cổ hình v sâu nên hơi thấy ngực tí nhé",5,
2541,232,Mặc tạm thôi mùi hôi lắm giặt vải phai màu  chất vải nóng khi nhận dc hàng đặt cho bạn thêm nhưng thấy k đẹp nên đơn sau đã k nhận mong shop thông cảm,5,
2542,233,"Mua lần t2 vẫn ưng ý như lần đầu, chất đẹp giá lại rẻ. Sẽ còn ủng hộ dài, cũng sẽ giới thiệu bạn bè người thân ủng hộ sh nhé. Nên mua lắm ạ",5,
2543,234,"Sản phẩm giống mẫu, hàng giao nhanh, chất dày dặn. Cơ mà mình mặc vô cứ cảm giác nó hơi tuộc ở vòng 1 ấy. Cho shop 5* về chất lượng",5,
2544,235,"Sản phẩm ok ! Mk m5 53 kg mặc vừa xinh , co dãn ! Tôn dáng ! Che bụng đc 1 chút ! Nên mua nha mn 😁🤣🤣😊☹️🤔🤣🐣🤣☹️🤣🤣🙃🙃🙃😗😃🤣😄🤣😁😆☹️🤔🥗☹️🥗😗😁🤣🤣🙃🙃🌷😉😂☺️😃👻😆😁😁🌻🌻😉😗😉😗😉😗😉",5,
2545,236,Jsaojdzjjxjdkdkskskskskskksksksjsjsnsbsnsnskalsosksbbsbsbsbbsbbn,5,
2546,237,"Chất lượng tốt , nnbvffhjkkmbxdbjkngffgbbnnmnhfffffhjjkjfdfbjjmmnbgg",5,
2547,238,"Hàng giao nhanh đóng gói cẩn thận 
Mẫu mã Chất vải rất ok ",5,
2548,239,"Shop tư vấn nhiệt tình. Chưa mặc thử nên chưa biết sao nhưng thấy chất lượng ạ. Mình ko có hình nên lấy đỡ hình này, mng thông cảm ạ. Thanks shop.",5,
2549,240,"Mượn hình shop dùng đỡ nha... đi tập bữa giờ mấy chị khen đồ màu tươi, vải mịn, kiểu đẹp... mua trúng giảm giá thik ghê!
Cảm ơn shop bán đồ có tâm nha!!! ",5,
2550,241,"Màu cam mình chụp lên hình hơi kì, này là dạng màu cam đất nha, chất liệu thun là thun bóng nha mn, lúc đầu m nghĩ là thun bt chứ, mình 44kg, 1m52 mặc vừa, có điều phần mút áo cứ xô lệch nên thấy hàng hơi cheap tí",5,
2551,242,Hàng chất liệu mẫu mã rất đẹp . Giao hàng nhanh . Có điều mình 48kg mà thấy mặc hơi kích xíu . Shop để mức cân nặng 53kg mình sợ sẽ bị kích nhiều . Mình 1m6,5,
2552,243,Giá tương đối rẻ nhưng chắc bụng mình hơi to nên mặc ko đẹp lắm 😁😁😁😁😁😁😁😁😁😁😁😁😁😁😁😁😁😁😁😁😁😁😁😁😁😁😁😁😁😁😁😁😁😁😁😁😁😁😁😁😁😁😁😁😁😁😁😁😁😁😁😁😁😁😁😁😁😁😁😁😁😁😁😁😁😁😁😁,5,
2553,244,Đã nhận hàng đủ số lượng comment dạo để kiếm xu xu xu xu xu xu xu xu xu xu xu xu tuy nhiên đồ của shop cũng rất cute nhé,5,
2554,245,Mình cao 1m60 nặng  60kg mặc  hơi  chật xíu nhưng chất vải đẹp và kiểu dáng  đẹp. Sản phẩm  như mô tả. ,5,
2555,246,"Giao hàng nhanh 
Chất khá ổn, tuy nhiên phần bo gấu quần hơi hơi bé. Bạn nào đùi to như mình sẽ thấy hơi bó chút",5,
2556,247,"Màu đỏ rất đẹp. Áo vừa, mắc khá là sexy. Quần hơi rộng so với mình. Hơi tiếc 1 chút.
Giao hàng rất nhanh. Đóng gói ok.",5,
2557,248,"Hình ảnh mang tính chất nhận xu.
Màu sắc và chất liệu phù hợp vs giá, mình 50kg mặc hơi ôm xí xi, >50kg mình nghĩ sẽ chậc cả quần và áo",5,
2558,249,"Đẹp xuất sắc mn ơi, nên mua ạ giá rẻ còn đẹp mặc vừa luôn còn ko thấy lộ bụng nữa lần sau tiếp tục ủng hộ shop",5,
2559,250,"Mặc lên ôm dáng, màu sắc đẹp , vải mịn , chắc là sẽ ủng hộ shop lần sau nè",5,
2560,251,Ưng hết sức luôn đẹp chất lượng lần sau sẽ ủng hộ shop 👍👍👍👍👍👍👍👍👍,5,
2561,252,"sản phẩm rất đẹp y hình, mình 46kg mặc vừa, chồng mình cũng vừa quần bơi, shop tư vấn nhiệt tình, rất hài lòng",5,Cảm ơn c yêu nhiều ạ. có dịp ủng hộ shop tiếp nha c <3
2562,253,Áo đẹp lắm mặc kín đáo  mình 51kg cao 1m6 mà mặc hơi chật xíu,5,
2563,254,"Shop nhiet tinh, noi chuyen tu van nhe nhang. Hang chat luong tot. Se tiep tục ủng hộ!",5,
2564,255,Hftghjjhhhhhhvccccvy   Hhvf gyhgv frtgf đèc vbhhjvv xdswd xdwewsdxtr njungggnhgg,5,
2565,256,"Giao hàng siêu nhanh 
Dễ mặc, ôm người, quần cao ngang rốn. vải có độ bóng nhẹ, bụng bự dễ thấy",5,
2566,257,"Giao hàng nhanh, mặc lên rất tôn dáng,vải đẹp,mà quần hơi chật đùi 1 chút ạ",5,Cảm ơn c yêu nhiều. Hi vọng sẽ ủng hộ shop lần sau ạ ❤️
2567,258,"hàng phù hợp với giá tiền
 thank you shop
bsjsjsvkavsjwbsnanbsksns",5,
2568,259,"Vải đẹp, đường may chắc chắn, rất đáng mua nha, giá thì quá là hợp lí lun",5,Cảm ơn c yêu nhiều. Hi vọng sẽ ủng hộ shop lần sau ạ ❤️
2569,260,Chất lượng sản phẩm tuyệt vời đóng gói sản phẩm rất đẹp và chắc chắn ,5,
2570,261,"39kg mac vua y nha mn, dep lam luon ak..................................",5,Cảm ơn c yêu nhiều. Hi vọng sẽ ủng hộ shop lần sau ạ ❤️❤️❤️
2571,262,Bạn mua bikini đến những đảo đẹp ở nước mình để chụp hình nhen :),5,
2572,263,Hàng y hình. Mua dc fash sale giá rẻ quá. Cam on sho0 dbdndbdj,5,
2573,264,"Hình ảnh minh hoạ thui. Mình nhận hàng rùi, vải ok, mình chưa mặc thử nên k bik sao",5,
2574,265,Mẫu mã ok. Giao hàng nhanh. Chất liệu vải tốt. Form vừa dáng..,5,Cảm ơn bạn đã ủng hộ 
2575,266,"Bộ đồ bơi vừa vặn, chất mát, mặc rất thoải mái. Thời gian giao hàng nhanh",5,
2576,267,"Sản phẩm giống hình, giá cả phù hợp, bạn nào 1.55 tầm 45kg thì mặc đẹp, 50kg thì mặc hơi chật",5,
2577,268,Sp giống hình. Chất vải khá ok. Mk 40kg mà mặc size dưới 55k hơi chật nên mn mua để ý size xíu là ok ,5,
2578,269,"Chất đẹp, màu ở ngoài đậm hơn ảnh, mình cao 1,54 nặng 46kg mặc vừa nhưng phần vai hơi bé ",5,
2579,270,"Lần đầu tiên mua của shop, sản phẩm y hình, trả lời Tin nhắn nhanh, chưa dùng nên không biết chất lượng sản phẩm như thế nào",5,Cảm ơn c yêu nhiều ạ. có dịp ủng hộ shop tiếp nha c <3
2580,271,"Hàng đúng hình, chất lượng ổn, quan trọng nhất là giấu được bụng mỡ.",5,
2581,272,Vải đẹp lắm màu cũng ok luôn chưa mặc thử nên k pk ok k,5,
2582,273,"Hàng khá ok , rẻ chất lượng tốt , áo vừa vặn , quần hơi chật ",5,
2583,274,"Hình ảnh không liên quan
Shop nhiệt tình 
Hàng đẹp nên mua nha 🥻🥻",5,
2584,275,"Shop tv rất nhiệt tình, đáng mua lắm nhaa.
Hình ảnh mang tính chất nhận xu",5,
2585,276,Chưa mặc thử nhưng nhìn chung là ok. Rất hài lòng. Ảnh klq lắm. ,5,
2586,277,"Tuyet voi, dang de mua, gia ca phai chang, se ung ho shop tiep,",5,Cảm ơn c yêu nhiều ạ. có dịp ủng hộ shop tiếp nha c <3
2587,278,Đẹp đúng mẫu nha mn ơi mình 1m52 45kg mặc vừa i luôn ai nặng kg nên nhờ shop tư vấn nha,5,
2588,279,"Chất vải oki, nhưng vận chuyển quá lâu luôn ạ, 5 ngày mới nhận được hàng, đặt đi bơi mà bơi về rồi mới nhận được 😭",5,
2589,280,Jkkkknnnklkvcdtjkn mlllkmmmmlpbggszcvnlooo là ygvvbmmlmmkkmmmm,5,Cảm ơn chị yêu nhiều ak. Hi vọng sẽ ủng hộ Shop lần sau
2590,281,"Chất lượng sản phẩm tốt. 
Thời gian giao hàng nhanh. 
Đóng gói chắc chắn. ",5,Cảm ơn c yêu nhiều ạ. có dịp ủng hộ shop tiếp nha c <3
2591,282,"Sản phẩm đẹp, giống hình
Giao hàng nhanh
Đóng gói cẩn thận ...",5,Cảm ơn c yêu nhiều ạ. có dịp ủng hộ shop tiếp nha c <3
2592,283,"Áo đẹp. Mà mình 52kg, bận hơi chật. Mút áo dễ xê dịch, xuống bơi hay lệch. ",5,
2593,284,hàng giao nhanh. chất vải co giãn tốt. đúng sz . lần đầu đặt hàng o shoppi nhưng khá ưng ý. sẽ ủng hộ shop tiêp ,5,
2594,285,Giao hàng nhanh. Đồ mặc rất ưng ý. Chất vải tốt. Mặc lên thích lắm luôn.,5,
2595,286,"Vải đẹp ♥️ giao hàng nhanh 5 sao cho shop
#hinh anh mang tính chất nhận xu😝",5,Cảm ơn c yêu nhiều ạ. có dịp ủng hộ shop tiếp nha c <3
2596,287,"Chất vải đẹp, mặc chuẩn form, không bị lỗi gì cả! Ok lắm ạ",5,
2597,288,"Hàng đẹp chất lượng rất ưng ý sẽ tiếp tục ủng hộ các lần sau 
Hhhhhhhhhhhhhhhhhhhhhhhhhhhhhhh",5,
2598,289,"Chất vải mát, dễ chịu.. giao hàng siêu nhanh vừa đặt 2 3 hôm là có",5,
2599,290,Mùa hè đang đến với những cơn nóng oi ả cùng những tia UVA và UVB độc hại ảnh hưởng trực tiếp đến làn da của bạn. Hầu hết vào thời điểm này trong năm các bạn gái nào ra đường cũng kèm theo một lớp chống nắng không chỉ trên mặt mà còn cho cả toàn thân,5,
2600,291,"Dong goi san pham rat dep va chac chan
Thoi gian giao hang rat nhanh",5,
2601,292,San pham tạm được phù hợp với giá tien .nnenbbnwjbzuhhqkjwhhqkqkbgzjnbjwzbnmkwkknejgdkytfvwkjwhg,5,
2602,293,Sp đẹp đóng gói đẹp giao hàng nhanh. Ảnh mang tính chất minh họa,5,
2603,294,"Xin lỗi shop vì không thể cho shop hình ảnh, nhưng mà với giá rẻ mà đồ đẹp như vậy là quá tuyệt vời, mình cảm thấy bộ này rất hợp với mình tuy có nhiều khuyết điểm nhưng mặc lên che hết đi thật là thích.cảm ơn shop đã bán một sản phẩm rẻ đẹp như vậy sẽ ủng hộ shop tiếp ạ",5,
2604,295,,5,
2605,296,sản phẩm khá ok,5,
2606,297,"Chất vải đẹp, vừa vặn. Rất hợp lý cho ai muốn tìm bikini nhưng k hở nhiều.",5,
2607,298,Vải bao mát chất lượng ok lắm luôn,5,
2608,299,"San phẩm ok, hình minh họa",5,
2609,300,,5,
2610,301,Ok,5,
2611,302,Mình 53kg mặc size <55kg hơi chật. Mấy bạn 53-55kg cứ mạnh dạn mua size lớn nhé,5,
2612,303,"Đặt lần đầu của shop 3 bộ 1lúc, đẹp miễn chê luôn từ chất vải đến form, đường may cũng rất đẹp nữa. Quá trời ưng luôn, đồ đẹp giá mềm, sẽ ủng hộ shop dài dài ❤️❤️❤️",5,
2613,304,,5,
2614,305,Rẻ mà ok lắm nhé.,5,
2615,306,,5,
2616,307,"Mình cao 1m53 nặng 43kg mặc vừa xinh, ai đùi to cân nhắc vì ống quần khá nhỏ ạ.
Chất mặc cực mát luôn, giá lại siêu rẻ hihi
Nên mua mọi người ạ, mặc thích lắm ấy.
Chúc shop ngày càng đông khách hơn nữa ạ ^^",5,
2617,308,Chất vải ok. Mà s đồ nhỏ vs số kí. ...bó người lắm,5,
2618,309,"Mình 1.57, 52kg mặc vừa in luôn, áo lên form rất đẹp, quần phía trước hơi lùng bùng tí nhưng vẫn đẹp, giá rất tốt..nên mua ah",5,
2619,310,"Màu ưng ý không bị chói quá . Giá rẻ, giao hàng tốc độ bình thường. ",5,
2620,311,Chưa có mặc nhưng sờ chất mát mịn .oki,5,
2621,312,Hàng đẹp ạ. Nhưng m 45kg lấy size bé r mà s vẫn hơi rộg😂,5,
2622,313,Nên muA nhé😘😘,5,
2623,314,"Chất vải đẹp, mềm mà giá lại rẻ :))",5,
2624,315,Mình nhận thấy đẹp bất ngờ luôn. Cảm ơn shop. Trước toàn phải ra cửa hàng mua giá rất mắc. Giờ sẽ chỉ mua ở đây thôi. Sẽ giới thiệu cho các chị bạn tâp yoga chung,5,Cảm ơn c yêu nhiều. .Hi vọng c ủng hộ shop lần sau ạ
2625,316,Đep,5,
2626,317,Hàng đẹp như hình. Xịn xò như bộ 300-400 mình mua. Sẽ ủng hộ tích cực,5,
2627,318,"44ký 1.56 
mặc vừa y 
vải có co giản
shop bán quá rẻ 
nên mua nha mọi người 
ship hàng nhanh như 1 cơn gió ",5,Cảm ơn c yêu nhiều ạ. có dịp ủng hộ shop tiếp nha c <3
2628,319,giá rẻ nhưng hàng chất lượng nên mua ạ,5,Cảm ơn c yêu nhiều. .Hi vọng c ủng hộ shop lần sau ạ
2629,320,"Hàng đẹp như hình, giao hàng nhanh",5,
2630,321,Đóng gói ok. Mình 1m57 ...48kg  áo thì vừa . quần hơi bó đùi . vải ok . mng nên mua .,5,
2631,322,Hàng đẹp lắm nha . Ko chật như các bác kêu đâu . Rộng thoải mái . Cạp cao . ,5,
2632,323,"Hàng quá đẹp, lên form chuẩn, che bụng cực hack dáng luôn, nên mua nha mọi ng",5,Cảm ơn c yêu nhiều ạ. có dịp ủng hộ shop tiếp nha c <3
2633,324,"Nhiều bạn cứ ns nhỏ hơn 53kg mà vẫn mang chật, đó là do vòng eo, đôi khi bạn nhẹ cân nhưng vòng eo vs bụng của bạn to thì chật vẫn bthg, riêng mh thấy sản phẩm của shop rất tốt, mh sẽ quay lại shop mua tiếp.",5,
2634,325,Đẹp :))),5,
2635,326,"Mẫu như hình , giao hàng nhanh , chất liệu vải ok lắm nha mng đáng túi tiền lun.  ",5,
2636,327,"Giá cả hợp lý. Đồ bơi ko có size. Mình 47kg 1m53, mặc đẹp vừa y, chỉ có đùi hơi bó. Đồ bình thường mình mặc sz M. Xanh coban nhưng ko chói đâu, xuống nước nó thành xanh đậm.",5,
2637,328,"Đã nhận được hàng, chất ổn so với tầm giá, shop phục vụ tốt.",5,"Cảm ơn c yêu nhiều ạ. Chi dễ thương quá, có dịp ủng hộ shop tiếp nha c <3"
2638,329,Đẹp,5,
2639,330,"Dày dặn, ok nhé, nhưng mình đặt màu cam, màu tối hơn ảnh 😥",5,Cảm ơn c yêu nhiều ạ. có dịp ủng hộ shop tiếp nha c <3
2640,331,Dẹp ah,5,Cảm ơn c yêu nhiều. Hi vọng sẽ ủng hộ shop lần sau ạ ❤️❤️❤️
2641,332,"Giống mẫu nhé, vì giặt nên ko chụp hình thật dc",5,
2642,333,Đang đồng tiền lắm sp ok nên mua,5,
2643,334,,5,Cảm ơn c yêu nhiều ạ. có dịp ủng hộ shop tiếp nha c <3
2644,335,Rất ok,5,Cảm ơn c yêu nhiều ạ. có dịp ủng hộ shop tiếp nha c <3
2645,336,"K biết vì lý do gì đặc 4tây 10tây thì mới tới, hàng thì ok , hơi buồn xíu vì k thể mặc đúng ngày đi bơi ,nói chung hàng thì ok ",5,
2646,337,Okkkkk la nha,5,
2647,338,"Đồ đẹp lâm luôn nha shop giao hàng nhanh.sẽ ủng hộ shop cho shop 5 sao nha,",5,
2648,339,,5,
2649,340,Vải dày dặn chắc chắn thích lắm ạ. Quá chất lượng so với giá tiền nhaaa,5,Cảm ơn chị yêu nhiều ak. Hi vọng sẽ ủng hộ Shop lần sau
2650,341,"Hàng đẹp lắm, mọi ng nên mua. Chất lượng hơn so với giá tiền",5,
2651,342,Hàng đẹp lắm mn ạ,5,
2652,343,"shop giao hàng nhanh, bộ đồ đẹp, nhưng quần hơi chật",5,Cảm ơn c yêu nhiều ạ. có dịp ủng hộ shop tiếp nha c <3 mặc 1-2 lần sẽ giãn ra c nha 
2653,344,hàng như ảnh ❤️,5,
2654,345,,5,
2655,346,Bộ mặc đc. Quần lẻ mua thêm mặc chậc r Shop ơi ,5,Cảm ơn c yêu nhiều. .Hi vọng c ủng hộ shop lần sau ạ
2656,347,"Giao hàng nhanh, vải hơi mỏng xíu. Nhưng phù hợp giá thì rất okay😍",5,
2657,348,"Đã nhận được hàng,, giao nhanh, vải mịn,, mang lên phom đẹp.. lần sau sẽ ủng hộ tiếp",5,
2658,349,"Vãi đẹp , nhưng bạn nào đùi to nên cân nhắc , đồ đẹp ",5,
2659,350,Đẹp đúng vs miêu tả.giao hàng nhanh,5,Cảm ơn chị yêu nhiều ak. Hi vọng sẽ ủng hộ Shop lần sau
2660,351,Hsnns,5,
2661,352,"Hàng chất lượng ok, giao hàng nhanh trong vòng 2 ngày, đóng gói cẩn thận.",5,
2662,353,Thấy cũng oke.,5,
2663,354,"Vải đẹp, đáng tiền",5,
2664,355,,5,
2665,356,"Vải đẹp. Phù hợp giá tiền. Giao hàng nhanh, đóng gói cẩn thận.",5,Cảm ơn chị yêu nhiều ak. Hi vọng sẽ ủng hộ Shop lần sau
2666,357,,5,
2667,358,Đồng hồ đẹp,5,
2668,359,,5,
2669,360,"Xinh mặc hợp , do mình mỡ cũng có nên mặc quần ko đẹp🥴",5,Cảm ơn c yêu nhiều. Hi vọng sẽ ủng hộ shop lần sau ạ ❤️
2670,361,"Màu đẹp , đường kim mũi chỉ tốt",5,
2671,362,"Hàng đẹp lắm nha mọi người , nên mua , shop phục vụ rất rất nhiệt tình check tn nhanh lắm ",5,
2672,363,Sản phẩm đẹp ok nên mua ạ ,5,
2673,364,Xuất sắc 👍👍💯,5,
2674,365,Ksksbdbcoxjbdi oábbdkdiddi ớhvdọid iaisbdbdb,5,
