,Unnamed: 0,khach_cmt,rating,shop_phan_hoi
0,0,Hàng dẹp đẹp 🤩 quá vậy em có 👍 thôi em cảm 🤧 và nhớ 😢 anh 🇬🇧 có 👍 thôi,5,
1,1,"Có mút áo, vải ok, giá cả hợp lý, ship cũng nhanh nữa, sẽ ủng hộ shop nữa ạ",5,
2,2,"Mặc vừa in lun, mà rẻ hơn mua ngoài shop nhiều nữa đỉnh gê 👍👍👍👍👍",5,
3,3,"Chất vải đẹp, mát. Đồ bơi như hình, có miếng độn ngực sẵn. Giao nhanh đúng loại hàng",5,
4,4,Sản phẩm đầy đủ giá hợp lý mọi người nên mua thử nha. Giao hàng 2 ngày,5,
5,5,"Sản phẩm đẹp, đóng gói cẩn thận, giao hàng siêu nhanh, rất đáng mua nha mn",5,
6,6,Okayyyyyyyyyyyyyyyyyyyyyyyyyyyyyyyyyyyyyyyyyyyyyyy,5,
7,7,"Đồ giống ảnh, size vừa, các bạn thoải mái mua đúng size kh bị chật hay gì đâu nhé. Nhưng vấn đề duy nhất là độn ngực hơi nhọn 😭😭 nhưng miếng độn chắc chắn, dù gì nhìn cùng kh đc đẹp form:( đồ ôm vừa phải, nên mua, giá rẻ so vs chất lượng, đc tặng cột róc khá tiện:3 giao nhanh",5,
8,8,"Hình ảnh mang tính chất nhận xu. Giao hàng nhanh, dc tặng cột tóc dễ thương, bộ đồi bơi dày dặn, ok luôn, shop rất tinh tế che tên sản phẩm, thanks shop",5,
9,9,"Nên mua nha mn. Mua kèm theo mút mặc bên trong để dự phòng. Mình 1m58, nặng 50kg mặc vừa",5,
10,10,"Mình nhận đc hàng rồi shop nhé. Rất đẹp, shop gói hàng cẩn thận lại đc tặng thêm dây buộc tóc. Cảm ơn shop nhé ạ.",5,
11,11,"Hàng cute, đúng màu, đúng size, đường may chắc chắn, nên mua nha cả nhà",5,
12,12,"Sh để 58kg-65kg nhưng mình 57kg, vòng 3 100cm, eo 86cm mặc hơi khít nha mn. Bơi thì có thể ướt cởi ra khó tí nhưng vẫn ổn. Vải mặc mát ko biết bền ko cho sh 5 sao mong là có sz lớn hơn sẽ quay lại",5,
13,13,"Hàng ok lắm ạ. Nhunge còn nhiều vải thừa, nói chung là vừa tiền. Hình ảnh minh họa",5,
14,14,"💨💥 THƯỞNG THỨC MÓN CHÈ LỆ HOA  CÓ TUỔI ĐỜI LÂU NĂM CỦA CÔ NGƯỜI HOA TẠI QUẬN 6 💨💥

🏡 Hẻm 183 Tân Hoà Đông Phường 14 Quận 6 cô ngồi trước cửa nhà truyền thống ( ngay gần trường THCS Đoàn Kết ) 
⏰ 6:00 - 14:00
💥 SĐT của cô là 0934108278, cô ko rành app này kia nên mng gọi nhờ cô chú ship cũng đc",5,
15,15,"Đã nhận được hàng, chất rất ưng nhưng đi giặt mất rồi nên ko chụp đc",5,
16,16,"Rất chi là ưng ý cho sản phẩm này, chất đẹp dáng ôm, áo lại còn có mút đệm ngực🤗🤗🤗🤗🤗🤗🤗🤗",5,
17,17,"Đóng gói sản phẩm tốt! Giao hành Now cực nhanh! 
Bộ bơi rất ưng nha, vải đẹp, form đẹp, tôn dáng, che được khuyết điểm cơ thể! Có điều 2 vạch đường trắng của quần không được thẳng đều cho lắm!
Mình mượn hình ảnh feedback của khách để đánh giá luôn 😊😊😊 ",5,
18,18,OooCháot lượng oke mỗi tội lên ng m hơi vị ngắn dù lựa theo sz của shop nhưng okela ksao đồ mặc học tchat thôi 👌🏻 okokokokoooooooooooooooooolokoooooooooooooo,5,
19,19,"Eo ôi. Đồ gì mà đẹp thế. Mình 1m55 43kg vừa size M quá đi. Hịn hò giá tốt. Chất đẹp, mẫu y hình, đệm mút có thể thay được nè. Mua của shop thích ghê 😍😍😍😋😋😋",5,
20,20,"Sản phẩm giống mô tả. Áo dày dặn, có đệm ngực, đường may ổn, rất ít chỉ thừa. Phù hợp giá tiền. Shop tư vấn nhiệt tình, đúng size mặc rất vừa và còn tặng thêm 1 dây buộc tóc xinh. Thanks!",5,
21,21,Hình ảnh chỉ mang tính chất nhận xu… hàng đẹp nhưng chưa mặc thử nên k biết thế nào,5,
22,22,"Bộ này mặc đi học bơi trên trường siêu hợp lý luôn ạ
Ưng 
Ghạyckahjckahjfksieruosdhjfsgjdshiydfjueeeryhjkufssgjjfdfgjkgsfjkvvggasgkkfsghjh",5,
23,23,"Áo xinh lắm form nhỏ nên mình đặt sz L vẫn hoi kích, cơ mà áo bơi nên mặc kích thì đẹp. Áo có mút ngực có thể tháo rời nha. Đường kim mũi chỉ cẩn thận ko có chỉ thừa ưng lắm luôn.",5,
24,24,"Mua hộ nên ko có hìnhhhhh
Giao hàng nhanh khiếpppppp
Đặt ngày 15 mà 17 đã giao rồi dù mình ở Hà Nội",5,
25,25,Đồ siêu đẹp mình cực thích nhưng mà chật lắm mình mang khó chịu nhưng đồ bơi phải ôm dáng mới đẹp nên cố gắng nè,5,
26,26,"Kết hợp nguyên set này vô là siêu xinh đẹp, kín đáo vừa không sợ đen vừa không sợ lộ. Hàng y hình, giao siêu nhanh, giá lại tốt. RẤT ĐÁNG MUA NHA MN ƠI 😍",5,
27,27,Đồ xinh nha mn mình m6 48kg đồ ngoài nhìn đẹp lắm kkkkkkkkkkkkkk,5,
28,28,"Shop giao hàng nhanh, đóng gói hàng cẩn thận. 40kg mặc size M cũng ổn. Mua về để đi tập bơi thì với giá này mình thấy ổn. Mặc thoaor mái",5,
29,29,"Sản phẩm rất ok. Quần thì mọi người nên chọn lớn hơn size của mình 1 size nhé. Vải mát, nhẹ, dễ mặc. Sẽ giới thiệu vs bạn bè ạ.",5,
30,30,"🍿 Bỏng free 🍿 
Có ai giống em k ? Đôi khi rạp k có phim gì cũng đi xem phim vì nhớ vị bỏng phô mai mặn mặn nhớ vị bỏng caramel ngọt ngọt 🤤 Bình thường bịch bỏng hơn 50k lận mà cứ lần nào đi cũng phải 1 mình 1 hộp 🤣 Nhiều khi chờ phim đã ăn hết 1 hộp rồi lại phải chạy ra mua thêm 😅 
Anh chị nào ",5,
31,31,Áo xịn xò cực kì nha mng oii mình 52kg mặc vừa vặn lun mỗi tội bụng to nên hơi ngấn xíu=))) nma vẫn okila vs giá lắm nha nên mua nha mngg,5,
32,32,"Hàng đẹp , phù hợp với giá tiền mình mặc rất ưng nha mn",5,
33,33,"Hàng đẹp chất lượng
Mình rất thích
Thaoir mái
Lần tới tiepws tục ủng hokn ahop",5,
34,34,1m55 50kg vừa size L. Áo mặc ổn nhưng m mua nút ngực khác tốt hơn để thay cho đỡ ọp ẹp và nhìn có ngực hơn. Quần lưng hơi rộng phải đi bóp eo. ,5,
35,35,"Hình ảnh chỉ mang tính chất nhận Xu
Sẵn mình sẵn đồng hồ nam CK 
Giá săn sale : 2tr",5,
36,36,"Trên 54kg thì nên lấy size lớn hơn, mình 53 thấy mang khá ôm r ạ....",5,
37,37,Áo đẹp nên mua đóng gói đẹp tuyệt vời hình ảnh mang tính chất nhận xu,5,
38,38,Nznzbzbzbz. Zsisjsbwbwoaoanwbauzisbdbe dbzisbe dbxuxjxbzb,5,
39,39,Chất vải dày dặn xứng đáng giá tiền. Hình ảnh và video mang tính chất nhận xu,5,
40,40,"Giao hàng khá nhanh, mình đặt size XL mà quần hơi ngắn, chất lượng sản phẩm ok nên mua nhé 🛒🛒🛒",5,
41,41,áo y hình nha mọi người. mình cần áo gấp để học bơi nên có ib shop mà shop rep nhanh lắm luôn :33 1000/10 điểm vì thái độ phục vụ shop ,5,
42,42,Tuyệt vờiiiiiiiiiiiiiiiiiiiiiiiiiiiiiiiiiiiiiiiiiiii,5,
43,43,"Áo lên form đẹp rất là nên mua, mình cao 1m6 nặng 54kg eo 74 mà mặc XL vừa y, may bị lỗi ngay dây kéo nhưng k sao, này may lại được. Giao hàng cực kỳ nhanh. Mình đặt hôm qua, sáng nay đã nhận đc.",5,
44,44,"Hàng đẹp, phù hợp gái tiền, mình mua đi học bơi nhưng đi biển vẫn okkkkkkkkkeeeeeee.. đi biển mặc set dài tay như thế này đỡ nắng mà cũng kín đáo đối với những ai ngại mặc bikini 2 mảnh",5,
45,45,"Chất lượng sản phẩm tốt, giao hàng nhanh chóng............",5,
46,46,"Khá là đc . Hàng y hình á mng
Hihihaahaaahaaaaaaaaaaaaaaa :)))",5,
47,47,…………………. …………………. …………………. …………………. …………………. …………………. ………………….,5,
48,48,"Nhìn chung thì chất vải tạm ổn, mình nghĩ nên tăng size để phù hợp dới ai hong thích mặc ôm như mình, mình mua theo hướng dẫn size của shop nhưng xuống nước nó bó sát lại.",5,
49,49,"Chất lượng cũng okela lắm. Hợp giá tiền. Quần không quá ngắn. Hợp với người thích kín đáo như mình. 
Mỗi tội giao hàng lâu. Cần gấp mà lỡ mất việc",5,
50,50,"Rất đáng mua nha, ưng hết ý zị đó, y như hình nha, do mình đem đi giặt r nên k có hình để up
Có nhờ shop gửi hàng sớm cho mình shop hỗ trợ rất nhiệt tình, thanks shop",5,
51,51,"Với tầm giá này thì áo ok ạ. Mình mua size M nhưng trên áo k ghi size gì cả nên k biết đúng M k. Bth đồ mình mang S lấy lên 1 size như các bạn review nên mang vừa vặn đẹp luôn. Shop giao hàng nhanh, kịp lúc mình đi chợ lễ",5,
52,52,"Mình mới đặt hàng ngày hôm qua mà nay đã có hàng, shop đóng gói hàng gọn gàng, chắc chắn. Còn về áo thì thun mịn có điều size L mà mình mặc hơi chật. ",5,
53,53,Sản phẩm rất chất lượng và phù hợp với giá tiền có điều là quần hơi rộng so với áo,5,
54,54,"Đóng gói cẩn thận , chất lượng sả phẩm tốt , đáng tiền , nên mua nha mọi nguoi ",5,
55,55,Áo nhận thấy chất lượng oke lắm. Giao hàng đúng ngày. Sẽ ủng hộ shop ^^,5,
56,56,"Giao hàng siêu nhanh
Shop tư vấn nhiệt tình, mình cần gấp là shop hỗ trợ giao sớm cho mình hơn dự kiến luôn
Sẽ giới thiệu bạn bè ủng hộ shop",5,
57,57,Áo mặc thoải mái. Dáng đẹp. Đi biển đỡ bị cháy đen. Mình 52kg m53 mặc vừa ,5,
58,58,"Quần áo size M hơi chật so với mình, quần hơi bó ôm chân. Shop giao hàng nhanh
Hình ảnh chỉ mang tính chất lấy xu kkk",5,
59,59,"Giap hàng nhanh , đúng mẫu. Đồ chất liệu dày nhưng mà chỗ dây kéo may hơi xấu ",5,
60,60,Đồ vải mịn mát mình chưa mặc thử xem form thế nào nhưng nhìn chung với giá vậy là quá ổn shop tư vấn tận tình ạ,5,
61,61,1m66 48kg mặc size L vừa. Tay bị ngắn nhưng k sao. Mút ngực hơi rộng sợ xuống nước k thoải mái. Kín đáo thích hợp đi chơi công viên nước,5,
62,62,"Sản phẩm đẹp. Size ôm. Chăm sóc kh nhanh,hiệu quả. Số hotline gọi là được shop check và gửi now luôn cho mình lúc hơn 8h tối.",5,
63,63,"Áo y ảnh à, vải mát mềm mịn cũng được. Tuy nhiên giá này thì form k chuẩn lắm đâu nhưng phù hợp giá tiền nha mng 😘😘",5,
64,64,"Chất lượng phù hợp với giá tiền
Form áo nhỏ, mn nên mua rộng hơn 1size so với bình thường, đường may tay áo bị rúm k đẹp",5,
65,65,"quần áo bơi đẹp lắm ạ, mình cần hàng gấp và có gọi shop gói hàng nhanh giúp, may là lấy hàng kịp thời ạ, cảm ơn shop nha",5,
66,66,Hdkdisownbdidodkdndjdkosjsbsnsmsbdklsnsbdhdhjdjjsjsnnsnsndndnndndndndn,5,
67,67,Sảnnnnnnn phẩmmmmmmmmmm tốtttttttttttttttttttttttttt,5,
68,68,"Chất lượng sản phẩm xuất sắc, mềm mát, mua trừ hao 1 size mặc thoải mái lắm nha, thời gian giao hàng siêu nhanh",5,
69,69,"Mình 1m72, 60kg , mặc xl vừa nhé. Áo form đẹp, quần đáy may không được đẹp lắm mặc kiểu sẽ thấy nổi vải thành hình vết hằn hình tam giác. Shop tư vấn nhiệt tình",5,
70,70,"Hàng uci á, mìng 1m65 nặng 45kg mặc vừa, quần k bih ngắn đâu á, áo thì tay áo chỉ dài gần đến bàn tay thôi, bên trong áo có sẵn mút dày dặnn",5,
71,71,"đồ giống hình, mfmdkdkdkfkffkkflflfkkfkffkfkfkfkkfkfkkfkfkfkgkktkfkgkkgoykgkkggkkfkgktltlglggklfltlgkgkkfglkggkgkgkgkg",5,
72,72,"chất áo thì khá xịn xò mình rất hài lòng
Giao hàng nhanh
Đóng gói chắc chắn
Giá lại rất hạt dẻ
Nói chung là ưng lắm luôn",5,
73,73,"Hàng giao nhanh, kiểm tra thấy hàng ổn, cảm ơn shop!
Sẽ quay lại ủng hộ thêm, chúc shop ngày càng bán đắt  khách❤️❤️❤️",5,
74,74,"Đồ giao cực nhanh, mới hôm qua đặt mà hôm nay nhận được rồi. Áo có mút sẵn rất tiện, đồ ôm dáng đẹp ........",5,
75,75,"Chất ok, k mỏng cũng k dày, áo có sẵn mút ngực rồi, mặc vừa vặn nhưng váy lại hơi rộng bụng. Size  đúng với số cân mô tả",5,
76,76,vải xịn hơn mình mua mấy bộ 200 mấy nữa á. form khá ok nuôn ♥️ mn nên mua nha,5,
77,77,"Shop giao hang nhanh lam, 1 ngay la co, nhung ma quần đáy ngắn qua, moi thu ok het , chỉ co quần đáy ngắn",5,
78,78,"Bộ đồ bơi y hình, shop giao hàng và chuẩn bị rất nhanh, mỗi tội quần hơi bó mặc hơi khó chịu chút",5,
79,79,"Vải mát, quần hơi ôm với mình huhu
Nhưng mà mặc lên xinh lắm nha, mình cao 1m62 nang 50kg mặc lên tôn dáng cực
Mình cần gấp, nt shop thì shop trl siêu nhiệt tình luonnn",5,
80,80,"Hàng đẹp. Shop nhiệt tình và ship nhanh cực.
Áo độn mút rất tiện. Giá bằng phân nửa mấy cửa hàng ngoài thôi.",5,
81,81,"Quán nem nướng mới mở tại số 32 ngõ 87 Lê Văn Hiến khá ok dành cho ae vừa thi xong đây. Quan trọng quả nước chấm ngon với quán cũng sạch sẽ, đồ ăn ngon, tôi về không thấy đau bụng gì thì khá là ok đấy. Đến nhanh không hết khuyến mại =)))
Giá: 25k/suất
——
#aof #aoftroll #reviewfood",5,
82,82,Vải đẹp dày ôm eo đẹp ship hàng nhanh đóng gói sản phẩm rất đẹp bộ trắng hơi mỏng macej lớn hơn một size thì ok,5,
83,83,"Hình với video k liên quan hihi
Nhưng chất lượng oke nhé
Với giá này thì ổn áp
Sẽ ủng hộ thêm",5,
84,84,"Mình 1m59-49kg size L nha. 
Đồ bơi khá ok và rẻ. Mn đặt nên tăng thêm 1 size vì mình tăng size mà đã ôm và fit hẳn luôn rồi.",5,
85,85,"Shop giao hàng nhanh, mẫu y hình, áo có 2 miếng mút đệm ngực, kín đáo. Cảm ơn shop nhiều nhé",5,
86,86,Mình 45kg mà mặc size L hơi chật tí. Chất vải siêu đẹp đáng đồng tiền. Mn nên mặc đồ bơi tay dài tránh bắt nắng nhé ,5,
87,87,"Chất lượng sản phẩm okelaaaa lắm nha
Vì sợ quần ngắn nên mình mua quần lửng riêng và áo rời
Về mặc vừa, chất liệu cũng thoáng mát mịn nữa
Vì mình lười quay lại quá nên lấy ảnh có sẵn",5,
88,88,"Hàng okie lắm ạ. Sẽ ủng hộ shop lần sau nữa
Hehehehehehehehehe",5,
89,89,"Áo đẹp, chất lượng tốt, mình 56kg mặc hơi rộng xíu như thế cho thoải mái",5,
90,90,"Giao hàng nhanh , mình chưa mặc thử nên chưa biế có vừa hay không , vẫn cho shop 5*",5,
91,91,"Áo vải mịn đg may khá chắc chắn cổ áo hơi lệch nhg vx ổn có lớp lót với mút hơi mỏng,size M m6 45kg mặc hơi rộng eo 1 tí, size XL m62 57kg mặc bị chật ngực nhg rộng tay",5,
92,92,"Hàng quá đẹp so với giá tiền, chất cũng ok lắm luôn. Mìn 59kg, 1m54 mặc XL vừa sát ngươi jd",5,
93,93,"Giao hàng siêu nhanh, hôm qua đặt mà hôm sau đã có hàng liền.
Vải và đường may siêu xịn xò. ",5,
94,94,"Thời gian giao hàng nhanh chỉ khoảng 2 ngày là có, đồ bơi vừa vải khá tốt so với giá tiền. ",5,
95,95,"Mình nặng 65kg cao 1m67 mặc size XL bao vừa nha, phần cổ hơi ngắn xíu. Chất mát, giao hàng cực nhanh, các bạn nên mua",5,
96,96,Hàng đẹp lắm nha sẽ ủng hộ shop tiếp nè 😍😍😍giao hàng nhanh nữa chứ  nói chung oke,5,
97,97,"Shop giao hàng nhanh, đóng gói sp chắc chắn, chủ shop nhiệt tình uy tín, giá tốt",5,
98,98,"Shop giao hàng nhanh, đóng gói sp chắc chắn, chủ shop nhiệt tình uy tín, giá tốt",5,
99,99,"Giao hàng nhanh, chất vải hơi bóng, mặc ôm sát, có đệm ngực, phù hợp mua học bơii",5,
100,100,"Video mang tính chất nhận xu , áo đẹp , giao hàng nhanh, sẽ quay lại ủng hộ lần sau ",5,
101,101,"Sản phẩm tốt, mặc ôm dáng, m đặt rộng hơn 1 sz cho thoải mái nhưng vẫn vừa",5,
102,102,"Áo vải xịn, mềm, siêu mát, kín đáo, giao hàng siêu nhanh. Mẫu giống y ảnh luôn ",5,
103,103,"Rẻ mà chất ok, với giá tiền này thì nên mua nhaaaa, nhận xong ưng ghê",5,
104,104,"Đáng đồng tiền bát gạo các bác ạ . Nó đẹp gì đâu luôn ây , nên mua nhé mọi nguoi",5,
105,105,Áo thì okela mà hơi buồn cho vết bục rách này giống như móc phải đâu đấyyyy,5,
106,106,Chất vải khá oke. Giao hàng nhanh. Nhưng quần bó và chật quá mặc k đẹp,5,
107,107,"Chat thum mat ôm, phom cua shop nhỏ, size XL tuong duong size M. Tay áo hơi ngắn ",5,
108,108,Rất là chất lượng nha các bạn 👍👍👍👍👍👍👍👍👍👍👍👍👍👍👍👍👍👍👍👍👍👍👍👍👍👍👍👍👍👍👍👍👍👍👍👍👍👍👍👍,5,
109,109,"Áo chất co dãn chất sờ mát tay
Chưa thử nên k biết vừa hay khôngggggg",5,
110,110,"Bộ đồ bơi giống hình, 63kg mặc vừa, nếu có như cầu sẽ cân nhắc mua thêm",5,
111,111,Hàng xinh giao nhanh lắm nha giá cả phải chăng nói chung oke lắm ,5,
112,112,Săn dk hàng 1k nên thấy rất vui. Sản phẩm okela. Shop nhiệt tình 💗,5,
113,113,"Shop giao hàng nhanh, đóng gói hàng chắc, vải và đường may đẹp lắm ạ",5,
114,114,Áo đẹp.  Giá quả rẻ.  Sau này sẽ ủng hộ típ nha nha nha nha nha nha !!!!! ,5,
115,115,Mua về học bơi mac chưa bơi đc bữa nào luôn hâhhahahahahahahahah,5,
116,116,Giao hàng nhanh. Chất lượng quá tốt so với mức giá này. Thanks shop ,5,
117,117,"Giao hàng khá nhanh, chất lượng sản phẩm tốt, sẽ ủng hộ shop lần sau",5,
118,118,"Áo đẹp, k giãn lắm nên mua rộng hơn size thường mặc cho thỏai mái",5,
119,119,"chất liệu oke
áo có lót đệm
chất lượng hhhhhhhhhhhhhhhhhhhhhhh",5,
120,120,Giao hàng tấm 3 ngày tuy đặt đến sixe XL nhưng mặc vào vẫn khá nhỏ. ,5,
121,121,"quá xịn quá xinh hihihihihi vải gì lạ lạ nhưng mặc ổn lắm, nhanh khô nữa",5,
122,122,"Đồ rất đẹp, mặc form cũng đẹp. Shop giao hàng nhanh đóng gói đẹp.",5,
123,123,"Giao hàng nhanh
Chất vải đẹp
Shop tư vấn tận tình
Đóng gói sản phẩm cũng hông đẹp lắm ",5,
124,124,"Đồ vải đẹp, mặc rất vừa người, đúng size mong muốn. Ví nhìn cưng",5,
125,125,iiiiiiiiiiiiiiiiiiiiiiiiiiiiiiiiiiiiiiiiiiiiiiiiiiii,5,
126,126,Đã nhận được hàng rồi ạ. Đồ chất lượng lắm và đẹp lắm ạ........,5,
127,127,"Giao hàng rất nhanh, chất lượng xịn, giá quá bèo nè, cảm ơn shop",5,
128,128,"Form nhỏ, vải hơi mỏng, giao hàng nhanh, đóng gói cẩn thận...",5,
129,129,Sản phẩm được đóng gói cẩn thận giao hàng nhanh chất lượng tốt ,5,
130,130,Áo ok nhưng tay áo hơi ngắn với lại mút ngực bị méo nhìn k được ok lắm cảm ơn shop,5,
131,131,"Đồ chất liệu ok,  hài lòng vì với mức giá này như vậy là quá ổn. Hình ảnh mang tính chất nhận xu",5,
132,132,Okeeeeeeeeeeeeeee lắmmmmmm làm biếnggg chụo ảnh thoing cảm,5,
133,133,"Chất liệu vải tốt. Miếng mút ngực hơi mỏng. Mình cao 1m58 nặng 53,5kg mua sz L mặc hơi chật...............",5,
134,134,Đồ bơi ở đây phải nói là okkkk lắm luôn á. Chất vải cực kì ổn áp luôn nha. Mặc lên xinh lắm. Sẽ quay lại mua thêm nha 👌🏻👌🏻👌🏻👌🏻Thêm nữa giao hàng nhanh lắm nha đặt nay mai có luôn nha ( nội thành nha ) ,5,
135,135,Sản phẩm đáng giá tiền ạ. So với mua ngoài thì rẻ hơn rất nhiều. ,5,
136,136,Okkkkkkkkkkkkkkkkkkkkkkkkkkkkkkkkkkkkkkkkkkkkkkkkkkkkk,5,
137,137,Đuejdjjxjjjsjwjsjjxhsjkzkwjevsjxhhejshwjwjjsjsjsjh,5,
138,138,"Quần bị chật, áo oke nên mu&&:&::&&/@/@//@:!!:!,’xnxnxnh",5,
139,139,Vải áo mát lắm ạ. Sory vì hình ảnh k liên quan ạ,5,
140,140,Hàng đẹp lắm mọi người ạ hình ảnh chỉ mang tính chất minh hoạ ..,5,
141,141,"Shop chuẩn bị hàng giao hàng siêu nhanh, đúng phân loại. Áo mặc ôm tôn dáng giá rẻ",5,
142,142,"Giao hàng nhanh. Chất lượng sản phẩm tốt, y hình. Đóng gói sản phẩm chắc chắn. Rất đáng tiền.",5,
143,143,"Sản phẩm tốt, vải dày dặn, ôm sát người, from rất đẹp, đáng tiền❤️",5,
144,144,Mua dùm nên không biết chất lượng sản phẩm như nào nữa😝😝😝😝😝😝😝,5,
145,145,"Sản phẩm rất tốt,  chất vải oke, mình 46 kg mang vừa in lun :)))))))",5,
146,146,"Ảnh không liên quan vì lấy xu ,nhưng mà ship nhanh với vải ok lắm mọi người nên mua nha không thất vọng ",5,
147,147,"đồ đẹp, đáng mua, mình 1m60 46kg mặc M vừa in luôn 💗💗💗💗💗💗💗💗💗💗💗💗💗💗💗💗💗💗💗💗💗💗💗💗💗💗💗💗💗💗💗💗💗💗",5,
148,148,"Mình 1m64 63kg mặc XL vừa đẹp nhé ạ!
Hàng vải mỏng nhẹ, mặc không bị bí. Quá ổn so với giá cả!",5,
149,149,"Ok, bạn mình 51kg mặc size L hơi chậtttttttttttt
(Ảnh và clip không liên quan ạ) ",5,
150,150,"Mình 48.5kg, 1m58 mặc size M khá vừa nhưng quần hơi ngắn và chật, nhưng vẫn ok ạ",5,
151,151,51kg mua size L về mặc hơi rộng phần thân. Chất cũng tạm ổn so với giá tiền,5,
152,152,"Đồ pơi đẹp lắmmm luôn ạaaaaaa
Giao hàng siêunhanhhhhhhhhhhh",5,
153,153,Hàng chất lượng tốt sorry vì cam của mình hơi cùi nên hơi mờ. Nhưng mình rất thích nha,5,
154,154,"Phù hợp với giá tiền. Shop dễ thương, tư vấn nhanh
Ảnh và video không liên quan",5,
155,155,các bạn tầm 47-50kg vẫn nên mua size L nhé vì quần hợ i bó ý còn áo thì vừa vặn lắm ,5,
156,156,"Rất ổn, vừa đẹp:) quần hơi chật tí nhưng không sao-)thks shop nhiều hihi",5,
157,157,"Chất vải co giãn tốt, giao hàng nhanh, mình  cao 1m52 nặng 44kg mặc vừa size M đẹp lắm luôn nhen",5,
158,158,Sản phẩm đẹp tuyệt vời đóng gói đẹp. Hình ảnh và video mang tính chất lấy xu,5,
159,159,Đồ oke lém nhưng mà mình quên quay vs chụp rồi. Nói chung là good ,5,
160,160,"Cmt lấy xu
Đồ đẹp giá phải chăng
Aaaaaaaaaaaaaaaaaaaaaaaaaa",5,
161,161,"Giao hàng nhanh, xịn , muaaaaa.........................",5,
162,162,"Chất lượng tốt, giao hàng nhanh
Khóa kéo trước nên hơi ngứa
Hàng ổn, sẽ tiếp tục ủng hộ shop",5,
163,163,Nên mua nha mọi người ơi 😍,5,
164,164,"Đồ đẹp vừa ý, ko có hình chụp lấy đỡ hình trên",5,
165,165,,5,
166,166,"Hàng đẹp , giá tốt",5,
167,167,Nhà nghèo đèn tối chụp hơi phèn . Chất ok quần may hơi kì kì mặc vào cứ sao sao,5,
168,168,Hàng ok,5,
169,169,"Sản phẩm chuẩn okela quá luôn nè, gói hàng cẩn thận nữa, mua shopee nhiều nên ko lo lắng gì cả 👍🏻👍🏻😅😅",5,
170,170,"Đồ đẹp, chất liệu thun dày vừa phù hợp với giá tiền, mình 56 kg chọn XL bận vùa đẹp lắm. 
d
Đường may của quần vô thun k đều  nếu may dằng thêm. đường chỉ nũa ok . 5 sao nhé",5,
171,171,"Đẹp lắm đó ạ, mình m6 44kg mặc M là vừa r mặc kín đáo nên mua nhé ạ!!",5,
172,172,Nên đặt lên 1 sz,5,
173,173,,5,
174,174,Sản phẩm rất đẹp vải tốt okkkkkkkkkkkkkkkkkkkkkkkkkkkkkk,5,
175,175,Chất vải oke. Nên mua nha cả nhà,5,
176,176,Niqjwbbbkskwbwhjsbsbwjsjbsbwjwksn,5,
177,177,Những ai ăn mặc thường ngày kín đáo có thể mua set đây. Sản phẩm chất lượng. Trong có mút nếu ai có ngực bé  như mình 🥲 thì phù hợp không cần thay mút.,5,
178,178,"áo đẹp chất dày dặn rất thich 
Phù hợp với giá tiền lắmm nhé",5,
179,179,"Chất quá đỉnh giày dặn ưng hết chỗ nói giao hàng nhanh 
Mình 49kg cao m6 mặc vừa sz M",5,
180,180,"Đẹp ạ ,mang vào bó sát người,có mút ngực điểm này mình thích nhất ,quần khá chật vào phần dưới nên đi nó hơi khó chịu tí ♥️ đăng ảnh tạm đc ạ",5,
181,181,"Mik ko ngờ giao hàng nhanh dị luôn á ,đồ chất lượng ,đúng mẫu và rất đẹp nhé shop 💯🤪✌️✌️✌️✌️",5,
182,182,"Tiền nào của nấy, thun co giãn, hơi chật ở phần ngực, đường chỉ cũng tạm",5,
183,183,"Rất vừa và ưng 2 bộ đồ bơi, shop giao hàng nhanh, tặng shop 5 sao nha!",5,
184,184,"❌ Chọn size còn phụ thuộc chiều cao nữa ạ. Nên khách inb shop để đc tư vấn chính xác nha ❌

❤️Cam kết 100% sản phẩm y hình
❤️Khách có thể thoải mái inbox để nhận được sự tư vấn
Hoặc ghé shop để thử trực tiếp
❤️Chất liệu
Thun lạnh, dày, mịn mát
Co dãn 4 chi",5,
