,Unnamed: 0,khach_cmt,rating,shop_phan_hoi
4163,84,váy đối cs tui thì hơi ngắn á huhu gahzhsjzjgsjyskyhdjdhdyeyeuxjdjjcjjfuduyeyywyeueudurududhdhdhxhxjcjckvkvjxjdjfjfjdhdhdhdjđjf vải thích lắm luôn á nèee,5,"😍 QUÝ ZỊ ƠI KHÁCH NHÀ EM UÝNH GIÁ EM 5* LUÔN NÈ 😍 \n
Jami trân quý buithuthu07 đã mua hàng và đánh giá ^^
Mong đươc đồng hành với bạn trong thời gian tới^^
Jami luôn lắng nghe bạn, nhắn tin góp ý giúp Jami cải thiện mỗi ngày nha <3"
4164,85,"Ẩn phẩm chất lượng giao hàng nhanhhhhhhh
Shop phục vụ rất tốtttt",5,
4165,86,"Đồ xiu đẹp, mặc lên hack dáng lắm nha, shop giao nhanh, nhiệt tình tư vẫn",5,"♥️ chíu chíu bắn tim khách nè -->>> <3
cảm ơn khách yêu đã uýnh giá 5* ạ. Mong được khách uýnh thêm 10000000 cái nữa
Jami luôn lắng nghe và cải thiện hãy nói Jami nghe nha
Love you 3e^∞"
4166,87,giao hàng nhanh chóng vải đẹp lắm ạ mng chọn lớn hơn 1 size cho thoải mái nheee,5,"😘 HÌNH NHƯ EM ĐÃ IU  pizing21  TỪ CÁI NHÌN ĐẦU TIÊN 
khách tặng em 5* như này tim nào chịu nỗi ối giời ơiii
Cảm ơn và giới thiệu bạn bè giúp Jami nha

-----
Jami luôn lắng nghe và cải thiện mong bạn nói Jami ngheeeee nha"
4167,88,đồ rất đẹp và ưng cái bụng lắm nhaa ;)))) sau này nhất định ủng hộ shop típ 🥰🥰,5,"♥️ chíu chíu bắn tim khách nè -->>> <3
cảm ơn khách yêu đã uýnh giá 5* ạ. Mong được khách uýnh thêm 10000000 cái nữa
Jami luôn lắng nghe và cải thiện hãy nói Jami nghe nha
Love you 3e^∞"
4168,89,shop phục vụ ổn…..shipper thân thiện…. nhiệt tình…..rất đáng tiền,5,"😘 HÌNH NHƯ EM ĐÃ IU  t.hong_gg  TỪ CÁI NHÌN ĐẦU TIÊN 
khách tặng em 5* như này tim nào chịu nỗi ối giời ơiii
Cảm ơn và giới thiệu bạn bè giúp Jami nha

-----
Jami luôn lắng nghe và cải thiện mong bạn nói Jami ngheeeee nha"
4169,90,Hơi bị xịn xịn lun ắ mn. Như mn ns áo k chui lọt nhưng mà zo cái cổ hơi ôm th còn phần áo vẫn mặc thoải mái như thường.váy có phần hơi ngắn..nếu váy dài thêm nx thì okila lun..sẽ tiếp tục ủng hộ nè..váy là có quần bên trong nha k như mấy shop kia nên là 1+ về phần váy nè,5,"😍 QUÝ ZỊ ƠI KHÁCH NHÀ EM UÝNH GIÁ EM 5* LUÔN NÈ 😍 \n
Jami trân quý tamdinh7126 đã mua hàng và đánh giá ^^
Mong đươc đồng hành với bạn trong thời gian tới^^
Jami luôn lắng nghe bạn, nhắn tin góp ý giúp Jami cải thiện mỗi ngày nha <3"
4170,91,"Hàng rất ok đáng tiền nha mn, rất nên mua ạ...................",5,"😘 HÌNH NHƯ EM ĐÃ IU  toqyen  TỪ CÁI NHÌN ĐẦU TIÊN 
khách tặng em 5* như này tim nào chịu nỗi ối giời ơiii
Cảm ơn và giới thiệu bạn bè giúp Jami nha

-----
Jami luôn lắng nghe và cải thiện mong bạn nói Jami ngheeeee nha"
4171,92,Shop đáng iuu nha chất vải mát mặc lên rất ôm người thấy nhiều bạn chê chật nhưng mình thấy khá ổn mình ~42kg-m53 tay áo cũng ko bị dài quá  shop tặng kèm cả scrunchies và giấy hướng dẫn dùng và hướng dẫn đổi trả luôn,5,"😘 HÌNH NHƯ EM ĐÃ IU  haheo1411  TỪ CÁI NHÌN ĐẦU TIÊN 
khách tặng em 5* như này tim nào chịu nỗi ối giời ơiii
Cảm ơn và giới thiệu bạn bè giúp Jami nha

-----
Jami luôn lắng nghe và cải thiện mong bạn nói Jami ngheeeee nha"
4172,93,Đồ bơi xinh xỉu luôn á shop ơi. Shop giao hàng nhanh và tặng đồ xinh nữa,5,"♥️ chíu chíu bắn tim khách nè -->>> <3
cảm ơn khách yêu đã uýnh giá 5* ạ. Mong được khách uýnh thêm 10000000 cái nữa
Jami luôn lắng nghe và cải thiện hãy nói Jami nghe nha
Love you 3e^∞"
4173,94,"Sản phẩm giống hình, chất vải ok, nên mua nha mọi người 👍👍👍👍👍👍👍",5,"😘 HÌNH NHƯ EM ĐÃ IU  minhtam13_07  TỪ CÁI NHÌN ĐẦU TIÊN 
khách tặng em 5* như này tim nào chịu nỗi ối giời ơiii
Cảm ơn và giới thiệu bạn bè giúp Jami nha

-----
Jami luôn lắng nghe và cải thiện mong bạn nói Jami ngheeeee nha"
4174,95,"Đẹp hết nước chấm luôn. Mọi người nên mua nha, sẽ che được khuyết điểm bụng dưới á",5,"😘 HÌNH NHƯ EM ĐÃ IU  aiemqd1x_e  TỪ CÁI NHÌN ĐẦU TIÊN 
khách tặng em 5* như này tim nào chịu nỗi ối giời ơiii
Cảm ơn và giới thiệu bạn bè giúp Jami nha

-----
Jami luôn lắng nghe và cải thiện mong bạn nói Jami ngheeeee nha"
4175,96,Vải dày đẹp. Mình 1m63 nặng 52 kg. Mua size L nhưng còn bị chật hông 1 tí. Hiuhiu. Shop nhiệt tình,5,"😍 QUÝ ZỊ ƠI KHÁCH NHÀ EM UÝNH GIÁ EM 5* LUÔN NÈ 😍 \n
Jami trân quý phanthidieulinh đã mua hàng và đánh giá ^^
Mong đươc đồng hành với bạn trong thời gian tới^^
Jami luôn lắng nghe bạn, nhắn tin góp ý giúp Jami cải thiện mỗi ngày nha <3"
4176,97,"Vải rất dày dặn và mát, không ngờ với cái giá này lại có bộ đồ đẹp dị. Còn tặng thêm cái dây buộc tóc dễ thương",5,"♥️ chíu chíu bắn tim khách nè -->>> <3
cảm ơn khách yêu đã uýnh giá 5* ạ. Mong được khách uýnh thêm 10000000 cái nữa
Jami luôn lắng nghe và cải thiện hãy nói Jami nghe nha
Love you 3e^∞"
4177,98,"Bên vận chuyển giao lâu. Bù lại hàng rất đẹp, rất đáng công chờ đợi, còn được tặng cột tóc xinh xinh. Love shop",5,"♥️ chíu chíu bắn tim khách nè -->>> <3
cảm ơn khách yêu đã uýnh giá 5* ạ. Mong được khách uýnh thêm 10000000 cái nữa
Jami luôn lắng nghe và cải thiện hãy nói Jami nghe nha
Love you 3e^∞"
4178,99,"Giá 132k cả ship là quá hời lun. Rất đáng mua, mặc thoải mái lắm mọi người ơi
Mới sinh e bé nên còn hơi mập, 1m6 58kg nha mọi người",5,"😘 HÌNH NHƯ EM ĐÃ IU  xo543xqngf  TỪ CÁI NHÌN ĐẦU TIÊN 
khách tặng em 5* như này tim nào chịu nỗi ối giời ơiii
Cảm ơn và giới thiệu bạn bè giúp Jami nha

-----
Jami luôn lắng nghe và cải thiện mong bạn nói Jami ngheeeee nha"
4179,100,"Wow! Mua bộ đồ bơi mà ưng hết sức. Mình mua đợt sale nên khá rẻ lại siêu chất lượng. Mình 42kg, m55 mặc size m vừa khít. Áo có lớp lót êm, váy có quần trong bảo hộ, cả áo và quần đều có bo chun ôm người. Vải ok. Mua đồ rẻ lại còn đc tặng quà, chắc chắn sẽ mua thêm và giới thiệu bạn mua đồ của shop😍",5,"Jami trân quý cảm ơn  nganhuynh99 đã mua hàng và đánh giá shop ^^
Mong đươc đồng hành với bạn trong thời gian tới, ^^
Nếu có gì không hài lòng ibx Jami nha"
4180,101,"Mình cao m52, 46kg mặc vừa size M nhưng quần hơi rộng 1 xíu cơ mà lên form vẫn đẹp, cảm ơn shop tặng thêm len cột tóc nữa.( lúc chụp hình hóp bụng mới lên hình đẹp xíu^^)",5,
4181,102,"Quá hài lòng về sản phẩm, vải tốt, đường may chắc chắn, kiểu dáng rất kín đáo nhưng vẫn gợi cảm, tôn dáng người mặc. Shop giao hàng nhanh, phục vụ tốt, đặc biệt là rất thích lời nhắn nhủ dễ thương và món wà đáng yêu của shop. ",5,
4182,103,Vào đẹp from đẹp.cao 1m65 nang 60kg mặc  vào hok bị mập lắm,5,
4183,104,"Áo đẹp lắm ạ, mình rất ưng, lại còn được tặng đồ cột tóc xinh xinh nữa. Mình còn mua trúng đợt khuyến mãi nữa. À shop giao hàng cũng rất nhanh. Cám ơn shop.",5,
4184,105,"Nhận được hàng rất ưng luôn
Giá ok hàng đẹp 
Vãi mắt
Mặc vừa lắm luôn
Giao hang nhanh
Shop phục vụ rất tốt 
Còn được tặng thêm quà nữa ",5,Cảm ơn b đánh giá nhưng từ “vãi mắt” chắc là khách yêu đánh nhầm là vải mát ý mn ơi ❤️
4185,106,"May mà mình đặt sz L shop nhé hehe =)) mình 1m58 48kg mặc vừa như này nhé, shop còn tặng dây chun siêu xinh tớ đeo ở tay đó :))) mọi người ủng hộ shop nha",5,
4186,107,"Rất hài lòng về sản phẩm này, chất vải ổn, giá cả phù hợp vs chất lượng.
Có quà vs giấy cảm ơn từ shop nữa 😊",5,
4187,108,"Vì chưa kịp chụp hình fb cho shop nên lấy đại 
Đồ rất đẹp 
Hàng giao Siêu siêu siêu nhanh
Đặt tối thứ 5 cỡ trưa thứ 6 đã có 
Mong shop luôn buôn may bán đắt ",5,
4188,109,Đồ bơi kín nhưng vẫn rất trend. Vải tốt. Có size nữa nên rất ưng. Feedback cho shop tấm ảnh của mình. Đồ vừa về xong lôi ra mặc thử đó.,5,"♥️ chíu chíu bắn tim khách nè -->>> <3
cảm ơn khách yêu đã uýnh giá 5* ạ. Mong được khách uýnh thêm 10000000 cái nữa
Jami luôn lắng nghe và cải thiện hãy nói Jami nghe nha
Love you 3e^∞"
4189,110,Áo đẹp quá trời luôn á. Bên trong có may thêm áo ngực nên hoàn toàn yên tâm,5,"😍 QUÝ ZỊ ƠI KHÁCH NHÀ EM UÝNH GIÁ EM 5* LUÔN NÈ 😍 \n
Jami trân quý skuphoria15.4 đã mua hàng và đánh giá ^^
Mong đươc đồng hành với bạn trong thời gian tới^^
Jami luôn lắng nghe bạn, nhắn tin góp ý giúp Jami cải thiện mỗi ngày nha <3"
4190,111,"Chất đẹp, chắc chắn, co giãn vừa đủ. Mút ngực to ko bị xê dịch lên xuống khi bơi. Mình 58kg mặc XL rất vừa vặn. Có nhiều shop bán i mẫu nhưng freesize. Thấy shop bán có chia size nên rất ưng. Sẽ quay lại ủng hộ! ",5,
4191,112,"Bộ này mặc vào siêu xinh ạ 😍 Chị chủ shop tư vấn nhiệt tình, vải đẹp mà giá rẻ nhất shopee nữa( mình tìm hết các tiệm trên shopee rồi nhe :v) Nhận hàng còn được tặng kèm lời chúc và kẹo ổi í 👌🏻❤️ ",5,
4192,113,"Sản phẩm rất đẹp, mặc vào bao thích luôn, nói chung rất chi là xin xò, giá rất chi là rẻ nữa, sẽ ủng hộ shop dài dài",5,Cảm ơn b
4193,114,"Hàng đẹp hơn mong đợi. Góp ý nếu chân váy xếp li 1 chút sẽ đẹp hơn, vì váy này xuống nước sẽ ôm sát nhìn hơi phản chủ :))))) sẽ ủng hộ shop khi hết dịch bệnh để đi du lịch tiếp :))))",5,Cảm ơn b để m nói với team may
4194,115,đồ đẹp so với giá nên mua bạn nào sợ hở nên mua có điều váy xuống nước nó nổi lên thấy quần tam giác luôn,5,Dạ cảm ơn b. Mà quần k lộ mông nè *^^* quâng đó sat nha á k hẳn tam giác ạ bên m có quần đùi nữa
4195,116,Đồ rất đẹp lấy rộng thêm 1 size thì mặc sẽ rất vừa người giá rẻ giao hàng nhah còn được cột tóc dễ thương,5,
4196,117,"Bikini ôm dáng và rất xinh. 
Bên shop hỗ trợ rất nhanh và nhiệt tình chu đáo.
Sẽ lại ủng hộ khi có dịp nhé ạ ❤",5,🌺🌺
4197,118,"Shop đóng gói cẩn thận, mình mặc thử váy vừa nhưng áo thì vai với tay áo rộng quá ko biết làm dao đây :((( ko biết đem đi đưa cho thơ may bóp lại đc ko shop :((",5,
4198,119,"Shop bán đồ dth, còn có quà tặng nữa.
Chất liệu vải ok.
Chưa mặc thử nhưng thấy cũng ok lắm",5,
4199,120,"Giao hàng khá lâu. Nhưng bù lại đồ may đẹp. Chất vải dày dặn, đương chỉ may cẩn thận chắc chắn. Phần mút ngực được may cố định nên k sợ bị lệch khi bơi ",5,Dạ b thông cảm ghtk bị vỡ á nên giao lâu
4200,121,Mình mua bị chật cần pass lại ạ . New 100% mình chưa bận lần nào . Mình ở tphcm,5,Bn đổi k b ơi. Qua nhà m đổi cho nha
4201,122,"Quá tuyệt vời lun , chất liệu sản phẩm tuyệt vời, lần đầu tiên mua mà ưng quá ",5,
4202,123,"Đồ bơi vô cùng ưng luôn, co dãn tốt không bị lỗi, giá vừa túi tiền siêu xịnnnn ❤️ Không bị bó hay quá rộng ạ, khoe eo nhưng vẫn rất kín đáo 🌸",5,
4203,124,"Shop vô cùng tận tình và đáng yêu, chất lượng tốt , ưng ý cũng như nếu bạn cần hàng gấp cứ inb cho shop , mình đặt hôm T7 hay CN gì đấy nhưng T3 cần phải mặc thì tadaaa, anh shipper đã giao nó vào cuối ngày , cảm ơn shop nhiều ❤️",5,
4204,125,Hàng giao nhanh sp rất đẹp nha mn mình cao m64 51kg mặc vừa size L nha,5,"😘 HÌNH NHƯ EM ĐÃ IU  huongdinh3006  TỪ CÁI NHÌN ĐẦU TIÊN 
khách tặng em 5* như này tim nào chịu nỗi ối giời ơiii
Cảm ơn và giới thiệu bạn bè giúp Jami nha

-----
Jami luôn lắng nghe và cải thiện mong bạn nói Jami ngheeeee nha"
4205,126,"Shop tư vấn nhiệt tình, đồ rất đẹp, giao hàng nhanh, sẽ tiếp tục ủng hộ",5,
4206,127,"Được shop tặng dây cột tóc xinh xinh, có điều shopee giao hàng lâu quá, đặt 5 ngày mới giao cho mình",5,Cam on b chắc do bên ghtk trúng dịp sale nên lâu ấy
4207,128,Đóng gói sản phẩm kỹ càng. Sản phẩm giá tốt. Chất lượng sản phẩm phải thử mới biết. Giao hàng nhanh chóng. Hài lòng với sản phẩm.,5,
4208,129,Thật sự bất ngờ khi chất lượng sp vượt ngoài sức mong đợi luôn ý ạ. Shop còn tặng kèm dây chun cùng phiếu cảm ơn nữa. Sẽ ủng hộ shop trong tương lai nữa ạ,5,
4209,130,"Đồ đẹp, shop còn tặng dây cột tóc siêu xinh
Giao hàng cũng nhanh nữa",5,
4210,131,"Sản phẩm y hình, rất ưng ý với sản phẩm.
Chất lượng sản phẩm tuyệt vời.",5,
4211,132,"Sản phẩm đẹp, dày dặn, shop tư vấn nhiệt tình. Sẽ ủng hộ nữa ❤ mong shop lấy thêm nhiều mẫu nữa cho ng bíu như mình 🤣",5,Cảm ơn b nhaaa
4212,133,"Hàng về nhanh, chất k dày k mỏng ncl ổn. Mặc hơi kích 1 chút nhưng mà ksao. CSKH tốt tặng kèm quà và thư cảm ơn. Recommend nha",5,
4213,134,"Tay áo hơi rộng, với váy xoè từ trên cao, nên ôm từ eo tới mông rồi xoè thì đẹp hơn. Mặc lên nhìn lùn lùn mập mập kiểu gì :( thấy bụng mỡ nhiều luôn á huhu",5,
4214,135,"Vải đẹp mát co dãn đường chỉ chắc chắn 
Mỗi cái quần trong không phải quần đùi, nhưng không lộ lắm. Đáng mua nha ",5,
4215,136,"chất vải mát, đường chỉ may đẹp, đóng gói hàng chắc chắn, còn có thư và dậy cột tóc nữa🥰 rất chi là dễ thương =))) mọi người nên mua nheee 
p/s gương em hơi dơ ạ",5,
4216,137,"Hàng đẹp y hình luôn, chất vải đẹp, mình còn đc tặng thêm kẹp tóc, cảm ơn shop nhiều luôn, sẽ mua lại ủng hộ",5,
4217,138,"Đồ đẹp lấm nhe, vải ok, chất lượng , giá vậy ok hơn so với mấy shop khác ",5,
4218,139,Nhìn đẹp. Mặc lên nhìn khá là xinh. Cảm ơn shop nhiều lắm vì đã hỗ trợ hết mình khi mình muốn đổi hàng. ,5,
4219,140,"Hàng quá là vừa ý em luôn, vải tốt lắm ạ. Giao hàng cũng nhanh lắm ạ",5,
4220,141,"Đồ bơi giống như hình, lúc đầu định chọn size S mà chọn size M là ok. Mình cao 1m60 nặng 44kg ",5,
4221,142,Vải dày vừa vặn đẹp giá lại ok giao hàng nhanh rất hài lòng về sản phẩm sẽ ủng hộ tiếp❤❤❤❤❤❤,5,
4222,143,"Hàng đẹp, giá tốt. Không còn chỗ nào để chê. Shop đóng gói cẩn thận, còn tặng thêm 1 dây bụt tóc nhỏ nhỏ xinh xinh.",5,Cảm ơn bạn ạ ^^
4223,144,"Ăn tết xong hơi ngấy nhưng mang đồ shop tự tin hẵn, vải co giãn tốt và shop có tặng quà nho nhỏ. ",5,😘😘😘😘
4224,145,Hinh anh duong may sac net dhop giao hang dung hen nhiẹt tinh cam on co keo chuc shop dat ,5,
4225,146,Hàng đẹp okela hshsvvsgsgsvvsvscscsvsghwsg svscsvsvshshshshshshshshshshdvdvdvdvdvdv,5,"Jami bikini chất giá rẻ xin cám ơn đánh giá của bạn.  Jami bikini chất giá rẻ Chúng tôi luôn hy vọng mang lại sự hài lòng cho phuongsmile1008kute , chúc bạn luôn vui vẻ và mong bạn tiếp tục ủng hộ Shop trong lần trải nghiệm mua hàng tiếp theo nhé!"
4226,147,"giao hàng nhanh, đồ bơi cũng được, phù hợp với giá tiền, shop tặng thêm dây tóc xinh",5,
4227,148,Rất xinh luôn ạ giá cả phải chăng nữa mình 64kg m57 but mặc vào rất tôn dáng luôn á mng uiii :>  chất liệu cũng rất thỏai mái nữa cảm ơn shop ♡,5,
4228,149,"Gia hàng nhanh, váy bơi y ảnh tuy nhiên may hơi bị lệch nên bên cao bên thấp 
😊😊😊😊😊",5,
4229,150,Đồ siêu ưng luôn và cảm ơn shop đã tặng mình chiếc kẹp nhé lần sau sẽ tt ủng hộ <3,5,
4230,151,"Váy mặc vừa khít, shop tặng thêm cột tóc siêu cute. Lần sau mình lại ủng hộ tiếp.",5,
4231,152,Qtgsvx cnxjhsiendnbdhdhiwjsnxhdbd. XmKkaixnxnd. Hdjdbdnjdjd dhdjjdbdhdjbd. Sbxjd ,5,
4232,153,"Sản phẩm rất đẹp, vải dày dặn co dãn, from váy may rất xoè, 1m68 62kg vừa size",5,
4233,154,"Hàng đẹp,giá tốt. Đc tặng quà khá xinh xắn. Mình sẽ gt bb ủng hộ. Thanks shop",5,
4234,155,"đồ mặc vừa đẹp, shop giao hàng nhanh. Sẽ ủng hộ tiếp trong tương laiiiiiiiiii",5,
4235,156,"Mình mua ở đây 3 lần rồi, lần nào cũng chất lượng hết é, các bạn nên mua nhó",5,
4236,157,"E chưa mặc thử nhưng thấy ok phết, shop rất cute ạ, cảm ơn shop vì món quà ",5,
4237,158,Áo giống hình. Shop ship hàng nhanh. Bao bì túi nilong thôi nhưng hàng ok.,5,
4238,159,"Đồ rất đẹp, rất vừa vặn. Giống y mẫu. Giao hàng nhanh. Shop rất dễ thương. ",5,
4239,160,"Mặc vừa như in luôn, váy hơi ngắn một chút
Giao hàng nhanh shop còn tặng quà nữa >< ",5,
4240,161,"Đồ đẹp chắc chắn còn được tặng khẩu trang, mình 43kg mặc vừa in luôn",5,
4241,162,Giao hàng khá nhanh. Hàng y hình. Mặc vào vừa khít ko lệch một li luôn. ,5,
4242,163,"Hàng siêu đẹp luôn ạ 
Các bạn nên mua nha 
Mặc cực kì ôm dáng k quá lộ ",5,Cảm ơn b❤️
4243,164,"Hàng y hình, vải đẹp. Mình mua 2 bộ ở shop rồi ạ rất là thích nhaaaaa",5,cảm ơn bạn rất nhiều ạ
4244,165,"Mình mặc vừa xinh luôn á, được tặng cột tóc đúng màu mình thích luôn",5,
4245,166,Đồ bơi vải thoáng mát okkk bận vào đẹp và shop cũng rất là dễ thương ,5,
4246,167,"Bộ đẹp giống mô tả, shop tặng kèm dây buộc tóc và có thư cảm ơn kh❤",5,
4247,168,"áo đẹp, mình còn nhận đc quà, dât buộc tóc xinh xắn nữa, thank shop",5,
4248,169,"Shop siêu đáng yêu, tặng kẹo và gửi lời cảm ơn nữa.hàng đẹp y hình",5,
4249,170,"Hàng y hình, giao hàng nhanh. Shop còn tặng thêm cột tóc xinh xẻo",5,
4250,171,"Mình 46kg cao 1m6 mặc sizeM hơi bó tay nhé
Cl ok😁😁😁😁😁😁😁😁😁😁😁😁😁😁😁😁",5,
4251,172,Giao hàng nhanh. Hàng y hình. Đc tặng thêm quà nữa. Cảm ơn shop,5,
4252,173,"Đồ đẹp như trong hình, thời gian giao nhanh. Nói chung là okee",5,
4253,174,"Sản phẩm y như hình ,đẹp ,giao hàng nhanh, rất đánggg tiềnnnn",5,
4254,175,Đồ bơi chất lượng giao hàng nhanh đóng gói đồ cẩn thậnn......,5,
4255,176,"Sản phẩm giống trong hình.Shop giao hàng rất nhanh, tư vấn nhiệt tình.Mình rất ưng bộ đồ bơi này!",5,
4256,177,"Váy xinh có quần bên trong
Ndnfbxbxbsbxhdhdhdhdhdhđbbdbdbdb",5,
4257,178,Quá đẹp quá rẻ. Shop tặng cho chiếc dây cột tóc xinh nữa. Mua đi mn ạ! ,5,
4258,179,"Ngon bổ rẻ nhé cả nhà, mình 63kg mặc sai xl vẫn vừa nhé.",5,
4259,180,Hàng đẹp lắm ạ. Giao hàng nhanh shop dễ thương lắm luôn áo hơi chật dù đã lựa size lớn,5,
4260,181,Ggggggggggggggggggggggggggggghhhghgghhgggggggggggggg,5,
4261,182,"Hàng giống với mô tả  vải khá dày 
Giao hàng nhanhhhhhhhhhhhhh",5,
4262,183,Sản phẩm rất đẹp và shop gói hàng nhanh còn tặng em thêm 1 bé chun cột tóc rất đáng yêu. Khuyên mn hãy mua sản phẩm bên shop nhé,5,
4263,184,"Hàng giống mẫu, còn dc tặng thêm cột tóc xinh xắn nữa",5,"😘 HÌNH NHƯ EM ĐÃ IU  carrotho  TỪ CÁI NHÌN ĐẦU TIÊN 
khách tặng em 5* như này tim nào chịu nỗi ối giời ơiii
Cảm ơn và giới thiệu bạn bè giúp Jami nha

-----
Jami luôn lắng nghe và cải thiện mong bạn nói Jami ngheeeee nha"
4264,185,Giao hàng nhanhhh... Sản phẩm y hình..... Chất lượng khá tốt so với giá... Mình cao 1m57 51kg  mặc size L vừa y,5,
4265,186,Mình m54 41kg do mông đùi hơi bự nên lúc kéo quần lên hơi khó. Còn lại thì rất vừa vặn xinh xẻo nha. ,5,
4266,187,Xịn xò xinh xẻo dã mann. Đồ tốt mà giá lại hợp lý. Đáng tiền muaa,5,"♥️ chíu chíu bắn tim khách nè -->>> <3
cảm ơn khách yêu đã uýnh giá 5* ạ. Mong được khách uýnh thêm 10000000 cái nữa
Jami luôn lắng nghe và cải thiện hãy nói Jami nghe nha
Love you 3e^∞"
4267,188,"Đồ đẹp lắm ạ <3 mình chọn XL mặc rất ok, rộng rãi còn được tặng kèm thêm kẹp tóc xinh xinh 🥰🥰",5,
4268,189,"Shop rất cẩn thận và dễ thương, chất vải đẹp, giá quá ổn",5,Cảm ơn b a
4269,190,"Giao hàng nhanh. Đồ đẹp, vừa vặn, vải và đường chỉ chất lượng. Shop còn tặng cái cột tóc xinh xinh nữa. Có điều váy ngắn hơn mình nghĩ...hiuhiu.
Thanks shop nhiều nha💙",5,
4270,191,"Đồ bên shop rất đẹp xinh, vải mịn. giao hành lại nhanh nữa. 🥰",5,
4271,192,Vải mát chưa mặc thử nhưng nhìn chung khá ok nên cho shop 5 sao,5,
4272,193,"Đồ đẹp lắm nè, shop tận tình lắm nha. Có 6 sao là cho luôn á ♥️",5,Cảm ơn b
4273,194,"Hàng đẹp. Dưới 55kg thì mặc đẹp. Vải dày dặn, mát. Nói chung cũng okie",5,
4274,195,"Vận chuyển nhanh, sản  phẩm giống y hình, vải cũng dày dặn và m mặc rất vừa ạ. Thanks shop vì món quà nhỏ nhỏ xinh xinh kèm theo ạ👍",5,
4275,196,"đồ bơi đẹp ạ, vải ok, còn được shop tặng kèm đồ buộc tóc",5,
4276,197,"Mình 1m55, 52kg, ngực 83, mông 93 vừa y size L. Shop tặng kèm cột tóc xinh lắm. Đáng tiền. Inbox thái độ phục vụ tốt.",5,
4277,198,Đồ bơi đẹp lắm ạaaaaaaaaaaaaaaaaaaaaaaaaaaaaaaaaaaaaaaa :33 hihi,5,
4278,199,"Giao hàng nhanh, chất lượng vải tốt, mình cao 1m6 nặng 50kg vẫn mặc vừa nha mng.",5,
4279,200,Hàng đẹp lắm C.ơn shop nha. Có cả tặng thêm 1 chiếc kẹp tóc nữa <3,5,
4280,201,Nên mua nha mng. đẹp lắm luôn lại còn được shop tặng dây buộc tóc nữa ạ. ship khá nhanh tuy nhiên chủ shop tư vấn kh nhiệt tình cho lắm ạ.,5,Dạ do dạo này m bận qa b ơi. Làm ở cty sml task sếp dí deadline gục mặt. M k trl nhiều dc :((
4281,202,"Xinh lắm luônn nha Giao hàng rất lẹ ,shop tư vấn rất nhiệt tình.Giá cá cũng rất hợp lý Nói chung là rất ưng bộ đồ bơi này:3",5,
4282,203,"Đồ bơi như hình.
Mình chọn giao hàng hoả tốc nên giao đc trong 2 tiếng.
Còn được tặng kèm đồ cột tóc nữa.",5,
4283,204,"Chất lượng sản phẩm rất tốt nhá mn
Đóng gói cẩn thận giao hàng cũng nhanh nữa
Ưng lắm luôn......",5,
4284,205,Shop giao hàng nhanh.  Đóng gói cẩn thận. Chất vải rất đẹp.  Ưng cái bụng Lắm.  Sẽ ủng hộ shop nhiều ,5,
4285,206,Đồ cũng ok ạ.đường chỉ may hơi lỗi nhưng thôi nó giống ảnh là đc rùi hehheee,5,
4286,207,"Shop giao hàng nhanh
Shop tư vấn nhiệt tình
Vải đẹp, mát",5,
4287,208,Đồ đẹp... Hơi ngắn :< nhưng rất tốt thanks shop nhiềuuuuuuuuuuuuuuuuuu ....................,5,
4288,209,"Đồ siêu vừa, siêu dễ thương luôn ạ, cảm ơn món quà nhỏ dễ thương của shop nha 😊",5,
4289,210,"Đồ bơi giống hình, giá rẻ. Shop còn tặng kèm chun buộc tóc nữa. Shop giao hàng nhanh. Cảm ơn shop.",5,
4290,211,Bộ đồ vừa vải đẹp mình sẽ ủng hộ shop lần tiếp theo ,5,
4291,212,Giao hàng nhanh kinh khủng khiếp luôn. Đồ đẹp lắm. Mọi người nên mua,5,
4292,213,Chất vải ok lắm mặc lên vừa luôn ạ sẽ ủng hộ shop 👍,5,🌴🌴🚇
4293,214,Áo rẻ đẹp đi đôi với chất lượng. Rất ưng ý. Sẽ ủng hộ lần sau 🥰🥰🥰🥰,5,
4294,215,Đẹp nhé các nàng. Mỗi tội giao hàng hơi lâu. Hàng ship đến thì mình đi du lịch rồi. Hic,5,"Jami bikini chất giá rẻ xin cám ơn đánh giá của bạn.  Jami bikini chất giá rẻ Chúng tôi luôn hy vọng mang lại sự hài lòng cho w7i1mrc_enur6c6qwjc3zs_zlcay , chúc bạn luôn vui vẻ và mong bạn tiếp tục ủng hộ Shop trong lần trải nghiệm mua hàng tiếp theo nhé!"
4295,216,Shop giao hang nhanh còn đc tặng kèm quà nữa đồ y như hình tư vấn nhiệt tình ,5,
