,Unnamed: 0,khach_cmt,rating,shop_phan_hoi
5276,388,"hàng y hình, chất vải dày dặn
che khuyết điểm tốt, shop nhiệt tình dễ thương",5,"Xin cám ơn đánh giá của bạn. Chúng tôi rất vui vì bạn đã tin tưởng sử dụng sản phẩm của shop. Chúng tôi luôn hy vọng mang lại sự hài lòng cho Quý khách hàng, chúc bạn luôn vui vẻ và mong bạn tiếp tục ủng hộ Shop trong lần trải nghiệm mua hàng tiếp theo nhé!"
5277,389,Không ngờ đẹp ngoài sức tưởng tượng vậy luôn á !!! Lời nhắn kèm theo thiệt cute hết sức còn được tặng kèm 1 đồ buộc tốc xinh xinh nữa 😍😍😍,5,❤️❤️❤️❤️
5278,390,"Hàng đẹp lắm ạ, còn tặng quà nữa, nên mua...................",5," Jami bikini chất giá rẻ xin cám ơn đánh giá của bạn.   Jami bikini chất giá rẻ Chúng tôi luôn hy vọng mang lại sự hài lòng cho  _myanhhh , chúc bạn luôn vui vẻ và mong bạn tiếp tục ủng hộ Shop trong lần trải nghiệm mua hàng tiếp theo nhé!"
5279,391,"Đồ siêu siêu đẹp luôn, hàng y hình, còn được shop tặng thêm cục kẹo nữa ",5,
5280,392,"Áo đẹp, vải thun lạnh dày dặn đã thế giá lại hạt dẻ. Sẽ mua thêm lần sau",5,
5281,393,"Váy đẹp giống trong hình, vải mát, thời gian giao hàng cũng nhanh ",5,
5282,394,Đẹp nha shop lên dáng đẹp vừa vặn. Hài lòng như mong đợi,5,
5283,395,Đẹpppppppppppppppppppppppppppppppppppppppppppppppp,5,
5284,396,"Hàng đẹp như hình,shop giao hàng nhanh......................",5,
5285,397,"Rất là đẹp luôn, siêu xinh, kín đáo. Mình 53kg, 1m52 size XL thoải mái luôn. Nói chung là 5 saooooooo",5,
5286,398,Tunehrojwvehjebdjekenbebjejejdnndjdjjebrbbrjejjejj,5,
5287,399,"Hàng đẹp chất lượng và phù hợp với giá tiền lắm ạ
Em chưa có tgian chụp hình đăng tạm tấm này ạ",5,
5288,400,"hàng đẹp, giao nhanh , vải tốt , chủ shop dễ thương lắm luôn á mn",5,Cảm ơn em nhaa
5289,401,đồ đẹp lắm nha mọi ngườiii vừa người tôn dáng cực luôn ,5,
5290,402,"Hàng đẹp lắm nha, váy tuy còn tí chỉ thừa nhưng chả ảnh hưởng đến chất lượng mấy, rất đẹp luôn",5,"😘 HÌNH NHƯ EM ĐÃ IU  haiyen12082006  TỪ CÁI NHÌN ĐẦU TIÊN 
khách tặng em 5* như này tim nào chịu nỗi ối giời ơiii
Cảm ơn và giới thiệu bạn bè giúp Jami nha

-----
Jami luôn lắng nghe và cải thiện mong bạn nói Jami ngheeeee nha"
5291,403,"Rất hài lòng luôn, form chuẩn. Cực thích 💖💖💖💖💖",5,"😍 QUÝ ZỊ ƠI KHÁCH NHÀ EM UÝNH GIÁ EM 5* LUÔN NÈ 😍 \n
Jami trân quý kimngantong45 đã mua hàng và đánh giá ^^
Mong đươc đồng hành với bạn trong thời gian tới^^
Jami luôn lắng nghe bạn, nhắn tin góp ý giúp Jami cải thiện mỗi ngày nha <3"
5292,404,"Giao hơi lâu nhưng đẹp lắm , chất mát trơn đẹpppk bh7đtgffvfjhgfggttgfyyvgyyhhgyyf7gxyhctyfftftddfggyyyfdthbjjvgggddsrccyhvyhggyhhygvgguggffyytgt",5,"😍 QUÝ ZỊ ƠI KHÁCH NHÀ EM UÝNH GIÁ EM 5* LUÔN NÈ 😍 \n
Jami trân quý vanthao35 đã mua hàng và đánh giá ^^
Mong đươc đồng hành với bạn trong thời gian tới^^
Jami luôn lắng nghe bạn, nhắn tin góp ý giúp Jami cải thiện mỗi ngày nha <3"
5293,405,"Hàng đẹp, đường chỉ may rất chắc chắn nhaa
Cao 1m65, 53kg mặc L là vừa nhaa
Cách làm việc của shop rất tốt, siêu dễ thương 💯",5,"♥️ chíu chíu bắn tim khách nè -->>> <3
cảm ơn khách yêu đã uýnh giá 5* ạ. Mong được khách uýnh thêm 10000000 cái nữa
Jami luôn lắng nghe và cải thiện hãy nói Jami nghe nha
Love you 3e^∞"
5294,406,1m53 46kg size L vừa luôn. Sản phẩm ok so với giá. Giao hàng nhanh. Mỗi tội bản thân ngực ko bự nên mặc vào ngực bụng như nhau =]]]]]],5,"😘 HÌNH NHƯ EM ĐÃ IU  ngocanhchu94  TỪ CÁI NHÌN ĐẦU TIÊN 
khách tặng em 5* như này tim nào chịu nỗi ối giời ơiii
Cảm ơn và giới thiệu bạn bè giúp Jami nha

-----
Jami luôn lắng nghe và cải thiện mong bạn nói Jami ngheeeee nha"
5295,407,,5,"😍 QUÝ ZỊ ƠI KHÁCH NHÀ EM UÝNH GIÁ EM 5* LUÔN NÈ 😍 \n
Jami trân quý nguyenticamle20 đã mua hàng và đánh giá ^^
Mong đươc đồng hành với bạn trong thời gian tới^^
Jami luôn lắng nghe bạn, nhắn tin góp ý giúp Jami cải thiện mỗi ngày nha <3"
5296,408,,5,"😘 HÌNH NHƯ EM ĐÃ IU  tadohongnhung  TỪ CÁI NHÌN ĐẦU TIÊN 
khách tặng em 5* như này tim nào chịu nỗi ối giời ơiii
Cảm ơn và giới thiệu bạn bè giúp Jami nha

-----
Jami luôn lắng nghe và cải thiện mong bạn nói Jami ngheeeee nha"
5297,409,"mút ngực co lên lắm, bơi tí cứ phải kéo áo. chắc phải khâu cố định vào ms yên tâm đc",5,"♥️ chíu chíu bắn tim khách nè -->>> <3
cảm ơn khách yêu đã uýnh giá 5* ạ. Mong được khách uýnh thêm 10000000 cái nữa
Jami luôn lắng nghe và cải thiện hãy nói Jami nghe nha
Love you 3e^∞"
5298,410,"Hình đẹp lấy xu. Chất vải mát lạnh co giản tốt, mặc rất thoải mái, chuẩn bị hàng rất nhanh. Ưng shop cực kỳ luôn..",5,"😘 HÌNH NHƯ EM ĐÃ IU  kimsamsum  TỪ CÁI NHÌN ĐẦU TIÊN 
khách tặng em 5* như này tim nào chịu nỗi ối giời ơiii
Cảm ơn và giới thiệu bạn bè giúp Jami nha

-----
Jami luôn lắng nghe và cải thiện mong bạn nói Jami ngheeeee nha"
5299,411,"Mình mua lần 1 về ko cẩn thận để bị lem màu. Nhắn tin mua lại áo thôi bạn chủ nhiệt tình hỏi tận răng, sau đó gửi mình mã giảm giá. Thực sự là thấy chất lượng phục vụ 5 sao💖💖💖 Rất hài lòng",5,
5300,412,"Trời đất ơi tui không ngờ có ngày tui mặc đồ bơi lại đẹp dữ thần vậy! Che sạch khuyết điểm của tui rùi nè! Đùi to, hông to, bụng dưới to, bắp tay to không thấy nữa rồi! Thích quá!",5,Cảm ơn n nha có hình ảnh nữa thì thích lắm cảm ơn bbbbbb
5301,413,"Giao hàng nhanh, chất lượng tốt so với giá tiền, shop còn tăng thêm quà nữa.
Mình cao 1m72 nặng 52kg, mặc size L cảm giác hơi bó vs hơi ngắn chút, nhưng mà chắc đồ bơi nó vậy, với cả bộ này cũng form ôm người nữa. Nhưng mà ncl khá ổn á, đồ đẹp phết :)))",5,"😍 QUÝ ZỊ ƠI KHÁCH NHÀ EM UÝNH GIÁ EM 5* LUÔN NÈ 😍 \n
Jami trân quý nttrang25072002 đã mua hàng và đánh giá ^^
Mong đươc đồng hành với bạn trong thời gian tới^^
Jami luôn lắng nghe bạn, nhắn tin góp ý giúp Jami cải thiện mỗi ngày nha <3"
5302,414,,5,
5303,415,"Dễ thương ,  hàng giống hình",5,Cảm ơn b
5304,416,"Shop giao lộn hàng nhưng rất nhiệt tình đổi trả, lần sau sẽ ủng hộ tiếp cho shop 🤩",5,
5305,417,"Áo mặc thoải mái nha, có chun ở dưới làm lòi cục mỡ của mình nên bạn nào eo nhỏ thì mặc cho xinh nha. Giá với chất liệu thì cực đáng tiền và rẻ nha",5,🥰🥰👏cảm ơn b
5306,418,"Chất vải rất đẹp, giá lại quá tốt. Mút ngực hơi bị lệch một chút. Mình nhắn tin hỏi shop tư vấn size mà không thấy trả lời. May mà chọn đúng size",5,Dạ m có phản hồi như hơi chậm b check lại giúp m nha
5307,419,Ok lắm,5,"♥️ chíu chíu bắn tim khách nè -->>> <3
cảm ơn khách yêu đã uýnh giá 5* ạ. Mong được khách uýnh thêm 10000000 cái nữa
Jami luôn lắng nghe và cải thiện hãy nói Jami nghe nha
Love you 3e^∞"
5308,420,"Vải cực kì thích. Mk bất ngờ vì lần đầu mua đồ bơi, giá siêu hợp lý mà chất lượng thế này. Mong shop sẽ ra mắt nhiều sản phẩm mẫu mã hơn nữa. Mình ủng hộ 😊",5,Cảm ơn b ạ^^
5309,421,"sản phẩm very tuyệt vời, giao hàng siêu nhanh. Nói chung là không có gì phải chê 😍😍 Shop còn tặng thêm một dây buộc tóc dễ thương lắm. ",5,
5310,422,"Mình mặc r nhé. Hàng đẹp, mặc vừa y luôn thích lắm ",5,
5311,423,"Sản phẩm đáng tiền lắm ạ. Mình cố tình đặt size rộng hơn số cân để mặc cho thoải mái, nên có vẻ khá rộng thật. ",5,Hì b vì thun lanh đồ bơi co giãn nữa nên bạn mặc đúng size á thì xuống nc thoaie mái hơn á❤️cảm ơn b
5312,424,"Đồ đẹp xỉu , y hình . Chất vải cực đã , mặc dù rất rẻ nhưng đồ rất chất lượng ko hề làm mình thất vọng",5,
5313,425,Vải xịn ... mình ưng nhất 2 mút độn vừa ngực mình.. mình cao 1m59 nặng 48 cân mặc size M khá vừâa nho,5,
5314,426,Đồ rất đẹp vải cũng mịn và mát nữa. Shop còn gửi tặng một cái cột tóc rất xinh. Sẽ ủng hộ shop tiếp 😊,5,
5315,427,"Chất lượng ok so với giá tiền, ok laaaa",5,"Jami trân quý cảm ơn  myduyenthivo đã mua hàng và đánh giá shop ^^
Mong đươc đồng hành với bạn trong thời gian tới, ^^
Nếu có gì không hài lòng ibx Jami nha"
5316,428,,5,
5317,429,"đồ giống hình còn kèm theo cột tóc cute, mình 1m55, 60kg mua size XL nhưng áo vẫn rộng, khuyên bạn nào khoảng 60kg nhưng vòng 1 khiêm tốn có thể mua size L cho vừa vặn hơn. Tưởng trong váy là quần đùi nhưng hơi thất vọng vì là dạng quần tam giác, mong shop có thể đổi sang dạng đùi để kín đáo hơn :3",5,
5318,430,"Lần thứ hai mua của shop, rất ưng í.",5,
5319,431,"Đồ đẹp, shop có tặng quà. Dễ thương ",5,
5320,432,"Hàng đẹp, hịn nhưng ai bụng to mình khuyên đừng mua vì bận vào sẽ đưa bụng ra dữ lắm nha",5,
5321,433,"Mới đầu mk cứ sợ mặc sẽ chật cơ nhưng ko ngờ mặc nên vừa xinh luôn 
Mk m60 48kg nha <3",5,
5322,434,Đồ đẹp lắm nha shop! Ưng cái bụng dễ sợ.. còn dc tặng quà kèm theo mỗi bộ lun cơ.. giao hàng nhanh! Sẽ ủng hộ dài dài,5,
5323,435,Giog hjh dep rất hai lòng 💓💓,5,
5324,436,"Hàng giao đúng mẫu ,kèm dây cột tóc xinh xinh. Mặc đẹp chất lượng tốt sẽ tiếp tục ủng hộ shop .",5,
5325,437,"Chất vải đẹp lắm ạ, thiết kế không cầu kì lại bắt mắt. Em cảm ơn nhiều ạ",5,Cảm ơn em
5326,438,"Đồ đẹp giống mẫu, shop có tặng 1 chiếc kẹo. 10đ bán hàng dễ thương 👍👍",5,
5327,439,"Hàng đẹp, ship nhanh. Mình 50kg mua size L vừa in, nên mg mua hơn 1 size cho thoải mái nhé",5,
5328,440,"Sp ổn , mặc tôn dáng kính đáo, nếu bụng nhỏ mac sẽ đep hơn , giá tốt",5,
5329,441,Chất đẹp nha mọi ng. Mình dáng quả lê 161cm .nặng 56kg. XL hơi rộng vì lúc đặt nhìn sz XL( 53-60kg) hihi . Ai dáng quả lê mông đùi to sz L là vừa nha . bận quá ko chụp đc ảnh. Nên mua ạ ,5,
5330,442,Vải đẹp shop còn tinh tế tặng cho cái chun buộc tóc cưng xỉu ạ ♥️,5,
5331,443,"- vải dày dặn, mặc vừa người 1m63 nặng 45kg ok nè, kh có ảnh mặc",5,
5332,444,Giao hàng nhanh đặt buổi sáng buổi chiều đã có... rất tuyệt vời ,5,
5333,445,1wechkkjkmmkmkmmmnnnnnnnjkjjjkkikhhhhbb,5,
5334,446,"Đồ đẹp, chất vải mặc thích lắm mng ơi, nói chung là ưnggg",5,
5335,447,"Hàng đẹp vải dày , sẽ ủng hộ shop",5,
5336,448,Mình thích lắmmmmmmmmmmmm. Iu shoppppppppppppppppppppp,5,Cảm ơn b
5337,449,"hàng đẹp như ảnh , shop còn tặng thêm cả dây chun 😘",5,
5338,450,,5,
5339,451,,5,
5340,452,,5,
5341,453,,5,
5342,454,"Váy mặc thoải mái lắm luôn, giá rẻ, giao hàng nhanh, chất lượng tốt, nói chung là nên mua",5,
5343,455,Chất liêu rất thích như hình và tặng kèm cột tóc cute,5,
5344,456,Ok nha,5,
5345,457,,5,
5346,458,Hàng ok chắc đò bơi là đồ bó nên mặc hơi bó xát chút xíu ,5,
5347,459,"Shop dễ thương, tận tình chu đáo, đóng gói chặt chẽ, có giấy chú thích và quà tặng là dây buộc tóc. Chất vải tốt, mặc rất thích, vừa vặn, shop gợi ý đúng vòng eo luôn, nhưng phần hông hơi khó qua ạ",5,"😘 HÌNH NHƯ EM ĐÃ IU  thuy_duong.16122003  TỪ CÁI NHÌN ĐẦU TIÊN 
khách tặng em 5* như này tim nào chịu nỗi ối giời ơiii
Cảm ơn và giới thiệu bạn bè giúp Jami nha

-----
Jami luôn lắng nghe và cải thiện mong bạn nói Jami ngheeeee nha"
5348,460,"1m57 nặng 54kg mặc siêu vừa, chất đẹp lên form cũng đẹp",5,
5349,461,Nhà không có gương nên k chụp được nhưng đẹp lắm nha mọi người <3,5,cảm ơn bạn rất nhiều ạ
5350,462,"Hàng rất tốt , rất đẹp luôn
Giao hàng nhanh
Shop thân thiện lại còn siêu dễ thương nữa",5,
5351,463,Đồ rất đẹp và xinh nhg phần đáy háng hơi chật tí nhg ko sao;),5,
5352,464,Rất đẹp mn ạ....giá thì học sinh  shop tư vấn tận tình giao hàng nhanh nói chung very good <3 ,5,
5353,465,,5,
5354,466,Chất liệu vải quá ok. Đồ bơi xinh quá trời 😍 ,5,Cảm ơn em❤️
5355,467,"Với tầm giá này thì quá là chất lượng, đáng mua !",5,
5356,468,,5,Cảm ơn b
5357,469,"Hàng đẹp y hình, thoải mái",5,Cảm ơn. Em
5358,470,"Quá đẹp chất vải dày dặn chứ ko mỏng chút nào, kiểu dáng thì quá ok.Shop còn tâm lí tặng thêm buộc tóc xinh xinh yêu lắm. Thank shop nha.",5,
5359,471,Sản phẩm đẹp nhx trên đơn có quà tặng nhx ship về ko có. Hơi thất vọng ,5,
5360,472,Hàng đẹp hơn cả sự mong đợi😍,5,
5361,473," tư vấn nhiệt tình, chị tư vấn dễ thương muốn xĩu. Còn được tặng 1 viên kẹo khi mua đồ nữa. Thích lắm luôn ❤🌟",5,Cảm ơn em phải chi toàn gặp được khách đáng iu siu vũ trụ như em thì thích quá ❤️❤️
5362,474,,5,Huhu hình đẹp v sao bạn đánh gia 3* v ạ :(
5363,475,"Shop giao hàng rất nhanh, gói hàng kĩ còn được nhận thêm quà tặng kèm theo đồ nhận được ngoài sự kì vọng chất vải rất đẹp sẽ ủng hộ shop dài dài 🥰",5,
5364,476,"Áo đẹp lắm y như hình, mik mặc thử vừa như in luôn.",5,
5365,477,,5,
5366,478,Rất đẹp mình mặc vừa in,5,
5367,479,"Ship nhanh và rẻ , đồ bơi siêu okie luôn. Vải xinh lắm nha mọi người , mặc mát . Nhìn rất giống ảnh . Mọi người nên mua nha  ",5,"Cảm ơn b , nhìn rất giống ảnh vì ảnh đó mẫu độc quyền m thuê book mà hâhhaa"
5368,480,,5,
5369,481,Mình 1m65 48 kg mặc đẹp lắm nha(vừa in luôn) vải mát lắm mấy bạn nào mà đi học bơi trên trường thì nên mua nha,5,
5370,482,"Giao hàng nhanh, đồ siu đẹp, còn đc tặng dây chun siu đáng iu nữa",5,
5371,483,"Người mình hơi tròn. 1m58, 60-62kg mà mặc size XL vẫn vừa. Thanks shop. ",5,
5372,484,Đồ bơi đẹp lắm luôn ạ không phải suy nghĩ khi mua đâu. Độ dài của chân váy vừa không quá ngắn cũng không dài ,5,
5373,485,"Siêu siêu ưng luonnnnn, mình 43kg mặc vừa y
Vải xịn, quà tặng siêu cute, shop rep ib dễ thương. Nói chung là quá tuyệt vời! nên mua nhaaaa",5,🙏🙏🥰🥰🥰🥰
5374,486,Vải đẹp mặc lên xinh đúng form ❤️❤️,5,
5375,487,Vì đang làm việc nên không thể chụp hình hay quay video nhưng mình thích shop nha cách phục vụ tư vấn đến gói quà xinh xẻo lắm 🥰🥰😊,5,🥰🔥
5376,488,"Hàng y như hình, chủ shop tư vấn nhiệt tình, size vừa vặn, còn được tặng thêm kẹo nữa. Hi hi.",5,Cảm ơn b nhìu nhiug
5377,489,"Hàng tốt lém ^^giá cũng hợp với túi tiền, còn được tặng kèm 1 cây kẹp nhỏ nhỏ xinh xinh",5,
5378,490,"Đồ giống y hình, mặc rất vừa vặn, mút trong áo cũng oke luôn, tháo ra đc, mặc cũng vừa ngực 🥰",5,
5379,491,"Mình vừa mới nhận được hàng, đồ xinh xỉu luôn mọi người ơi. Chất vải dày dặn, form ôm chuẩn. Mình 40kg, 1m52 bận size S vừa in; lại còn được tặng buộc tóc nữa. Highly recommend cho mọi người đến với shop nhé.",5,
5380,492,Đồ xink xẽo quak ạ,5,
5381,493,Đồ vừa rẻ lại chất lượng . Còn dc tặng thêm một cái dây cột tóc rất dễ thương,5,
5382,494,Đẹp với giao nhanh nữa định up hình mà sao không up đc. Shop rep tn cực nhanh ha tối muộn rồi vẫn rep yêu dễ sợ,5,Cảm ơn b nhiều ❤️❤️❤️
5383,495,"Hàng y hình, chất lượng, tư vấn nhiệt tình, giao hàng nhanh. Siêu siêu hài lòng nha shop",5,
5384,496,"Giao hàng nhanh. Sản phẩm như hình. Shop rất dễ thương, sau này sẽ ủng hộ shop ",5,
5385,497,Rất đẹp và đúng như bộ đồ có trong hình mẫu nhưng váy hơi ngắn xíu ạ,5,"😘 HÌNH NHƯ EM ĐÃ IU  vu_thuy_duong_1410  TỪ CÁI NHÌN ĐẦU TIÊN 
khách tặng em 5* như này tim nào chịu nỗi ối giời ơiii
Cảm ơn và giới thiệu bạn bè giúp Jami nha

-----
Jami luôn lắng nghe và cải thiện mong bạn nói Jami ngheeeee nha"
5386,498,"Đồ bơi đẹp, giống hình chụp.
Shop dễ thương còn tặng kèm món quà nhỏ nữa.
Có cơ hội sẽ ủng hộ shop tiếp.",5,
5387,499,Đã nhận được sp và rất hài lòng. Tks shop,5,
5388,500,Chất lượng tốt,5,
5389,501,"Tui 56kg mặc size L vừa với đẹp lắm á mng . Nên mua nhé , shop tư vấn nhiệt tình lắm ạ",5,"😘 HÌNH NHƯ EM ĐÃ IU  jiikhsujdj  TỪ CÁI NHÌN ĐẦU TIÊN 
khách tặng em 5* như này tim nào chịu nỗi ối giời ơiii
Cảm ơn và giới thiệu bạn bè giúp Jami nha

-----
Jami luôn lắng nghe và cải thiện mong bạn nói Jami ngheeeee nha"
5390,502,"Áo hơi rộng xíu nhưng chất vải và đường may rất tốt, đặc biệt chốt đơn giao hàng siêu nhanh.",5,
5391,503,,5,
5392,504,,5,"Jami bikini chất giá rẻ xin cảm ơn đánh giá của bạn. Nếu có vấn đề cần thắc mắc, bạn hãy nhắn tin trực tiếp với Jami bikini chất giá rẻ, Jami bikini chất giá rẻ sẽ hỗ trợ bạn nhiệt tình. Cám ơn bạn đã tin tưởng sử dụng sản phẩm của Jami bikini chất giá rẻ. Chúc  mmmmmmm146899 bạn luôn vui vẻ và sẽ sớm tiếp tục ủng hộ Jami bikini chất giá rẻ ở các sản phẩm khác nhé!"
5393,505,Shop giao hàng nhanh lại còn đc tặng phụ kiện nhỏ xinh xinhh chất vải ổn,5,"😘 HÌNH NHƯ EM ĐÃ IU  huynekk19  TỪ CÁI NHÌN ĐẦU TIÊN 
khách tặng em 5* như này tim nào chịu nỗi ối giời ơiii
Cảm ơn và giới thiệu bạn bè giúp Jami nha

-----
Jami luôn lắng nghe và cải thiện mong bạn nói Jami ngheeeee nha"
5394,506,"Chất tốt giá rẻ còn được tặng kèm dây buộc tóc xinh xinh, nên mua",5,
5395,507,"Hàng rất đẹp, giao hàng nhanh, chủ shop cute còn tặng cả kẹo nữa, 5 sao. ",5,
5396,508,,5,"😘 HÌNH NHƯ EM ĐÃ IU  phantommay  TỪ CÁI NHÌN ĐẦU TIÊN 
khách tặng em 5* như này tim nào chịu nỗi ối giời ơiii
Cảm ơn và giới thiệu bạn bè giúp Jami nha

-----
Jami luôn lắng nghe và cải thiện mong bạn nói Jami ngheeeee nha"
5397,509,Mình 45kg mặc size L vừa nha,5,
5398,510,"thích cực, vải mát mặc sướng lắm, co dãn tốt, giao hàng nhanh, đáng mua lắm nhaaa",5,"Jami bikini chất giá rẻ xin cảm ơn đánh giá của bạn. Nếu có vấn đề cần thắc mắc, bạn hãy nhắn tin trực tiếp với shop, chúng tôi sẽ hỗ trợ bạn nhiệt tình. Cám ơn bạn đã tin tưởng sử dụng sản phẩm của shop. Chúc  ngockimkimtonnu bạn luôn vui vẻ và sẽ sớm tiếp tục ủng hộ Shop ở các sản phẩm khác nhé!"
5399,511,"chất vải khá mát,sản phẩm y hình, nói chung là đẹp sẽ ủng hộ shop nhiều🥳",5,
5400,512,"Thiệt sự là ưng lắm í , giao hàng nhanh , sp cực chất lượng <3 ",5,
5401,513,"đồ đẹp nh với mình váy hơi ngắn tí , trên tay áo trái có 1 đường phấn giặt không raa=(",5,"Bạn ibx m hỗ trợ cho bạn. Phấn giặt để với nước ấm 1 tý là ra nha. Phấn đó kẻ để may á
^^"
5402,514,,5,
5403,515,"Độ co dãn tốt có cả mút ngực luôn nhen
Anh shipper dth giao hàng lại nhanh nữa nè😍😍",5,
5404,516,"Hàng đẹp lắm á mọi người, không mua là uổng lắm đó. Do là freesize nên cũng không vừa nhưng vẫn okela ",5,
5405,517,Shop siêu đáng yêu UvU mua hàng mà còn được gửi kẹo nữa ạ UwU,5,
5406,518,,5,
5407,519,"Giao hàng đúng hẹn, nhìn chung ổn ",5,
5408,520,Hàng rất đẹp ,5,
5409,521,,5,
5410,522,"Hàng đẹp, giá vừa phải, shop phục vụ nhiệt tình, mình rất thích.",5,
5411,523,,5,"😍 QUÝ ZỊ ƠI KHÁCH NHÀ EM UÝNH GIÁ EM 5* LUÔN NÈ 😍 \n
Jami trân quý thaojoechen đã mua hàng và đánh giá ^^
Mong đươc đồng hành với bạn trong thời gian tới^^
Jami luôn lắng nghe bạn, nhắn tin góp ý giúp Jami cải thiện mỗi ngày nha <3"
5412,524,,5,"😍 QUÝ ZỊ ƠI KHÁCH NHÀ EM UÝNH GIÁ EM 5* LUÔN NÈ 😍 \n
Jami trân quý e9w2dha801 đã mua hàng và đánh giá ^^
Mong đươc đồng hành với bạn trong thời gian tới^^
Jami luôn lắng nghe bạn, nhắn tin góp ý giúp Jami cải thiện mỗi ngày nha <3"
5413,525,,5,"😍 QUÝ ZỊ ƠI KHÁCH NHÀ EM UÝNH GIÁ EM 5* LUÔN NÈ 😍 \n
Jami trân quý hongansky đã mua hàng và đánh giá ^^
Mong đươc đồng hành với bạn trong thời gian tới^^
Jami luôn lắng nghe bạn, nhắn tin góp ý giúp Jami cải thiện mỗi ngày nha <3"
5414,526,,5,"😍 QUÝ ZỊ ƠI KHÁCH NHÀ EM UÝNH GIÁ EM 5* LUÔN NÈ 😍 \n
Jami trân quý ngannn31_10 đã mua hàng và đánh giá ^^
Mong đươc đồng hành với bạn trong thời gian tới^^
Jami luôn lắng nghe bạn, nhắn tin góp ý giúp Jami cải thiện mỗi ngày nha <3"
5415,527,"Giao hàng nhanh, chất lượng tốt",5,"😍 QUÝ ZỊ ƠI KHÁCH NHÀ EM UÝNH GIÁ EM 5* LUÔN NÈ 😍 \n
Jami trân quý huynhphuong040604... đã mua hàng và đánh giá ^^
Mong đươc đồng hành với bạn trong thời gian tới^^
Jami luôn lắng nghe bạn, nhắn tin góp ý giúp Jami cải thiện mỗi ngày nha <3"
5416,528,,5,"😘 HÌNH NHƯ EM ĐÃ IU  dung.bong  TỪ CÁI NHÌN ĐẦU TIÊN 
khách tặng em 5* như này tim nào chịu nỗi ối giời ơiii
Cảm ơn và giới thiệu bạn bè giúp Jami nha

-----
Jami luôn lắng nghe và cải thiện mong bạn nói Jami ngheeeee nha"
5417,529,,5,"😍 QUÝ ZỊ ƠI KHÁCH NHÀ EM UÝNH GIÁ EM 5* LUÔN NÈ 😍 \n
Jami trân quý ntminhthi1402 đã mua hàng và đánh giá ^^
Mong đươc đồng hành với bạn trong thời gian tới^^
Jami luôn lắng nghe bạn, nhắn tin góp ý giúp Jami cải thiện mỗi ngày nha <3"
5418,530,,5,"😍 QUÝ ZỊ ƠI KHÁCH NHÀ EM UÝNH GIÁ EM 5* LUÔN NÈ 😍 \n
Jami trân quý langocminhanh đã mua hàng và đánh giá ^^
Mong đươc đồng hành với bạn trong thời gian tới^^
Jami luôn lắng nghe bạn, nhắn tin góp ý giúp Jami cải thiện mỗi ngày nha <3"
5419,531,,5,"♥️ chíu chíu bắn tim khách nè -->>> <3
cảm ơn khách yêu đã uýnh giá 5* ạ. Mong được khách uýnh thêm 10000000 cái nữa
Jami luôn lắng nghe và cải thiện hãy nói Jami nghe nha
Love you 3e^∞"
5420,532,,5,"♥️ chíu chíu bắn tim khách nè -->>> <3
cảm ơn khách yêu đã uýnh giá 5* ạ. Mong được khách uýnh thêm 10000000 cái nữa
Jami luôn lắng nghe và cải thiện hãy nói Jami nghe nha
Love you 3e^∞"
5421,533,,5,"😘 HÌNH NHƯ EM ĐÃ IU  thanhvynguyen1806  TỪ CÁI NHÌN ĐẦU TIÊN 
khách tặng em 5* như này tim nào chịu nỗi ối giời ơiii
Cảm ơn và giới thiệu bạn bè giúp Jami nha

-----
Jami luôn lắng nghe và cải thiện mong bạn nói Jami ngheeeee nha"
5422,534,,5,"😘 HÌNH NHƯ EM ĐÃ IU  amiaa1809  TỪ CÁI NHÌN ĐẦU TIÊN 
khách tặng em 5* như này tim nào chịu nỗi ối giời ơiii
Cảm ơn và giới thiệu bạn bè giúp Jami nha

-----
Jami luôn lắng nghe và cải thiện mong bạn nói Jami ngheeeee nha"
5423,535,,5,"😘 HÌNH NHƯ EM ĐÃ IU  jeonjungae02rz  TỪ CÁI NHÌN ĐẦU TIÊN 
khách tặng em 5* như này tim nào chịu nỗi ối giời ơiii
Cảm ơn và giới thiệu bạn bè giúp Jami nha

-----
Jami luôn lắng nghe và cải thiện mong bạn nói Jami ngheeeee nha"
5424,536,,5,"😍 QUÝ ZỊ ƠI KHÁCH NHÀ EM UÝNH GIÁ EM 5* LUÔN NÈ 😍 \n
Jami trân quý giauthai0612 đã mua hàng và đánh giá ^^
Mong đươc đồng hành với bạn trong thời gian tới^^
Jami luôn lắng nghe bạn, nhắn tin góp ý giúp Jami cải thiện mỗi ngày nha <3"
