khach_cmt,rating,shop_phan_hoi
tạm ổn,4,"""cảm ơn quý khách đã tin tưởng và ủng hộ 20we. hi vọng rằng,bạn đã có những trải nghiệm mua sắm vui vẻ tại shop. chúc bạn một ngày tốt lành !"""
.,4,nan
"quần mỏng màu nhạt , hơi rộng hơn tưởng tượng",4,"""cảm ơn quý khách đã tin tưởng và ủng hộ 20we. hi vọng rằng,bạn đã có những trải nghiệm mua sắm vui vẻ tại shop. chúc bạn một ngày tốt lành !"""
size thì nên chọn hơn 1 size,4,"""cảm ơn quý khách đã tin tưởng và ủng hộ 20we. hi vọng rằng,bạn đã có những trải nghiệm mua sắm vui vẻ tại shop. chúc bạn một ngày tốt lành !"""
shop giao nhầm mẫu . nhưng quần vẫn ok 😪,4,"""cảm ơn quý khách đã tin tưởng và ủng hộ 20we. hi vọng rằng,bạn đã có những trải nghiệm mua sắm vui vẻ tại shop. chúc bạn một ngày tốt lành !"""
oke,4,"""cảm ơn quý khách đã tin tưởng và ủng hộ 20we. hi vọng rằng,bạn đã có những trải nghiệm mua sắm vui vẻ tại shop. chúc bạn một ngày tốt lành !"""
giao hàng lâu,4,"""cảm ơn quý khách đã tin tưởng và ủng hộ 20we. hi vọng rằng,bạn đã có những trải nghiệm mua sắm vui vẻ tại shop. chúc bạn một ngày tốt lành !"""
quần đẹp,4,"""cảm ơn quý khách đã tin tưởng và ủng hộ 20we. hi vọng rằng,bạn đã có những trải nghiệm mua sắm vui vẻ tại shop. chúc bạn một ngày tốt lành !"""
hơi rộng,4,"""cảm ơn quý khách đã tin tưởng và ủng hộ 20we. hi vọng rằng,bạn đã có những trải nghiệm mua sắm vui vẻ tại shop. chúc bạn một ngày tốt lành !"""
ổn,4,"""cảm ơn quý khách đã tin tưởng và ủng hộ 20we. hi vọng rằng,bạn đã có những trải nghiệm mua sắm vui vẻ tại shop. chúc bạn một ngày tốt lành !"""
tạm dc,4,nan
quần đen bé hơn 1 size,4,nan
quần hơi rộng với dài lúc đầu cứ tưởng mặc vừa :(,4,"""cảm ơn quý khách đã tin tưởng và ủng hộ 20we. hi vọng rằng,bạn đã có những trải nghiệm mua sắm vui vẻ tại shop. chúc bạn một ngày tốt lành !"""
ok hơn chiếc quần màu đen hôm nọ giao,4,"""cảm ơn quý khách đã tin tưởng và ủng hộ 20we. hi vọng rằng,bạn đã có những trải nghiệm mua sắm vui vẻ tại shop. chúc bạn một ngày tốt lành !"""
hợp lý giá cả chất lượng ok,4,"""cảm ơn quý khách đã tin tưởng và ủng hộ 20we. hi vọng rằng,bạn đã có những trải nghiệm mua sắm vui vẻ tại shop. chúc bạn một ngày tốt lành !"""
quần đẹp nhưng đặt lộn size mang k vừa,4,"""cảm ơn quý khách đã tin tưởng và ủng hộ 20we. hi vọng rằng,bạn đã có những trải nghiệm mua sắm vui vẻ tại shop. chúc bạn một ngày tốt lành !"""
quần xanh đậm quá bận ko thích lắm,4,"""cảm ơn quý khách đã tin tưởng và ủng hộ 20we. hi vọng rằng,bạn đã có những trải nghiệm mua sắm vui vẻ tại shop. chúc bạn một ngày tốt lành !"""
cũng đc,4,"""cảm ơn quý khách đã tin tưởng và ủng hộ 20we. hi vọng rằng,bạn đã có những trải nghiệm mua sắm vui vẻ tại shop. chúc bạn một ngày tốt lành !"""
tạm ổn,4,"""cảm ơn quý khách đã tin tưởng và ủng hộ 20we. hi vọng rằng,bạn đã có những trải nghiệm mua sắm vui vẻ tại shop. chúc bạn một ngày tốt lành !"""
mua size 34 mà rộng hơn cả size 36,4,"""cảm ơn quý khách đã tin tưởng và ủng hộ 20we. hi vọng rằng,bạn đã có những trải nghiệm mua sắm vui vẻ tại shop. chúc bạn một ngày tốt lành !"""
sản phẩm ok đúng said với mầu,4,"""cảm ơn quý khách đã tin tưởng và ủng hộ 20we. hi vọng rằng,bạn đã có những trải nghiệm mua sắm vui vẻ tại shop. chúc bạn một ngày tốt lành !"""
khá đẹp,4,"""cảm ơn quý khách đã tin tưởng và ủng hộ 20we. hi vọng rằng,bạn đã có những trải nghiệm mua sắm vui vẻ tại shop. chúc bạn một ngày tốt lành !"""
giao hàng nhanh sp okla,4,"""cảm ơn quý khách đã tin tưởng và ủng hộ 20we. hi vọng rằng,bạn đã có những trải nghiệm mua sắm vui vẻ tại shop. chúc bạn một ngày tốt lành !"""
quần đẹp lắm,4,"""cảm ơn quý khách đã tin tưởng và ủng hộ 20we. hi vọng rằng,bạn đã có những trải nghiệm mua sắm vui vẻ tại shop. chúc bạn một ngày tốt lành !"""
ok,4,"""cảm ơn quý khách đã tin tưởng và ủng hộ 20we. hi vọng rằng,bạn đã có những trải nghiệm mua sắm vui vẻ tại shop. chúc bạn một ngày tốt lành !"""
ship hơi bị lâu ! nhưng hàng bao đẹp,4,"""cảm ơn quý khách đã tin tưởng và ủng hộ 20we. hi vọng rằng,bạn đã có những trải nghiệm mua sắm vui vẻ tại shop. chúc bạn một ngày tốt lành !"""
ok,4,"""cảm ơn quý khách đã tin tưởng và ủng hộ 20we. hi vọng rằng,bạn đã có những trải nghiệm mua sắm vui vẻ tại shop. chúc bạn một ngày tốt lành !"""
ok,4,"""cảm ơn quý khách đã tin tưởng và ủng hộ 20we. hi vọng rằng,bạn đã có những trải nghiệm mua sắm vui vẻ tại shop. chúc bạn một ngày tốt lành !"""
ổn,4,"""cảm ơn quý khách đã tin tưởng và ủng hộ 20we. hi vọng rằng,bạn đã có những trải nghiệm mua sắm vui vẻ tại shop. chúc bạn một ngày tốt lành !"""
hơi rộng nhưng tạm được,4,"""cảm ơn quý khách đã tin tưởng và ủng hộ 20we. hi vọng rằng,bạn đã có những trải nghiệm mua sắm vui vẻ tại shop. chúc bạn một ngày tốt lành !"""
quần oke đẹp,4,"""cảm ơn quý khách đã tin tưởng và ủng hộ 20we. hi vọng rằng,bạn đã có những trải nghiệm mua sắm vui vẻ tại shop. chúc bạn một ngày tốt lành !"""
hàng ok mỗi tội giao sai size,4,"""cảm ơn quý khách đã tin tưởng và ủng hộ 20we. hi vọng rằng,bạn đã có những trải nghiệm mua sắm vui vẻ tại shop. chúc bạn một ngày tốt lành !"""
giao hàng nhanh nhưng size quần hơi to,4,"""cảm ơn quý khách đã tin tưởng và ủng hộ 20we. hi vọng rằng,bạn đã có những trải nghiệm mua sắm vui vẻ tại shop. chúc bạn một ngày tốt lành !"""
lưng quần quá rộng,4,"""cảm ơn quý khách đã tin tưởng và ủng hộ 20we. hi vọng rằng,bạn đã có những trải nghiệm mua sắm vui vẻ tại shop. chúc bạn một ngày tốt lành !"""
sản phẩm ok nhưng giao hàng hơi lâu,4,"""cảm ơn quý khách đã tin tưởng và ủng hộ 20we. hi vọng rằng,bạn đã có những trải nghiệm mua sắm vui vẻ tại shop. chúc bạn một ngày tốt lành !"""
mọi ng nên mua đúng size ko nên mua dư quá,4,"""cảm ơn quý khách đã tin tưởng và ủng hộ 20we. hi vọng rằng,bạn đã có những trải nghiệm mua sắm vui vẻ tại shop. chúc bạn một ngày tốt lành !"""
sản phẩm mặc cx đẹp,4,"""cảm ơn quý khách đã tin tưởng và ủng hộ 20we. hi vọng rằng,bạn đã có những trải nghiệm mua sắm vui vẻ tại shop. chúc bạn một ngày tốt lành !"""
chỉ thừa hơi nhiều,4,"""cảm ơn quý khách đã tin tưởng và ủng hộ 20we. hi vọng rằng,bạn đã có những trải nghiệm mua sắm vui vẻ tại shop. chúc bạn một ngày tốt lành !"""
quần mỏng,4,"""cảm ơn quý khách đã tin tưởng và ủng hộ 20we. hi vọng rằng,bạn đã có những trải nghiệm mua sắm vui vẻ tại shop. chúc bạn một ngày tốt lành !"""
còn nhiều chỉ thừa,4,nan
dài quá hịc,4,nan
ổn,4,nan
sản phẩm tốt,4,nan
ok,4,nan
đúng size,4,nan
hàng ok trừ 1 sao vì gửi hàng hơi lâu,4,nan
"quần đẹp , ổn",4,nan
thời gian hàng rất chậm,4,nan
hoi rộng,4,nan
hỏng khuy,4,nan
rất tốt,4,nan
quần đẹp mỗi tội vải hơi mỏng,4,nan
quần đẹp mna rộng quá,4,nan
quần mở 1 mảng nhỏ tầm 5cm kiểm hàng ko kĩ,4,nan
quần màu đẹp nhưng mỏng manh quá,4,nan
có mùi thuốc tẩy nồng,4,nan
xịn,4,nan
hàng ok đúng như hình 🤣,4,nan
cx tốt,4,nan
quần đẹp hợp vs giá tiền,4,nan
hàng không giống hình 1 tí nào,4,nan
sản phầm,4,nan
"quần ok nhưng hơi ngắn, cạp thấp",4,nan
khá ưng nhưng quần hơi cũ,4,nan
.,4,nan
cũng ổn,4,nan
"quần ôm vừa chân, phân lưng hơi rộng 9/10",4,nan
đẹp,4,nan
cũng ok mà hơi mỏng,4,nan
quần này phải là quần khá bảnh mới đúng,4,nan
chỉ thừa hơi nhiều,4,nan
hơi dài nhưng đẹp,4,nan
đặt 35 giao 36 rộng thì thôi rồi,4,nan
hơi to so với size,4,nan
tốt,4,nan
khá đẹp nhưng hơi dài,4,nan
quần rất đẹp giao hàng nhanh,4,nan
m67 size 28 ổn giao nhanh quần hơi nhiều chỉ thừa,4,nan
bal,4,nan
hơi dài nhưng không sao vẫn đẹp,4,nan
quần đẹp nhưng shop giao nhầm màu nên hơi buồn 😢,4,nan
size bé nhất mà mặc vẫn bị dài và hơi rộng bụng,4,nan
hàng tốt,4,nan
vẫn còn chỉ thừa,4,nan
quần rộng không hợp cho mấy,4,nan
ok,4,nan
mỏng,4,nan
cũng ok,4,nan
sản phẩm đc. ok nhé. nên mua,4,nan
quần màu ko giống trong ảnh lắm nên 4 sao,4,nan
giao sai màu,4,nan
quần màu hơi nhạt,4,nan
cũng đc,4,nan
hơi nhiều chỉ thừa,4,nan
tạm ổn,4,nan
quần khá đẹp đáng để mua,4,nan
quần thì ok nhưng bụng bơi chật,4,nan
quần ok đúng hình ảnh,4,nan
được,4,nan
size 27 mà m63 hơi to và dài,4,nan
cũng ok,4,nan
vải oke mỗi tội chọn size hơi bé,4,nan
hơi rộng nha mn. 1m74 53kg,4,nan
quần rất dẹp đóng gói cẩn thận rất ưng í,4,nan
giao hàng hơi lâu,4,nan
màu quần nhạt hơn so với ảnh.,4,nan
tổng quan thì chất lượng khá ổn,4,nan
"quần đẹp, chất lượng ổn nhưng hơi rộng",4,nan
sản phẩm k như trên hình cho lắm,4,nan
cũng ok thoi,4,nan
phom hơi rộng mn nên đặt lùi lại 1-2 size,4,nan
quần đẹp nhưng hơi rộng,4,nan
vải hơi xổm,4,nan
nói chung là ok trong tầm giá,4,nan
màu hơi nhạt ạ,4,nan
quần đẹp lắm nha mg =(:,4,nan
quần ok. túi 1 bên thủng,4,nan
duoc nhung mà size nhất mình mặc vẫn rộng,4,nan
bị sứt chỉ một bên quần gần túi ,4,nan
quấn đẹp nhưng ko sáng như miêu tả trừ 1 sao,4,nan
quần không có cúc . còn lại thì có ok,4,nan
quần hơi to,4,nan
tốt,4,nan
tạm ổn,4,nan
bên đài bên ngắn,4,nan
quần ok mnmua nhớ hỏi kĩ nếu là nữ nhé,4,nan
ok,4,nan
hơi rộng,4,nan
rộng bụng,4,nan
đc,4,nan
hàng đẹp nhưng màu hơi nhạt,4,nan
rộng quá,4,nan
quần màu hơi nhạt ,4,nan
ship nhanh nhưng a ship chán quá,4,nan
"quá đẹp , hơi bị nhiều chỉ thừa",4,nan
"giống hình, đẹp",4,nan
hơi ngắn á,4,nan
shop giao nhanh,4,nan
có vẻ màu k giống như mình nghĩ,4,nan
"sản phẩm tốt nhưng có lỗi, shop phục vụ tốt",4,nan
ok nhưng quần hơi mỏng xiu,4,nan
sản phẩm đúng như hình,4,nan
đẹp mà bụng hơi rộng,4,nan
chất lượng ưng nhưng còn hơi thiếu sót 4sao thôi,4,nan
khó xắn gấu wua,4,nan
ok,4,nan
màu hơi sẫm,4,nan
dẹp,4,nan
quần rộng quá,4,nan
size 27 nma vẫn không vừa :(,4,nan
quần khá giống trong hình ,4,nan
sezi 28 rộng quá,4,nan
màu quần ổn. nhưng vừa lôi ra thì đã bị hỏng cúc,4,nan
màu nhạt hơn so vs hình mô tả,4,nan
em cảm thấy màu nó k đc đậm như ảnh,4,nan
màu k giống ảnh.! nhưng quần chất lượng ổn,4,nan
quần hơi dài ,4,nan
tạm,4,nan
tạm,4,nan
hàng đẹp lắm nha shop nhưng hơi rộng,4,nan
oke,4,nan
hàng ổn nhưng vải hơi xấu,4,nan
hàng như hình như mẫu cảm ơn shop rất nhiều ,4,shop rất cảm ơn thiện chí của mình. anh cho shop xin lại soa với ạ
màu hơi nhạt quần hơi nhăn '-' ,4,nan
quần có vài chỗ bị ố,4,nan
hàng ok,4,nan
chất vải oce đẹp,4,nan
màu hơi nhạt so vs hình.,4,nan
lỗi chỉ may 1 tý,4,hàng có chút sơ xuất nhỏ mong anh thông cảm nhé
quần giống hình giao nhanh,4,nan
quần ống hơi bé,4,nan
đẹp nhưng sz chưa vừa,4,nan
tạm ổn,4,nan
ok đấy mua thì mua ko mua cũng đc ,4,nan
giá hơi chát nhưng bù lại vải cũng xịn lắm nha,4,shop cảm one a nhiều ạ.mong a ủng hộ shop lâu dài ạ.❤️
ổn,4,nan
vải ổn giá ok,4,nan
hơi rộng 1 tí ,4,a có gì chưa hài lòng về sản phẩm của 20we ạ ? cùng trò chuyện với 20we nha
quần may lỗi,4,nan
quần đẹp ,4,nan
khá đẹp,4,nan
tốt,4,nan
"hàng mới đẹp như hình nhưng size hơi nhỏ và quần ko có thun cột, dễ tụt khi vận động mạnh",4,nan
áo thì đẹp mà quần quá mỏng mọi người nên cân nhắc khi mua h,4,nan
vãi ổn nhưng mình đặt 2 bộ size l. mình cao m73 đặt 2 bộ thì bộ đen thì hơi nhỏ bộ xám thì tay quá ngắn như con nít mặc á. mặc bộ đen thì hơi tạm. theo mình size nhỏ quá.,4,nan
"bộ này hàng đẹp, chất vải tốt mặc mát, ngon so với giá 74k. mà shop gửi áo thì đúng size, có mac ghi size. nhưng quần thì cảm giác to hơn so với áo, như thể xl ấy. mà cái size bị xé mất. chơi z chơi mình đi shop. 4 sao thôi vì quần to hơn so vs áo. bộ sau cũng xl mà trông quần vừa vặn hẳn.",4,nan
"vải áo có vẻ mỏng, mát. nhưng mng nên mặc up size lên nhé vì mình mua theo size trong mô tả áo bị nhỏ. nhưng vs giá này ra shop thể thao mua 1 bộ mình thấy ok hơn",4,nan
"đặt bộ size xl, áo thì đúng size, quần thì size l 🙄 rồi s mặc được đây shop bán trá hình quá đồ cũng được đúng màu, mà đưa size ko đúng thì làm sao khách mặc được 🙂đọc bình luận bên dưới cũng nhiều bạn có th trên rồi đúng là giá rẻ 1 bộ thì ko đòi hỏi nhiều nhưng ít nhất quần cũng đúng size chứ",4,"dạ sai sót trong khâu sản xuất đã mang tới trải nghiệm không tốt cho quý khách, rất xin lỗi bạn vì bất tiện trên. mọi thắc mắc quý khách vui lòng chát với shop để được hỗ trợ đổi trả hoàn toàn miễn phí ạ."
vải hơi mỏng size l hơi bé so với suy nghĩ của mình. tạm chấp nhận được,4,nan
đóng gói ok. nhìn vải cũng ok lắm nhưng chưa đc mặc nên chưa biết nó ntn. thấy cũng rẻ rẻ săn deal 75k mặc thử xem ntn.,4,nan
áo thì ko biết làm sao nhưng ổn và vải đẹp! mát😁 điểm trừ là áo bị bẩn mn ạ! bẩn kiểu do phấn thôi nên tạm chấp nhận 😗 nói chung với giá ntn thì ngư thế là ổn rồi😁,4,nan
áo xinh mà mua màu xám thành màu hơi trắng :( đáng tiền ạa size xl người trên 60kg vẫn chật áo.,4,nan
giá đấy ok r ko mong gì hơn nhưng sz áo lệch quá ạ huhu :( e lấy đúng sz ghi chú ghi mà về rộng lắm,4,nan
so với tầm gái 75k thì mk đánh giá là tốt. mặc ở nhà hay đi tập thể dục ổn. cái quần sờ hơi mỏng.,4,nan
"hàng ở vn mà vận chuyển 10 ngày mới tới, bên vận chuyển njnja quá tệ cho 1 sao bên vận chuyển. shop cũng nhiệt tình. mua size hơi rộng",4,nan
"giá rẻ.áo đúng size, nhưng quần thì hơi nhỏ và khác chất vải với áo.áo đẹp.quần tạm được.cũng okay.thanks shop.",4,nan
áo mỏng vải bí ko mát đâu nhé. tạm đc thôi ko ưng cho lắm tiền nào của đó,4,nan
hàng giao thực tế giống hình. đúng size. logo trên áo in hơi méo. lưng quần ko có dây rút trong.,4,nan
"chất vải áo khá nóng, không biết mặc vài ngày có bị xù lên không. chất quần mát, mặc được. shop giao hàng rất nhanh, 1 ngày là có rồi",4,nan
giao hàng nhanh. chất vải mềm và cũng mát nhưng gửi cho mình bộ bị rách mấy chỗ.chán.,4,pucu shop cảm ơn bạn đã mua hàng shop sẽ luôn cố gắng phục vụ và làm hài lòng bạn hơn nữa. nếu có điều gì chưa hài lòng bạn có thể inbox ngay cho shop để được hỗ trợ ạ. chúc bạn và gia đình mạnh khỏe.
chất liệu vải thoáng mát. hàng đẹp. mình 62kg đặt size xl mà áo vẫn hơi ngắn.,4,nan
"hàng ok so với giá, tuy nhiên shop chuẩn bị hàng hơi lâu .….",4,nan
chất lượng tạm ổn. vãi mõng . tiền nào của nấy . giao hàng nhanh. đóng gói ok,4,nan
đã nhận được hàng. sản phẩm y hình. chất co dãn tốt. thun không lạnh lắm. nói chung ưng ý,4,nan
mình mua hộ lên ko có ảnh.nhưng nghe ng nhận nói là size khá vừa.chất thì mình ko biết ạ,4,nan
shiper nhiet tinh. hang phu hop gia tien.,4,nan
quần xl nhưng hơi nhỏ thì phải. áo thì hoi mỏng xíu. nhưng mặc tạm,4,nan
áo thì rất tốt nhưng quần thì mỏng sau đích kiểu như là nối vải v giao hàng quá chậm nên ko chỉ cho shop 4 sao thoi,4,nan
đồ cũng chuẩn quần hơi rộng một chút nhưng không sao đã mua lần hai,4,nan
sản phẩm phù hợp với giá tiền. nên mua,4,nan
"đồ cũng ok , shop giao đồ nhanh mà bên bưu cục giao hơi chậm",4,nan
"đặt áo quần đen hết, nhận hàng áo xanh đen quần đen. không ưng màu cho lắm nhưng chất liệu vải ok",4,nan
"mình mua 2 bộ : bô mầu tím than đẹp, ưng. nhưng bộ trắng đơn giá đăt hơn nhưng đương kim mũi chỉ cà chun quần thi ẩu. cơ bản chất đẹp, và shop giao nhanh, nếu không bị nhược điểm trên thi dc 5*.",4,nan
"áo ok mặc mát, nhưng xem chất áo và quần k giống nhau lắm, giống ghép áo với quần khác nhau thành set thôi, nch k đòi hỏi nhiều với giá này đc, vậy là ok rồi",4,nan
"chất vải mỏng, nhẹ nhưng phần đường chỉ ở mặt trước của quần may bị lỗi mà mua vs giá rẻ nên cũng ko đòi hỏi nhiều",4,nan
"chồng mình 60kg cao 1m75, đặt sz xl - quần vừa nhưng áo bị cộc tay, mặc chật. giao hàng nhanh, vải mát. ",4,nan
"áo thì chất đẹp,nhưng quần quá nhỏ so với áo,với lại chỉ thừa nhiều.",4,nan
vải đẹp mát nhưng shop giao quần sz m áo lại là sz l,4,nan
áo in tương đối đẹp. quần hơi mỏng nhưng với giá săn sale là quá hời.,4,nan
giao hàng nhanh. chất mát đẹp. nhưng màu quần vs màu áo ko đc giống nhau lắm. 9/10 ,4,nan
"hàng khá đẹp so với mức giá, săn đc sale nên khá hời",4,nan
"chất lượng tương đương với giá tiền, đóng gói đẹp. giao hàng nhanh",4,nan
"vải hơi thô, mặc nóng. phù hợp giá tiền áo bị đóm như hình fom rộng",4,nan
"mới lấy thì nhìn chất vải khá ok, co giản shop ib tư vấn size nhiệt tình",4,nan
"chất vải rất đẹp và mịn. rất hài lòng, chất lượng và cực rẻ. nhưng giao sai size quần . 3 size xl mà có 1 quần xl còn 2 quần size s.",4,nan
size không chuẩn. xl mà nhỏ như l. tiền nào của đó.,4,nan
order sz xl bình thường thì rộng rãi mà nay order đúng xl mặc hơi chật. hơi buồn,4,nan
áo hơi bẩn . chất quần cũng không ok lắm. ,4,nan
quần thì to mà áo thì bé tý xl mà như m hay l ak shop kiễm tra lại size nha shop ui,4,nan
đồ đẹp nhug ma 1m8 mat bị hỏng sợ nên hỏi shop trc shop keu xl vừa. nên mua xl. ck mặt bị hỏng chán.,4,nan
từ lúc đặt 1 tuần mới nhận được. áo có logo trong khi mình đặt không có,4,nan
túi lủng còn dây kéo túi kéo dc 3 lần hư luôn :) còn lại ok,4,nan
"quần khá ok. còn áo thì hơi ngắn, rộng, với nó giãn quá.",4,nan
áo bị rách phần ống tay ạ.,4,nan
hàng cũng khá là ok trong tầm giá. chất vải hơi nóng. quần nên có dây buộc,4,nan
chất vải thì ok có điều logo ở ngực áo thì lệch nghiêng mặc lên không giống ai . áo thì chỉ ở cổ và sườn bung hết ra,4,"rất xin lỗi quý khách vì lỗi của sản phẩm. bên shop đổi hàng tại nhà miễn phí khi sản phẩm lỗi hoặc sai , a/c chat cho bên shop để được hỗ trợ nhé!"
đặc 2 cái xl giao 1cái xl còn cái kia xl nhỏ quá,4,nan
với giá tiền này thì chất vải phù đubgs cới giá tiền,4,nan
logo bị lệch ,4,"dạ sai sót trong khâu kiểm tra sản phẩm đã mang tới trải nghiệm không tốt cho quý khách, rất xin lỗi bạn vì bất tiện trên. mọi thắc mắc quý khách vui lòng chát với shop để được hỗ trợ đổi trả hoàn toàn miễn phí ạ."
"áo đẹp, quần bình thường. quần chỉ có màu đen.",4,nan
giá rẻ hàng tốt. nhưng lại bị thừa chỉ,4,nan
phù hợp với giá xiên,4,nan
vải hơi mỏng. phù hợp giá tiền,4,nan
"đặt màu xám ship về màu xanh, bó tay",4,nan
đóng gói sản phẩm chưa đẹp,4,nan
áo bị rách 1 lỗ li ti,4,nan
cái quần bật chỉ hết shop ơi,4,nan
tạm ổn so vs giá tiền,4,nan
sản phẩm màu đen không giống như hình,4,nan
cũng tạm,4,nan
sp tốt,4,nan
vải áo ok. vải quần hơi chán,4,nan
sản phẩm đẹp hợp giá tiền mà hơi mỏng ak,4,nan
sản phẩm tạm được ,4,pucu shop cảm ơn anh/chị đã tin tưởng và ủng hộ sản phẩm của shop ạ. shop sẽ luôn cố gắng phục vụ và làm hài lòng anh/chị hơn nữa. nếu có bất kỳ điều gì khiến mình chưa hài lòng a/c có thể inbox ngay cho shop để được hỗ trợ ạ. chúc anh/chị và gia đình mạnh khỏe và luôn có những trải nghiệm tuyệt vời nhất khi đến với pucu shop.
quần nhỏ so với size ,4,nan
quần mỏng và ngắn so với size l,4,nan
vải hơi mỏng nhưng ok với giá sp ,4,nan
đặt 2 bộ thì 1 bộ quần với áo mỗi cái 1 màu,4,nan
sản phẩm ổn,4,nan
ok,4,nan
mẫu mã ok nhưng phải chờ mặc xem chất có mát k,4,nan
cũng ok so vs giá,4,nan
shop giao sai size so với size mình đặt,4,nan
 giao hàng nhanh .đúng size đúng mẫu .vãi ok,4,nan
chất lượng ok so với giá tiền,4,nan
chất lượng được ,4,nan
"áo ok, quần chưa ưng ý lắm",4,nan
phù hợp với giá tiền,4,nan
dao lộn màu,4,nan
hàng giao rất nhanh. chất áo rất đẹp,4,nan
áo đẹp chất lượng tốt nhưng logo in bị lệch,4,nan
khá ok,4,nan
sản phẩm đẹp,4,nan
size hơi bé áo quần ok,4,nan
chất lượng rất ok,4,nan
áo thì ok quần mỏng hơi xấu,4,nan
"vải mát đường may chuẩn không chỉ thừa chỉ có điều là vải hơi mỏng không được dày, shop tư vấn nhanh nhiệt tình, nói chung là oke với giá cuối cùng là giặt bị ra màu nước đầu, nước sau không biết sao",4,nan
"hàng đẹp lắm lun í, vải dày nữa mà lỗi cái bộ màu xanh dây buộc lại màu đen và khác loại với 2 bộ còn lại nên 4 sao thôi",4,nan
"giao đúng mẫu, màu ở ngoài đậm hơn chút so với trên hình mỗi tội giao hàng lâu 2 tháng mới nhận đc nhưng do covit nên thôi",4,nan
giao hàng siêu nhanh. chưa sài nên chưa biết chất lượng sao.săn sale nên giá thành ổn,4,nan
vải này phai màu khủng khiếp. mình giặt ko để ý bị phai hết vào phần áo màu trắng. m ko giặt cùng qao khác,4,nan
"chất vải sờ chắc tay, đanh, mịn mặc vào form dáng đẹp, tuy nhiên k được mát cho lắm. nói chung là ổn. mặc mùa hè thì sẽ khá nóng. dùng khi có điều hoà là ok",4,nan
"bộ đồ chất dày dặn, cảm giác hơi nóng màu xanh than hôm trước để cạnh áo trắng của mình bị phai màu ra áo trắng nên cho mình trừ 1*",4,nan
"vide, hình ảnh mang tính chất nhận xu, chất liệu đẹp, vải mát, nt với shop để hỏi sz mà mãi k thấy tl, đanh lựa theo kg thì lại bị rộng.",4,nan
"giao hàng cùng hà nội mà siêu siêu siêu lâu. hẹn giao ngày 18 tận ngày 20 mới nhận đc hàng trong khi đặt hàng từ ngày 14. chuẩn bị hàng lâu, giao hàng càng rất lâu. cần xem lại về giao vận! hàng ok so với giá tiền.",4,nan
vải dày với nóng lắm. size m nhưng khá là rộng. mặc mùa thu thôi chứ mùa hè là nóng thêm đấy ạ.,4,nan
"mua tặng nên ko có hình, chất mak đk chuẩn bị hàg nhah trừ 1* do bên giao hàg",4,nan
"giao hàng nhanh, chất lươngj sản phẩm hơi nóng, nhưng với giá như vậy cũng chấp nhận được.",4,nan
hàng cũng được chất vải thích hợp mặc vào hôm mát mẻ. lưu ý mn nên chọn lùi 1 size k thì rộng. shop hỗ trợ đổi hàng rất nhanh. chúc shop 1 ngày vui vẻ,4,nan
"vải oke ạ, lấy ra giặt vải màu xanh ra màu lem phần màu trắng, cũng tạm chấp nhạn được",4,nan
"đóng gói cẩn thận kĩ càng, mới nhận hàng nên chưa biết chất lượng sản phẩm",4,nan
