khach_cmt,rating,shop_phan_hoi
"quần đẹp lắm shop ạ. mỗi tội mua xong quần thì xe em hỏng, cho 4 sao thôi",4,"""cảm ơn quý khách đã tin tưởng và ủng hộ 20we. hi vọng rằng,bạn đã có những trải nghiệm mua sắm vui vẻ tại shop. chúc bạn một ngày tốt lành !"""
"sản phẩm tạm có chất lượng khá tốt, giao hàng khá nhanh cảm ơn shop",4,nan
"quần ổn, mặc hơi rộng, đóng gói cẩn thận. với giá tiền như này thì ko trông đợi gì nhiều",4,nan
chất lượng và kiểu dáng vải khá ổn có điều màu sáng hơn trong ảnh khá nhiều nên mình có hơi thất vọng chút,4,nan
"quần đẹp nha mn, m8 60kg mặc size 30 hơi ngắn, hình ảnh mang tc nhận xu",4,nan
có một sp bị rộng dù mua hai cái cùng size với nhau,4,nan
hàng về đẹp ạ nhưnh mỗi tội có vài chỗ ko bị xanh hết có chỗ xanh đậm có chỗ xanh nhạt ko đồng đều . sẽ ủng hộ shop tiếp,4,nan
giao hàng nhanh gói hàng đẹp chất lượng phải đợi thời gian mới biết,4,nan
chất lượng tốt giá rẻ hay sao mà chịu được nữa giảm giá sốc tại triển vĩ đại gia tạo bất chợt đổ bộ lên đảo 🏝️ là một,4,nan
shop tư vấn kiểu quần què gì bảo đặt size 30 đặt về rộng như váy 🙄(hình ảnh chỉ để lấy xu),4,nan
"shop giao thiếu cho mình 1 cái quần nhưng chủ shop nhiệt tình ib và hứa sẽ chuyển cái quần còn lại cho mình quần đẹp và rộng lắm, mình mặc bị dài do chân ngắn á trừ 1 sao do giao thiếu quần, mong shop sẽ để ý đơn hàng của khách hơn do cái quần kia là mình đặt cùng bạn, rất khó xử nữa",4,nan
"so vs mức giá thì khá là oke la , ae cứ theo bảng size nhé , chuẩn luân",4,nan
sản phẩm khá tốt đóng gói sp chắc chắn chất quần oke mà mùa hè thì mặc hơi nóng xíu nhưng vẫn đc,4,nan
nó không phải là màu xanh nhạt á. nó bị đậm hơn bên ngoài. chất vải thì vẫn ổn nhưng màu thì nhìn quê quê. thôi cho 4 sao,4,nan
quần có ~200k thì thế này là quá ok rồi á 😋 quay cho mọi người xem cận luôn nè,4,nan
vải ok . giao hàng nhanh. mỗi tội nhìn quần hơi bẩn. khá hài lòng.,4,nan
"quần đẹp, hàng giống ảnh ạ, hình như shop giao sai màu vì màu này đậm quá :<",4,nan
"giao hàng nhanh, quần nhiều chỉ thừa, kéo khoá quần hơi phò, ống quần không rộng lắm chả khác gì quần côn. nhưng mà quần hơn 100k vậy là ok r",4,nan
quần đẹp chất vải oke cơ mà nhìn quần giống form nữ quá với cả dịch nên giao hàng hơi lâu! mình đặt từ hôm 16 đến tận 23 mới lấy được hàng,4,nan
"chất liệu tốt quần to hơn so với ảnh mẫu,cũng đẹp mình và bạn đặt đơn cùng 1 ngày và cùng 1 địa chỉ mà người có trước người có sau",4,nan
"do dịch nên gần 1 tuần mới giao tới :< chất liệu quần okla, túi quần nhỏ, lưng quần rộng, 1 ít chỉ thừa phía trong quần.",4,nan
hàng về không được đẹp như mong đợi chán shop quá đặt lần đầu ok lần 2 thì haiz,4,nan
"màu không giống ảnh, quần nam nữ mà mình mua size nhỏ nhất vẫn rộng, độ dài vừa, lưng rộng",4,nan
tôi thấy chất vải khá là mỏng so với giá tiền thì hơi cao nói chung là ổn,4,nan
from được nhưng chất hơi dễ bám bụi tóm lại là hơi đắt so với giá tiền,4,nan
shop tư vấn cho mk chọn size 28 là vừa đẹp luôn nhưng khi nhận hàng hơi bị thất vọng vì quầ quá rộng đúng kiểu bơi trong quần luown chán thật sự còn ảnh vs video chỉ mang tính chất lấy xu,4,nan
"quần màu khác hình, bạc phếch. size thì hơi rộng so với chiều dài",4,nan
"quần màu không giống hình,ko dãn,ship hơi lâu,khá thất vọng",4,nan
"đóng gói hơi sơ sài :) quần ok mỗi cái là màu hơi không giống mình mong muốn hi vọng giặt xong nó phai bớt, mua được giá hời nên cũng chấp nhận được",4,nan
quần cũng khá đẹp so với giá tiền. chất vải cũng oce. có điều mình có chút hiểu nhầm qua mô tả nên đặt size bị to. bạn nào từ 40 đến 46kg nên đặt size nhỏ nhất nha. shop cũng hỗ trợ nhiệt tình.,4,nan
"shop chuẩn bị và giao hàng nhanh, quần đẹp nma tiếc là dưới chân quần bị lỗi nhỏ tí, cũng buồn nma ncl ok💯",4,nan
sản phẩm cũng ok nhưng nhìn vải có chút không đẹp nma vẫn đánh giá 4s cho shop phát triển hơn,4,nan
"vải thì không có gì để chê,dày dặn,shop tư vấn nhiệt tình. mỗi tội là quần hơi bị chật so với mình🥲",4,nan
quần màu đậm hơn trong ảnh phải xắn quần lên 8cm mới vừa. bạn nào thấy cơ mình phù hợp với size ví dụ size 30 thiì nên chọn mua size nhỏ hơn 29 vì mua đúng size quần trộng vl,4,"20we xin cảm ơn quý khách hàng đã lựa chọn dịch vụ của 20we. 20we đã inbox rồi đó, quý khách hãy check ib để cùng trò chuyện với 20we nha !"
shop giao hàng nhanh đảm bảo yêu cầu time nhiwng mà màu sắc khôgn dc như mong muốn . màu ngả sang màu xám chứ k có độ xnah,4,nan
"mình mua cho bạn nên không rõ chất lượng nhưng thấy bảo là from dáng được , chất không được đẹp lắm , nói chung là được xin lỗi vì hình ảnh chỉ mang tính chất nhận xu .",4,nan
quần đẹp nhưng có dính 1 vết bẩn nhỏ trên đầu gối mong lần sau shop kiểm tra kĩ hàng trước khi giao cho khách ,4,nan
quần bị gập eo 64 mặc hơi rộng😥 m54 quần dài quá trên m6 thì đẹp lại tốn 20k tiền cắt😥,4,nan
sz quần shop tư vấn hơi lệch mình cao 1m62 48kg mà vừa rộng vừa dài,4,nan
sản phẩm màu đen thì oke giống hình nhưng sản phẩm màu xanh thì nhạt hơn hình. về mở ra nhìn chán thực sự luôn,4,nan
"shop ở hà nội mà giao diêu nhanh luôn, quần giống hình nhưng mặc rộng dù đã nhờ shop tư vấn",4,nan
ib shop tư vấn bảo mặc size 28 cũng ổn mà về nó rộng muốn xỉu luôn chất ok lắm nhé màu cũng ổn,4,nan
shiper giao hàng nhầm giao lâu nhưng quần rất đẹp,4,nan
"quần như hình có điều lưng quần hơi rộng mình cao 1m7 nặng 43kg mặc size 27, với lại nút khoá quần bị lỗi",4,nan
chất lượng sản phẩm rất tốt nhưng mà shop tư vấn size quần bị to quá. hơi buồn vì mất thêm tiền đi cắt😥,4,nan
"quần ổn. ship nhanh, màu không được như mong muốn cho lắm. tuy nhiên khá ổn, vải bò ok. đóng gói chắc chắn",4,nan
"cũng ok k quá đẹp lắm đâu mng ạ, mih mua cho b nên k muốn nói gi nhìu",4,nan
đẹp nhưng vải hơi mỏng size 28 mà cứ như 29 nhưng vẫn tạm ổn nhé ❤️,4,nan
hàng thì đẹp nha mọi người mỗi tội nó chẳng xanh như trong hình đâu nên cho 4 sao gặp phải anh giao hàng cục súc ko nghe máy cái anh đó hủy đơn luôn năn nỉ mãi mới dc,4,nan
quần dày dặn ok nhưng mỗi cái là ống nó bó quá mặc như quần bình thường mà lấy size to hơn thì lại không vừa hơi buồn,4,nan
sản phẩm ik như hình nha mn nhưng có điều đặt size 28 hơi chật 29 là đẹp mặc ko vừa bụng,4,nan
chất vải cũng được nhưng mà vì fom này chỉ hợp với các bạn nam thôi nha mình hơi tiếc vì quần mặc vừa nhưng phần đùi quá rộng nên nhìn hơi thô nha các bạn nữ,4,nan
chất vải bình thường màu không được giống hình lắm giá cũng rẻ nên chấp nhận được,4,nan
vải đẹp dày dặn nhunge ống quần hơi to k thích lắm,4,nan
quần cũng ok. ăn mau đi k trở lại đây thì có vẻ như là một trong những người có ,4,shop cảm one a nhiều ạ.mong a ủng hộ shop lâu dài ạ.❤️
giao hàng nhanh tư vấn ổn nhưng mà trên quần còn dính cái gì màu vàng trông hơi bẩn chất liệu quần thì ok,4,nan
giao hàng nhanh quần ổn nhìn khá giống hình mà ống quần hơi bé so với ảnh ,4,nan
quần ưng 👍🏻👌🏻 nhưng size rộng hơn so vs bình thường nên trừ 1 sao,4,nan
"video ko ko liên quan nhưng quần khá đẹp, may chắc chắc, bị xước ở 1 chỗ",4,nan
vải tốt giao hàng nhanh như mẫu có điều nhìn màu hơi cũ nhưng mà đẹp,4,nan
quần rất đẹp mà tiếc 1 cái là óng quần nhỏ không được như hình :(,4,nan
giao hàng nhanh đóng gói cẩn thận hàng cũng được nhưng sau chổ phi cút quần cắt sẵn nên không biết mới 100% không do shop khác chưa ai cắt sẵn cả .ngoài ra còn thấy chỉ thừa nữa,4,"""cảm ơn quý khách đã tin tưởng và ủng hộ 20we. hi vọng rằng,bạn đã có những trải nghiệm mua sắm vui vẻ tại shop. chúc bạn một ngày tốt lành !"""
vải kh dày cũng kh mỏng tạm đc,4,"""cảm ơn quý khách đã tin tưởng và ủng hộ 20we. hi vọng rằng,bạn đã có những trải nghiệm mua sắm vui vẻ tại shop. chúc bạn một ngày tốt lành !"""
vải hơi cứng ngứa,4,"""cảm ơn quý khách đã tin tưởng và ủng hộ 20we. hi vọng rằng,bạn đã có những trải nghiệm mua sắm vui vẻ tại shop. chúc bạn một ngày tốt lành !"""
lệch 1 size nên bị rộng bụng :(,4,nan
giao không đúng màu:) chất lượng ổn:),4,"""cảm ơn quý khách đã tin tưởng và ủng hộ 20we. hi vọng rằng,bạn đã có những trải nghiệm mua sắm vui vẻ tại shop. chúc bạn một ngày tốt lành !"""
không đúng màu đặt hàng. quần mặc vừa 😑,4,"""cảm ơn quý khách đã tin tưởng và ủng hộ 20we. hi vọng rằng,bạn đã có những trải nghiệm mua sắm vui vẻ tại shop. chúc bạn một ngày tốt lành !"""
sản phẩm khá giống hình nhưng chất lượng vải thì chỉ 4 sao thôi,4,"""cảm ơn quý khách đã tin tưởng và ủng hộ 20we. hi vọng rằng,bạn đã có những trải nghiệm mua sắm vui vẻ tại shop. chúc bạn một ngày tốt lành !"""
quần bị một vết bẩn to giặc khó ra ngoài vấn đề đó ra thì mình hài lòng hình ảnh chỉ mang tính chất nhận xu,4,"""cảm ơn quý khách đã tin tưởng và ủng hộ 20we. hi vọng rằng,bạn đã có những trải nghiệm mua sắm vui vẻ tại shop. chúc bạn một ngày tốt lành !"""
quần rất okay,4,"""cảm ơn quý khách đã tin tưởng và ủng hộ 20we. hi vọng rằng,bạn đã có những trải nghiệm mua sắm vui vẻ tại shop. chúc bạn một ngày tốt lành !"""
"mình cao 1m58, cân nặng tầm 40-50. theo bảng quy đổi kích cỡ của shop là 27. mua về quần vừa rộng vừa dài, không mặc được. mấy bạn nào tầm mình mua 26 nhé. mà shop ship mình quần nam à",4,"""cảm ơn quý khách đã tin tưởng và ủng hộ 20we. hi vọng rằng,bạn đã có những trải nghiệm mua sắm vui vẻ tại shop. chúc bạn một ngày tốt lành !"""
buồn thế chứ mong lần sau shop chú ý hơn để k xảy ra tình trạng này nữa,4,"""cảm ơn quý khách đã tin tưởng và ủng hộ 20we. hi vọng rằng,bạn đã có những trải nghiệm mua sắm vui vẻ tại shop. chúc bạn một ngày tốt lành !"""
shop tư vấn hoàn trả nhiệt tình,4,nan
"màu có vẻ sáng hơn ảnh, sản phẩm này nữ mặc sẽ hợp hơn nam nhưng mà vẫn cứ là ok",4,nan
"chất lượng sản phẩm ổn, giao hàng nhanh, nhưng không như mong chờ, đóng gói cẩn thận.",4,nan
sản phẩm ok,4,nan
màu quần ko giống hình cho lắm,4,nan
hay,4,nan
nice,4,"""cảm ơn quý khách đã tin tưởng và ủng hộ 20we. hi vọng rằng,bạn đã có những trải nghiệm mua sắm vui vẻ tại shop. chúc bạn một ngày tốt lành !"""
lỡ mua hơi rộng nhưng chắc sửa đc màu đẹp form ổn,4,"""cảm ơn quý khách đã tin tưởng và ủng hộ 20we. hi vọng rằng,bạn đã có những trải nghiệm mua sắm vui vẻ tại shop. chúc bạn một ngày tốt lành !"""
quần vải rất đẹp nhưng cạp quá rộng,4,"""cảm ơn quý khách đã tin tưởng và ủng hộ 20we. hi vọng rằng,bạn đã có những trải nghiệm mua sắm vui vẻ tại shop. chúc bạn một ngày tốt lành !"""
màu quá nhạt so với hình quần hơi rộng m7 mặc vừa,4,nan
sp bình thường ,4,nan
"quần không có túi ,giao hàng nhanh ,m65 50kg size 26 vừa bụng ,mà quần dài gần 100cm khác với thông số 93(shop ghi) phải sắn 2 lần cạp hơi dài",4,"""cảm ơn quý khách đã tin tưởng và ủng hộ 20we. hi vọng rằng,bạn đã có những trải nghiệm mua sắm vui vẻ tại shop. chúc bạn một ngày tốt lành !"""
không ngờ là quần to và rộng như vậy luôn á .,4,"""cảm ơn quý khách đã tin tưởng và ủng hộ 20we. hi vọng rằng,bạn đã có những trải nghiệm mua sắm vui vẻ tại shop. chúc bạn một ngày tốt lành !"""
đặt quần màu đen mà shop giao màu xanh. mua tặng nên hơi buồn. shop có nói mình hoàn hàng nhưng đúng 28 tết rồi hoàn hàng phiền quá nên mình đành nhận hàng.,4,"""cảm ơn quý khách đã tin tưởng và ủng hộ 20we. hi vọng rằng,bạn đã có những trải nghiệm mua sắm vui vẻ tại shop. chúc bạn một ngày tốt lành !"""
"quần lưng ko cao, đũng quần bị thụng, chất vải cứng nhưng giá tiền thấp nên cũng phù hợp",4,"""cảm ơn quý khách đã tin tưởng và ủng hộ 20we. hi vọng rằng,bạn đã có những trải nghiệm mua sắm vui vẻ tại shop. chúc bạn một ngày tốt lành !"""
do mình đặt size 34 cho rộng mà ai ngờ nó rộng quá tr rộng nên mặt kh vừa buồn ghia mong shop cho đổi size,4,"""cảm ơn quý khách đã tin tưởng và ủng hộ 20we. hi vọng rằng,bạn đã có những trải nghiệm mua sắm vui vẻ tại shop. chúc bạn một ngày tốt lành !"""
vãi đẹp quần đẹp rẻ giá hợp lí giao nhanh shop tư vấn nhiệt tình,4,"""cảm ơn quý khách đã tin tưởng và ủng hộ 20we. hi vọng rằng,bạn đã có những trải nghiệm mua sắm vui vẻ tại shop. chúc bạn một ngày tốt lành !"""
"màu đẹp, đường may tốt, nhưng mà phần chỉ bên trong màu đỏ không giống màu trong hình quảng cáo nên cho 4 sao",4,"""cảm ơn quý khách đã tin tưởng và ủng hộ 20we. hi vọng rằng,bạn đã có những trải nghiệm mua sắm vui vẻ tại shop. chúc bạn một ngày tốt lành !"""
"quần form đẹp, giá rẻ. có điều quần mình mua lại bị bục chỉ sẵn ở phần khuy quần và một vết ố (han gỉ) ở ống quần :( nhưng không sao.",4,nan
"chất lượng vải tốt, đường may đều, cao 1m56 hơi dài và hơi rộng vs mk",4,nan
quần siêu đẹp luôn ạ mỗi tội hơi dài so với em 10đ chất lượng nhưng giao hàng khá lâu chắc do dịch bệnh,4,nan
quần màu sáng mà bên trong khâu chỉ đen xắn lên xấu lắm ạ :),4,"""cảm ơn quý khách đã tin tưởng và ủng hộ 20we. hi vọng rằng,bạn đã có những trải nghiệm mua sắm vui vẻ tại shop. chúc bạn một ngày tốt lành !"""
"đặt hai chiếc cùng loại mà màu hơi khác nhau tí, ship hơi lâu nữa nhưng cũng ok",4,"""cảm ơn quý khách đã tin tưởng và ủng hộ 20we. hi vọng rằng,bạn đã có những trải nghiệm mua sắm vui vẻ tại shop. chúc bạn một ngày tốt lành !"""
"màu hơi nhạt nên trừ 1 sao mọi thứ khác thì quá oke ,vải dày dặn ,sản phẩm tốt đối với mình hơi rộng nhưng oke shop rất tận tình",4,"""cảm ơn quý khách đã tin tưởng và ủng hộ 20we. hi vọng rằng,bạn đã có những trải nghiệm mua sắm vui vẻ tại shop. chúc bạn một ngày tốt lành !"""
"đúng size, tạm ổn giao sai màu nên trừ 1 sao, đặt xanh sky giao xanh nhạt :( nói chung là buồn đó ống hơi rộng so với suy nghĩ kh thấy chỉ thừa ai muốn chắc chắn thì đi đạp lại lần nữa. riêng mình chắc vừa bóp ống vừa đạp :(",4,"""cảm ơn quý khách đã tin tưởng và ủng hộ 20we. hi vọng rằng,bạn đã có những trải nghiệm mua sắm vui vẻ tại shop. chúc bạn một ngày tốt lành !"""
"hàng giống như hình , size chuẩn , túi bị nhỏ ,chất vải nóng mặc mùa hè thì xác định ướt đẫm luôn :) nhưng nhân viên rep ib chậm nên cho[ 4* thôi :) ] giao hàng chậm [ ]",4,"""cảm ơn quý khách đã tin tưởng và ủng hộ 20we. hi vọng rằng,bạn đã có những trải nghiệm mua sắm vui vẻ tại shop. chúc bạn một ngày tốt lành !"""
"quần hơi dài, nhưng mà màu đẹp, chất liệu ok, đáng đồng tiền bát mì",4,"""cảm ơn quý khách đã tin tưởng và ủng hộ 20we. hi vọng rằng,bạn đã có những trải nghiệm mua sắm vui vẻ tại shop. chúc bạn một ngày tốt lành !"""
"giao hàng lâu quá , quần nhìn trên ảnh ko trắng mấy ai ngờ mua về trắng nhiều quá ko thích nhưng quần đẹp ko lỗi , tạm cho shop 4 sao nhé",4,"""cảm ơn quý khách đã tin tưởng và ủng hộ 20we. hi vọng rằng,bạn đã có những trải nghiệm mua sắm vui vẻ tại shop. chúc bạn một ngày tốt lành !"""
sp tạm ổn nhưng size 29 dành cho người 1m7 nặng 57 là hơi rộng nha shop,4,"""cảm ơn quý khách đã tin tưởng và ủng hộ 20we. hi vọng rằng,bạn đã có những trải nghiệm mua sắm vui vẻ tại shop. chúc bạn một ngày tốt lành !"""
"mình đặt cả 2 quần cỡ 28.mk thấy quần màu xanh rất to chắc phải cỡ 29,30 j đấy nhưng bù lại vải quần rất chắc chắn mong shop lần sau để í",4,"""cảm ơn quý khách đã tin tưởng và ủng hộ 20we. hi vọng rằng,bạn đã có những trải nghiệm mua sắm vui vẻ tại shop. chúc bạn một ngày tốt lành !"""
"quá nhiều chỉ thừa, đóng gói thì đc.👍 trừ một sao nhé",4,"""cảm ơn quý khách đã tin tưởng và ủng hộ 20we. hi vọng rằng,bạn đã có những trải nghiệm mua sắm vui vẻ tại shop. chúc bạn một ngày tốt lành !"""
quần khá đẹp. màu không giống như ảnh 100% nhưng mà cũng giống 85%,4,"""cảm ơn quý khách đã tin tưởng và ủng hộ 20we. hi vọng rằng,bạn đã có những trải nghiệm mua sắm vui vẻ tại shop. chúc bạn một ngày tốt lành !"""
ảnh mang tượng trưng quần đẹp nha nên mua nha các bạn,4,"""cảm ơn quý khách đã tin tưởng và ủng hộ 20we. hi vọng rằng,bạn đã có những trải nghiệm mua sắm vui vẻ tại shop. chúc bạn một ngày tốt lành !"""
"hàng rất đẹp giá cả hợp lý , mỗi cái là giao hàng hơi lâu",4,"""cảm ơn quý khách đã tin tưởng và ủng hộ 20we. hi vọng rằng,bạn đã có những trải nghiệm mua sắm vui vẻ tại shop. chúc bạn một ngày tốt lành !"""
"chất vải ổn, không có chỉ thừa, đóng gói cẩn thận. với giá chỉ hơn 100k thì như này là quá ok. size hơi rộng so với mình, khuyên mn nên đặt nhỏ lại 1 size nhé",4,"""cảm ơn quý khách đã tin tưởng và ủng hộ 20we. hi vọng rằng,bạn đã có những trải nghiệm mua sắm vui vẻ tại shop. chúc bạn một ngày tốt lành !"""
quần đẹp vải dày dặn đúng như shop mỗi tội mình đặt size 29 ngta giao 28,4,nan
chất lượng ok shop tư vấn nhiệt thì mặc dù bị giao nhầm nhưng shop đã đổi trả rất uy tính,4,nan
sp tốt giao hàng đúng hẹn nhưng hơi chậm ngày cuối cùng dự kiến là nhận đc,4,nan
quần thì khá tốt nhưng vì giao thiếu mất phải chờ để lấy thêm 1 cái nữa nên cho shop 4*,4,nan
quần hơi ngắn ! chất vải mềm. nói chung tạm được! shiper chưa ok lắm.,4,nan
"hàng gửi lâu quá, mdu chất cũng oke. nhưng giao hàng chậm, shop làm việc thiếu chuyên nghiệp, giao sai hàng",4,nan
"hàng shop đẹp cơ mà mùi vải nồng quá, ai giặt nhiều cho mình xin ý kiến",4,nan
"màu sáng hơn trên hình , vải đẹp nhưng quần chỉ đẹp khi mặc vừa thôi :(",4,nan
quần rất tốt nhưng có vài chỗ khâu chưa chắc chắn lắm lên chỉ cho 4 s 😂,4,nan
"quần đẹp nhưng có lỗi ở ống quần, chỗ lỗi vải k đủ may nên thủng lỗ",4,nan
ống nó kh rộng như hình đâu ạ mình mặc thì ống thấy ổn nhưng lưng nó rộng kinh khủng phải đi bóp lại ạ 🥲,4,nan
mình m75 nặng 56 cân mua size 29 ok nãy mặc thử thì vừa quần vải hơi mỏng còn lại ok,4,nan
"hàng mới về không đúng mẫu báo shop đổi lại sau khi đổi lại thì thấy oke nha mỗi điều lỗi gửi nhầm hàng là của shop ,mà khi đổi hàng lại không chịu ship ,bay 30k :)",4,nan
"không giống trông hình, kêu ống suôn ng mà chiều rộng của ống không phải mn đừng tin shop. đưa thông tin sp sai sự thật ",4,nan
"form quần khá đẹp, tuy nhiên vẫn còn chỉ thừa và bị như ảnh",4,nan
quần chất liệu ok xịn đẹp nhưng có điều là bị bung chỉ ở chỗ mác sau ,4,nan
quần rất đẹp giao hàng nhanh shop nhiệt tình nhưng quần không dãn với cả bn nào cao trên 1m8 như mình thì size 32 sẽ hơi ngắn nhưng mà để xuông đi tất cổ cao thì vẫn ok,4,nan
sản phẩm uy tín nhưng vải 2 ống chân quần lại khác nhau nên mình chỉ cho 4 sao thôi giao hàng khá nhanh,4,nan
khá ưng tại vừa size . màu hơi lỗi xíu nhưng tạm chấp nhân,4,nan
khá oke nhưng shop hơi kì đáng ra phải xé cái giá gốc đi lại để đó,4,nan
"shop nhiệt tình, chất lượng tốt, giao hàng nhanh, hàng chất lượng trong tầm giá.",4,cảm ơn khách yêu đã tin tưởng và lựa chọn mua hàng tại shop. hãy ghé shop thường xuyên để trải nghiệm những sản phẩm và dịch vụ tuyệt vời nhất nhé. . chúng tôi luôn hy vọng được tiếp tục đồng hành cùng khách yêu trong tương lai.
"quần đẹp sắn lên thì bao đẹp, nhưng màu vải cũ không được như trong hình nên giảm 1 sao",4,nan
"giao hàng nhanh , đóng gói kỹ nhưng vải còn dư chỉ nhiều và bị lem màu.",4,nan
quần đẹp nhưng có cái shop ko kiểm tra kĩ để bị rách mất vài chỗ,4,nan
"chất phẩm sản phẩm tậm ổn giá cả hợp lí, rất đáng để mua",4,nan
quần đẹp. ống hới rộng nêu bạn nào ko thich mặc ống rộng thì chú ý.,4,nan
giao hơi lâu . quần có khá nhìu chỉ thừa .tiền nào của nấy nói chung tạm thôi,4,"""cảm ơn quý khách đã tin tưởng và ủng hộ 20we. hi vọng rằng,bạn đã có những trải nghiệm mua sắm vui vẻ tại shop. chúc bạn một ngày tốt lành !"""
vải tốt quần đẹp hơi nhiều chỉ thừa và quần ko có cúc ko biết do nỗi hay j nhưng vẫn hợp với tầm giá,4,nan
sản phẩm khá chất lượng,4,"""cảm ơn quý khách đã tin tưởng và ủng hộ 20we. hi vọng rằng,bạn đã có những trải nghiệm mua sắm vui vẻ tại shop. chúc bạn một ngày tốt lành !"""
quần thơm. size 29 hơi to so với bảng quy đổi kích cỡ. mặc vào rộng eo. hình ảnh để nhận xu,4,nan
thấy quần được nhiều lượt mua nên mua về mặc thử. chất lượng cũng không quá tốt so với giá nhưng được cái là không có chỉ thừa nên cho 4sao thôi nha 😘,4,nan
chất lượng quần khá tốt giao hàng nhanh và màu quần thì hơi khác với trong hình chỉ hơi thất vọng chỗ đó còn lại ok hết,4,nan
"sản phẩm ok, hợp với giá tiền, đặt size 28 nhưng shop lại giao size 27, m7 55kg vừa khít, eo bị chật. cho shop 4sao :3.",4,nan
vải k được đẹp lắm kiểu nhũn k vào from như hình quần quá rộng ống màu thì đậm hơn hình được cái giao hàng nhanh dù tronc mùa dịch,4,nan
"vải mỏng, khá rộng mua sz bé nhất mà vẫn rộng chắc tại mình gầy quá chứ kp do shop nhưng giá đấy thì cũng ok mn nha",4,nan
đặt hàng trước tết tầm 12 ngày nhưng sau tết mới nhận được khi huỷ đơn hàng là hàng đang trong tình trạng ng bán chưa đưa cho đơn vị vận chuyển tớ mới huỷ nhé nhưng vẫn ship về ạ quần hơi rộng so với size ạ,4,nan
