khach_cmt,rating,shop_phan_hoi
"nói chung màu quần nhạt hơn trong ảnh, đai quần sau ko đẹp lắm, giao hơi lâu nhưng chất lượng sản phẩm ổn, nên mua đúng size mình mặc thì sẽ vừa bụng nhưng chiều dài quần chỉ vừa phải chứ ko dài để mà săn gấu lên đc",4,"""cảm ơn quý khách đã tin tưởng và ủng hộ 20we. hi vọng rằng,bạn đã có những trải nghiệm mua sắm vui vẻ tại shop. chúc bạn một ngày tốt lành !"""
đẹp nhưng size vẫn to ạ em mặc size 26 nhưng kb shop gửi cho tầm size 27 hoặc 28 rồi 😆,4,"""cảm ơn quý khách đã tin tưởng và ủng hộ 20we. hi vọng rằng,bạn đã có những trải nghiệm mua sắm vui vẻ tại shop. chúc bạn một ngày tốt lành !"""
.,4,"""cảm ơn quý khách đã tin tưởng và ủng hộ 20we. hi vọng rằng,bạn đã có những trải nghiệm mua sắm vui vẻ tại shop. chúc bạn một ngày tốt lành !"""
ý là mua xanh rồi mà màu hơi nhạt 1 tí như củ ý ( ý kiến riêng ạ ),4,"""cảm ơn quý khách đã tin tưởng và ủng hộ 20we. hi vọng rằng,bạn đã có những trải nghiệm mua sắm vui vẻ tại shop. chúc bạn một ngày tốt lành !"""
"đặt 2 giao 1, nhưng shop cũng giao thêm nên ko sao",4,"""cảm ơn quý khách đã tin tưởng và ủng hộ 20we. hi vọng rằng,bạn đã có những trải nghiệm mua sắm vui vẻ tại shop. chúc bạn một ngày tốt lành !"""
hàng chất đẹp mà gửi sai mẫu màu mình đặt màu đen mà về màu xanh,4,"""cảm ơn quý khách đã tin tưởng và ủng hộ 20we. hi vọng rằng,bạn đã có những trải nghiệm mua sắm vui vẻ tại shop. chúc bạn một ngày tốt lành !"""
quần đẹp giao hàng nhanh shop thân thiện nhưng phần eo vẫn chật sz 29 còn chật hơn sz 27,4,"""cảm ơn quý khách đã tin tưởng và ủng hộ 20we. hi vọng rằng,bạn đã có những trải nghiệm mua sắm vui vẻ tại shop. chúc bạn một ngày tốt lành !"""
hàng đẹp nhưng chưa gì thấy xù rồi,4,"""cảm ơn quý khách đã tin tưởng và ủng hộ 20we. hi vọng rằng,bạn đã có những trải nghiệm mua sắm vui vẻ tại shop. chúc bạn một ngày tốt lành !"""
"quần đẹp vãi dày đóng gói sản phẩm tốt . có cái giao sai màu quần nha shop, trừ 1 sao nha",4,"""cảm ơn quý khách đã tin tưởng và ủng hộ 20we. hi vọng rằng,bạn đã có những trải nghiệm mua sắm vui vẻ tại shop. chúc bạn một ngày tốt lành !"""
ship hàng hơi lâu thôi nè. nhưng chất vải thì tốt. co dãn,4,"""cảm ơn quý khách đã tin tưởng và ủng hộ 20we. hi vọng rằng,bạn đã có những trải nghiệm mua sắm vui vẻ tại shop. chúc bạn một ngày tốt lành !"""
hàng đẹp mà dưới phần ống chân bị 1 đốm vàng nhỏ để ý kỉ mới thấy được kh sao,4,"""cảm ơn quý khách đã tin tưởng và ủng hộ 20we. hi vọng rằng,bạn đã có những trải nghiệm mua sắm vui vẻ tại shop. chúc bạn một ngày tốt lành !"""
tốt,4,"""cảm ơn quý khách đã tin tưởng và ủng hộ 20we. hi vọng rằng,bạn đã có những trải nghiệm mua sắm vui vẻ tại shop. chúc bạn một ngày tốt lành !"""
mặc rất là ưng nhưng với giá tiền hơi mắc cần được xem xét kĩ,4,"""cảm ơn quý khách đã tin tưởng và ủng hộ 20we. hi vọng rằng,bạn đã có những trải nghiệm mua sắm vui vẻ tại shop. chúc bạn một ngày tốt lành !"""
tiền nào của nấy nha,4,nan
đồ khá oke nhưng hơi rộng một tí ạ ! bạn nào mua nên cân nhắc kĩ size nha !,4,nan
"vải hơi mỏng,cỡ 30 mà to quát nói chung cũng tạm được",4,"""cảm ơn quý khách đã tin tưởng và ủng hộ 20we. hi vọng rằng,bạn đã có những trải nghiệm mua sắm vui vẻ tại shop. chúc bạn một ngày tốt lành !"""
quần đẹp chất liệu tốt mặc vào lên dáng rất ok nhưng mà giao hàng hơi lâu nên cho 4 sao,4,"""cảm ơn quý khách đã tin tưởng và ủng hộ 20we. hi vọng rằng,bạn đã có những trải nghiệm mua sắm vui vẻ tại shop. chúc bạn một ngày tốt lành !"""
"đẹp nhưng mà quần ko rộng như mình nghĩ, nếu ai muốn mặc rộng thì tăng thêm 1 size nhé",4,"""cảm ơn quý khách đã tin tưởng và ủng hộ 20we. hi vọng rằng,bạn đã có những trải nghiệm mua sắm vui vẻ tại shop. chúc bạn một ngày tốt lành !"""
cũng đc,4,"""cảm ơn quý khách đã tin tưởng và ủng hộ 20we. hi vọng rằng,bạn đã có những trải nghiệm mua sắm vui vẻ tại shop. chúc bạn một ngày tốt lành !"""
quần khá đẹp đường may chắc chắn cầu kì,4,"""cảm ơn quý khách đã tin tưởng và ủng hộ 20we. hi vọng rằng,bạn đã có những trải nghiệm mua sắm vui vẻ tại shop. chúc bạn một ngày tốt lành !"""
sản phẩm hoàn thiện rất đẹp không có chỉ thừa lên fom rất đẹp,4,"""cảm ơn quý khách đã tin tưởng và ủng hộ 20we. hi vọng rằng,bạn đã có những trải nghiệm mua sắm vui vẻ tại shop. chúc bạn một ngày tốt lành !"""
vải giày dặn không có chỉ thừa nhưng lưng quần vừa mà ốg hơi bự và dài,4,"""cảm ơn quý khách đã tin tưởng và ủng hộ 20we. hi vọng rằng,bạn đã có những trải nghiệm mua sắm vui vẻ tại shop. chúc bạn một ngày tốt lành !"""
"quần form rất đẹp , nhưng có mùi hơi kì , giao hàng nhanh",4,"""cảm ơn quý khách đã tin tưởng và ủng hộ 20we. hi vọng rằng,bạn đã có những trải nghiệm mua sắm vui vẻ tại shop. chúc bạn một ngày tốt lành !"""
hơi tiếc vì m57 47kg size 27 vẫm rộng,4,"""cảm ơn quý khách đã tin tưởng và ủng hộ 20we. hi vọng rằng,bạn đã có những trải nghiệm mua sắm vui vẻ tại shop. chúc bạn một ngày tốt lành !"""
mua màu sáng sáng mà,4,"""cảm ơn quý khách đã tin tưởng và ủng hộ 20we. hi vọng rằng,bạn đã có những trải nghiệm mua sắm vui vẻ tại shop. chúc bạn một ngày tốt lành !"""
mk đặt một kiểu lại giao kiểu khác,4,"""cảm ơn quý khách đã tin tưởng và ủng hộ 20we. hi vọng rằng,bạn đã có những trải nghiệm mua sắm vui vẻ tại shop. chúc bạn một ngày tốt lành !"""
quần chẳng khác nào màu trắng luôn mn ạ chất đẹp vải dày dặn nhưng nói đúng ra thì nò là màu trắng. hơi thất vọng 🙁,4,nan
đánh giá mang tính chất lấy xu,4,nan
v,4,nan
"hàng tốt chất lượng, nhưng mà shiper ko điện cuộc mà mà để khách hàng không bắt máy, tận 3 ngày sau mới giao lại",4,nan
quần oki nhưng k như mong muốn lắm đóng gói cân thận,4,nan
quần đẹp như trong ảnh có điều giao hàng hơi lâu nên đánh giá 4 nhé còn lại ok,4,nan
khoá kéo hơi chán tí quần khá đẹp.nói chung tiền nào của đấy,4,nan
chất lượng hơn với giá tiền mà màu xanh nhạt hơi già 😢,4,nan
hàng tốt,4,nan
"mình cao m62, 50kg đặt size 26 mà to với dài quá trời 😿",4,nan
quần đẹp nhưng nhiều chỉ thừa,4,nan
"quần bị rách lỗ nhỏ nên mình không thể để 5* được, tuy nhiên giao hàng rất nhanh shop tư vấn cũng rất nhiệt tình",4,nan
quần cùng size 37 màu xanh mình mặc vừa nhưng màu đen lại chật. còn lại ok hết,4,nan
"chất lượng tốt,mặc vừa lên form đẹp,cúc quần còn lõng lẽo",4,nan
"quần nhăn nheo, chất liệu vải mỏng không giống như hình",4,nan
cỡ tư vấn hơi nhỏ so với thực tế nhưng đổi hàng và trả lời vấn đề về hàng hoá nhanh và chu đáo nhưng vẫn trừ 1 sao nhá shop,4,nan
"chất ok, màu chưa giống lắm. nói chung ok, nhưng mùi khó chịu vl",4,nan
quần khá đẹp nhma mặt đc 1 lần là bị đổ lông ròi mng cân nhắc nha nhma với giá này thì phải chịu ròi,4,nan
"mặc vào thoải mái, giao hoàng nhanh, chất liệu sản phẩm tốt,… nói chung tuyệt vời :)",4,nan
đặt xanh sky mà màu giống xanh nhạt hơn,4,nan
hơi lắm chỉ thừa,4,nan
bt,4,nan
"form của quần thì mình rất ưng bảng size cũng chuẩn tuy nhiên quần có mùi rất khó chịu, giặt rồi mà vẫn k hết, ngoài ra khi mặc quần mình cảm thấy mặt bên trong nó kiểu bị lợn cợn cọ xát vào da nên thấy hơi ngứa ngáy. chắc quần này có cố thì mặc đc mùa đông, chứ còn mua hè mặc nóng chết k chịu nổi!",4,nan
huhu lỡ đặt sz to quá . h khá ổn . chờ hàng đến tay mất cả tháng nhưng vì dịch nên thoi ạ,4,nan
quần đẹp vừa vặn vs em gói hàng cẩn thận nhưng lấy ra tỳ quần hơi bụi vs có cái j bám nơi ý nhưng em vẫn hài lòng,4,nan
quần mặc tuy vừa nhưng cạp lại bị ngắn mặc thấy khó chịu,4,nan
chất vải tốt đấy nhưng hàng kh giống mẫu ống dưới nhỏ quá :( nhưng thôi với giá tiền đó thì cũng tạm đc,4,nan
quần khá ổn giống mô tả mỗi tội hơi hôi lên trừ 1 sao,4,nan
chất lượng sp thì cũng ok giá tốt,4,nan
hơi dài,4,nan
"hàng tuy tốt, giao nhanh nhưng sai màu 🙂",4,nan
"mùi thuốc nhuộm quá nồng, phải gọi là hắc luôn ý :(",4,nan
cũng tạm,4,nan
"thời gian cbi hàng khá là lâu, size 34 mà như 32 chật bụng !",4,nan
"quần đẹp , hàng giao nhanh nhưng chỉ may chưa chắc chắn",4,nan
quần đẹp . nhưng giao nhầm màu. lấy xanh nhạt lại giao xanh đậm,4,nan
quần khá là đẹp nhưng mình mặc kh hợp lắm,4,nan
quần rất là okela mình cao 1m69 50kg mặc size 27 vừa như in lun bạn nào mà mún rộng chút nữa thì đặt size 28 là đẹp lun,4,nan
quần đẹp eo hơi nhỏ nha eo mình 83 mua size 29 hơi đau bụng mn lựa chọn kĩ thời gian giao hàng rất lâu đặt 9/9 đến 27/9 mới có hàng 😑,4,nan
"túi hơi nhỏ, chấp nhận được",4,nan
quần có vẻ k dày dặn cho lm nh mặc lên cx rất đẹp,4,nan
quần đẹp hàng chất lượng hơn hình nhưng trong lúc shop chuyển hàng cho shiper hơi lâu lên mình tặng 4 sao nhé,4,nan
tạm được,4,nan
do là quần nam nên bị rộng bụng mn mà 70kg nên lấy 32 thôi,4,nan
hàng giao nhanh trong mùa dịch chất lượng tốt. nhưng mk lấy size theo bảng size mà rộng và dài quá mk cao m56 45kg size 27 :'c,4,nan
mình m62 mặc size 27 quần vẫn chạm đất một vài cm nhé vải quần tốt. bạn nào thích rộng hẳn thì ok nhé,4,nan
còn rất nhiều chỉ thừa,4,nan
size 27 mà dài vch😶,4,nan
"chất lượng vải ok. tội giao hàng quá lâu và nhà vận chuyển thì ngâm hàng không giao, khuyên thật shope đừng phát triển kênh giao hàng của mình",4,nan
đẹp nhưng ko vừa với mình :( shop nhiệt tình lém,4,nan
hàng màu k giống mô tả cho lắm,4,nan
"quần màu khá đẹp, chất vải cũng ổn nhưng quần của tui bị lỗi ống cao ống thấp khoảng 1-2 phân, nên tui ko hài lòng về phần này, còn với giá này thì khá hợp lý rồi cx ko đòi hỏi gì thêm, nếu shop có thể cho mình đổi hàng đc ko ạ,",4,nan
hàng hơi nhiều chỉ thừa,4,nan
xanh biển hơi nhà quê chứ không phải xanh sky nha! còn lại thì ok.,4,20we trân trọng cảm ơn ý kiến đóng góp của quý khách hàng. mong được phục vụ quý bạn những lần tiếp theo để dịch vụ được tốt hơn.
god,4,nan
màu không giống như trong ảnh hơi thất vong,4,nan
giao hàng nhanh nhưng quần khá rộng và sp cs nhiều chỉ thừa,4,nan
vải hơi mỏng nhưng mà với giá tiền thì ok mn ạ,4,nan
không giống vs màu trong ảnh của shop lắm,4,nan
quần không giống trong hình mấy toàn mùi thuốc tẩy với nồng lắm hơi rộng bụng 😞,4,nan
"chất vải tốt, không có chỉ thừa. mỗi tội hơi dài, không giống trên hình",4,nan
quần cũng được cơ mà hơi mùi bột giặt,4,nan
đẹp chất lượng oke màu sáng sủa ít chỉ thừa size 28 mà đùi to quá nhất là shop mõm kêu được ktr hàng mà ship không cho ktr,4,nan
review như tiktok :) quần khá tốt còn nhiều chỉ thừa túi xâu nhưng đáy quần chỉ khá cùi,4,nan
khá đẹp nhưng màu không chuẩn lắm vì hơi đậm ý kiến riêng,4,nan
quần đẹp nên mua nha <3,4,nan
"cũng dc, có một chỗ bị sứt chỉ",4,nan
quần thì đẹp nhưng chắc shop đông người mua quá lên giao hàng hơi lâu,4,nan
hàng giao rất nhanh nhưng vẫn còn một số chỗ có chỉ thừa quần hơi màu bạc bạc đi,4,nan
chất lg vải khá ổn mặc thoải mái đúng size giao hàng cực kì nhanh nhưng mà màu hơi đậm hơn trong hình,4,"20we xin cảm ơn quý khách hàng đã lựa chọn dịch vụ của 20we. 20we đã inbox rồi đó, quý khách hãy check ib để cùng trò chuyện với 20we nha !"
giặt 1 lần tuột gấu  nói chung là tạm ổn ,4,nan
"hàng giống mẫu, nhưng buồn là mình đặt size 33 lại giao size 32 nên mặc hơi khó chịu tí :(",4,nan
quần màu không sáng như trong hình cho lắm nhưng mặc ok vải tốt hợp với giá tiền lần sau sẽ ủng hộ shop tiếp,4,nan
cũng oke nhưng em cao m65 nặng 48kg mặc size 27 hơi rộng,4,nan
"sản phẩm khá ok, chất vải hơi nóng 1 chút nhưng phù hợp giá tiền ncl ok 60",4,nan
giao hàng quá nhanh,4,nan
màu quần hơi nhạt,4,nan
màu của vãi ko như trên ảnh chất vải tạm đc đc cái ship nhanh 👌,4,nan
không tồi,4,nan
"tư vấn khách rất tốt mình rất thíc hàng chất lượng,giao nhanh",4,nan
hàng đẹp chất lượng giao hàng nhanh tận tình,4,"""cảm ơn quý khách đã tin tưởng và ủng hộ 20we. hi vọng rằng,bạn đã có những trải nghiệm mua sắm vui vẻ tại shop. chúc bạn một ngày tốt lành !"""
"đẹp,nhưng hơi rộng và dài",4,nan
.,4,nan
"form quần khá rộng nha, vải ok chỉ hơi có mùi",4,"""cảm ơn quý khách đã tin tưởng và ủng hộ 20we. hi vọng rằng,bạn đã có những trải nghiệm mua sắm vui vẻ tại shop. chúc bạn một ngày tốt lành !"""
hàng giao nhanh,4,nan
quần mua size 27 nhưng hơi rộng shop ạ,4,"""cảm ơn quý khách đã tin tưởng và ủng hộ 20we. hi vọng rằng,bạn đã có những trải nghiệm mua sắm vui vẻ tại shop. chúc bạn một ngày tốt lành !"""
quần nhạt hơn nhiều so với ảnh 😢,4,"""cảm ơn quý khách đã tin tưởng và ủng hộ 20we. hi vọng rằng,bạn đã có những trải nghiệm mua sắm vui vẻ tại shop. chúc bạn một ngày tốt lành !"""
"quần đẹp,nhưng bị lỗi túi quần",4,"""cảm ơn quý khách đã tin tưởng và ủng hộ 20we. hi vọng rằng,bạn đã có những trải nghiệm mua sắm vui vẻ tại shop. chúc bạn một ngày tốt lành !"""
quần hơi mỏng nên 4sao nhé,4,"""cảm ơn quý khách đã tin tưởng và ủng hộ 20we. hi vọng rằng,bạn đã có những trải nghiệm mua sắm vui vẻ tại shop. chúc bạn một ngày tốt lành !"""
đẹp nhưng quá to,4,"""cảm ơn quý khách đã tin tưởng và ủng hộ 20we. hi vọng rằng,bạn đã có những trải nghiệm mua sắm vui vẻ tại shop. chúc bạn một ngày tốt lành !"""
màu quần hơi xấu,4,"""cảm ơn quý khách đã tin tưởng và ủng hộ 20we. hi vọng rằng,bạn đã có những trải nghiệm mua sắm vui vẻ tại shop. chúc bạn một ngày tốt lành !"""
size 30 mà hơi ngắn,4,"""cảm ơn quý khách đã tin tưởng và ủng hộ 20we. hi vọng rằng,bạn đã có những trải nghiệm mua sắm vui vẻ tại shop. chúc bạn một ngày tốt lành !"""
ống nhìn ko to lắm,4,"""cảm ơn quý khách đã tin tưởng và ủng hộ 20we. hi vọng rằng,bạn đã có những trải nghiệm mua sắm vui vẻ tại shop. chúc bạn một ngày tốt lành !"""
khá ổn với tầm giá,4,"""cảm ơn quý khách đã tin tưởng và ủng hộ 20we. hi vọng rằng,bạn đã có những trải nghiệm mua sắm vui vẻ tại shop. chúc bạn một ngày tốt lành !"""
quần đẹp lắm ae,4,"""cảm ơn quý khách đã tin tưởng và ủng hộ 20we. hi vọng rằng,bạn đã có những trải nghiệm mua sắm vui vẻ tại shop. chúc bạn một ngày tốt lành !"""
màu ko nổi lắm,4,"""cảm ơn quý khách đã tin tưởng và ủng hộ 20we. hi vọng rằng,bạn đã có những trải nghiệm mua sắm vui vẻ tại shop. chúc bạn một ngày tốt lành !"""
màu cũ quá,4,"""cảm ơn quý khách đã tin tưởng và ủng hộ 20we. hi vọng rằng,bạn đã có những trải nghiệm mua sắm vui vẻ tại shop. chúc bạn một ngày tốt lành !"""
cx ổn,4,"""cảm ơn quý khách đã tin tưởng và ủng hộ 20we. hi vọng rằng,bạn đã có những trải nghiệm mua sắm vui vẻ tại shop. chúc bạn một ngày tốt lành !"""
oki,4,"""cảm ơn quý khách đã tin tưởng và ủng hộ 20we. hi vọng rằng,bạn đã có những trải nghiệm mua sắm vui vẻ tại shop. chúc bạn một ngày tốt lành !"""
ok,4,"""cảm ơn quý khách đã tin tưởng và ủng hộ 20we. hi vọng rằng,bạn đã có những trải nghiệm mua sắm vui vẻ tại shop. chúc bạn một ngày tốt lành !"""
"vãi mỏng, có chỉ thừa.",4,"""cảm ơn quý khách đã tin tưởng và ủng hộ 20we. hi vọng rằng,bạn đã có những trải nghiệm mua sắm vui vẻ tại shop. chúc bạn một ngày tốt lành !"""
mua cùng size mà nhỏ và ngắn hơn loại màu xanh,4,nan
"mình là người vn, nếu chọn 5☆ thì là trung quốc",4,nan
giao hàng quá chậm thời gian nhận đc hàng chậm vl,4,nan
giao sai màu,4,"""cảm ơn quý khách đã tin tưởng và ủng hộ 20we. hi vọng rằng,bạn đã có những trải nghiệm mua sắm vui vẻ tại shop. chúc bạn một ngày tốt lành !"""
vãi ok nhưng có 1 chút lỗi nên 4 sao thôi ạ,4,"""cảm ơn quý khách đã tin tưởng và ủng hộ 20we. hi vọng rằng,bạn đã có những trải nghiệm mua sắm vui vẻ tại shop. chúc bạn một ngày tốt lành !"""
giao hàng chậm trừ 1 sao,4,"""cảm ơn quý khách đã tin tưởng và ủng hộ 20we. hi vọng rằng,bạn đã có những trải nghiệm mua sắm vui vẻ tại shop. chúc bạn một ngày tốt lành !"""
sản phẩm đẹp mà có điều giao hơi lâu thank shop,4,"""cảm ơn quý khách đã tin tưởng và ủng hộ 20we. hi vọng rằng,bạn đã có những trải nghiệm mua sắm vui vẻ tại shop. chúc bạn một ngày tốt lành !"""
quần đẹp như giao hàng lâu,4,"""cảm ơn quý khách đã tin tưởng và ủng hộ 20we. hi vọng rằng,bạn đã có những trải nghiệm mua sắm vui vẻ tại shop. chúc bạn một ngày tốt lành !"""
ko đúg màu,4,"""cảm ơn quý khách đã tin tưởng và ủng hộ 20we. hi vọng rằng,bạn đã có những trải nghiệm mua sắm vui vẻ tại shop. chúc bạn một ngày tốt lành !"""
quần đẹp nhg giao hàng hơi lâu,4,"""cảm ơn quý khách đã tin tưởng và ủng hộ 20we. hi vọng rằng,bạn đã có những trải nghiệm mua sắm vui vẻ tại shop. chúc bạn một ngày tốt lành !"""
hơi rộng tí nhưng cg đẹp,4,"""cảm ơn quý khách đã tin tưởng và ủng hộ 20we. hi vọng rằng,bạn đã có những trải nghiệm mua sắm vui vẻ tại shop. chúc bạn một ngày tốt lành !"""
god,4,"""cảm ơn quý khách đã tin tưởng và ủng hộ 20we. hi vọng rằng,bạn đã có những trải nghiệm mua sắm vui vẻ tại shop. chúc bạn một ngày tốt lành !"""
đặt màu xanh sky mà shop giao màu nhạt hơn :),4,"""cảm ơn quý khách đã tin tưởng và ủng hộ 20we. hi vọng rằng,bạn đã có những trải nghiệm mua sắm vui vẻ tại shop. chúc bạn một ngày tốt lành !"""
ko đúng màu xanh mình thích,4,"""cảm ơn quý khách đã tin tưởng và ủng hộ 20we. hi vọng rằng,bạn đã có những trải nghiệm mua sắm vui vẻ tại shop. chúc bạn một ngày tốt lành !"""
quần rộng fom ko đc đẹp,4,"""cảm ơn quý khách đã tin tưởng và ủng hộ 20we. hi vọng rằng,bạn đã có những trải nghiệm mua sắm vui vẻ tại shop. chúc bạn một ngày tốt lành !"""
eo rông wa,4,"""cảm ơn quý khách đã tin tưởng và ủng hộ 20we. hi vọng rằng,bạn đã có những trải nghiệm mua sắm vui vẻ tại shop. chúc bạn một ngày tốt lành !"""
đẹp mà giao lâu quá ạ,4,"""cảm ơn quý khách đã tin tưởng và ủng hộ 20we. hi vọng rằng,bạn đã có những trải nghiệm mua sắm vui vẻ tại shop. chúc bạn một ngày tốt lành !"""
mua 2 lần mà lần 2 quần khác nhau là sao hả shop,4,"""20we.oficial cảm ơn bạn đã tin tưởng và sử dụng sản phẩm của shop. hi vọng rằng, shop sẽ có cơ hội được phục vụ bạn trong thời gian tới ạ . chúc bạn một ngày tốt lành và đừng quên ấn theo dõi 20we để không bỏ lỡ những ưu đãi hấp dẫn nhé ạ ."""
hàng chất luợng bth,4,"""cảm ơn quý khách đã tin tưởng và ủng hộ 20we. hi vọng rằng,bạn đã có những trải nghiệm mua sắm vui vẻ tại shop. chúc bạn một ngày tốt lành !"""
quần hơi mỏng,4,"""cảm ơn quý khách đã tin tưởng và ủng hộ 20we. hi vọng rằng,bạn đã có những trải nghiệm mua sắm vui vẻ tại shop. chúc bạn một ngày tốt lành !"""
quần đẹp chất lượng nhưng giao hơi lâu😄,4,"""cảm ơn quý khách đã tin tưởng và ủng hộ 20we. hi vọng rằng,bạn đã có những trải nghiệm mua sắm vui vẻ tại shop. chúc bạn một ngày tốt lành !"""
chất vải đẹp mỗi tội giao hàng hơi lâu,4,"""cảm ơn quý khách đã tin tưởng và ủng hộ 20we. hi vọng rằng,bạn đã có những trải nghiệm mua sắm vui vẻ tại shop. chúc bạn một ngày tốt lành !"""
bên vận chuyển làm việc quá tệ,4,nan
nhiều chỉ thừa quá,4,"""cảm ơn quý khách đã tin tưởng và ủng hộ 20we. hi vọng rằng,bạn đã có những trải nghiệm mua sắm vui vẻ tại shop. chúc bạn một ngày tốt lành !"""
ok,4,"""cảm ơn quý khách đã tin tưởng và ủng hộ 20we. hi vọng rằng,bạn đã có những trải nghiệm mua sắm vui vẻ tại shop. chúc bạn một ngày tốt lành !"""
giao lộn quần màu sky mà lấy màu xanh nhạt,4,"""cảm ơn quý khách đã tin tưởng và ủng hộ 20we. hi vọng rằng,bạn đã có những trải nghiệm mua sắm vui vẻ tại shop. chúc bạn một ngày tốt lành !"""
đẹp tốt nhưng giao hàng lâu quá gần 2 tuần,4,"""cảm ơn quý khách đã tin tưởng và ủng hộ 20we. hi vọng rằng,bạn đã có những trải nghiệm mua sắm vui vẻ tại shop. chúc bạn một ngày tốt lành !"""
màu khác à,4,"""cảm ơn quý khách đã tin tưởng và ủng hộ 20we. hi vọng rằng,bạn đã có những trải nghiệm mua sắm vui vẻ tại shop. chúc bạn một ngày tốt lành !"""
non,4,"""cảm ơn quý khách đã tin tưởng và ủng hộ 20we. hi vọng rằng,bạn đã có những trải nghiệm mua sắm vui vẻ tại shop. chúc bạn một ngày tốt lành !"""
khác hình nhưng cũng được,4,"""cảm ơn quý khách đã tin tưởng và ủng hộ 20we. hi vọng rằng,bạn đã có những trải nghiệm mua sắm vui vẻ tại shop. chúc bạn một ngày tốt lành !"""
mua hộ k biếc,4,"""cảm ơn quý khách đã tin tưởng và ủng hộ 20we. hi vọng rằng,bạn đã có những trải nghiệm mua sắm vui vẻ tại shop. chúc bạn một ngày tốt lành !"""
cũng được nha shop,4,"""cảm ơn quý khách đã tin tưởng và ủng hộ 20we. hi vọng rằng,bạn đã có những trải nghiệm mua sắm vui vẻ tại shop. chúc bạn một ngày tốt lành !"""
hàng khá ổn,4,"""cảm ơn quý khách đã tin tưởng và ủng hộ 20we. hi vọng rằng,bạn đã có những trải nghiệm mua sắm vui vẻ tại shop. chúc bạn một ngày tốt lành !"""
lên mua,4,"""cảm ơn quý khách đã tin tưởng và ủng hộ 20we. hi vọng rằng,bạn đã có những trải nghiệm mua sắm vui vẻ tại shop. chúc bạn một ngày tốt lành !"""
"chật quá , ngon nhưng hơi chật",4,"""cảm ơn quý khách đã tin tưởng và ủng hộ 20we. hi vọng rằng,bạn đã có những trải nghiệm mua sắm vui vẻ tại shop. chúc bạn một ngày tốt lành !"""
